gtfo get fuck stfu shut fuck mkmkomfgsfd miss keisha miss keisha oh fuckin god fuckin dead,0
dead m dead supposed live nine month without two outlanderfinale,0
not speak children died middle east dead children yo,0
m lazy actor audition roles dead people,0
katrina kaif looks drop dead gorgeous lux golden rose awards,0
tbh m mess seem happy inside m dead breathe smoke exhale maybe just temporary,0
cali thewalkingdead making list daryl everyone whose dead didn't follow plan,0
m liberal agree sean hannity u s journalism dead couldn't un see bias welcome corrup,0
suicide pact class eight girls jump off building tamil nadu one survives,0
m dead duuuuvvvvaaalllll,0
fun games till dead ass stop fucking,0
walking dead giving fucking heart attack right now man cannot take,0
niyyy ain't gotta die dead,0
lincoln dead year amendment passed congress knows ha,0
dead,0
fun games till dead ass stop fucking,0
fun games till dead ass stop fucking,0
cali thewalkingdead making list daryl everyone whose dead didn't follow plan,0
fun games till dead ass stop fucking,0
cali thewalkingdead making list daryl everyone whose dead didn't follow plan,0
cali thewalkingdead making list daryl everyone whose dead didn't follow plan,0
michonne judith ll back ll bring daddy gonna bring shane back dead thewa,0
m done u swear god will last text send ur dead wym,0
someone already exposed family confederate flags ig m dead,0
friends check big walking dead program tonight monumental one lots folks worked hard,0
fun games till dead ass stop fucking,0
footage provided abc appears show papua new guinea locals possibly drunk coming new accommodation thr,0
man killed suspected machete attack suburban street,0
know downside sara lance legends laurel lance dead no alex kingston mother,0
walking dead crazy tonight,0
morgue worker sex dead body got pregnant porn,0
walking dead eu te amo porra,0
find mutuals rt like teen wolf pretty little liars vampire diaries theoriginals reign agents shi,0
cali thewalkingdead making list daryl everyone whose dead didn't follow plan,0
believed dead,0
morgue worker sex dead body got pregnant porn,0
cali thewalkingdead making list daryl everyone whose dead didn't follow plan,0
walking dead stressing,0
im rooting teamrick kick saviors ass let negan see dead,0
wisdom tom stoppard's play rosencrantz amp guildenstern dead,0
cali thewalkingdead making list daryl everyone whose dead didn't follow plan,0
cali thewalkingdead making list daryl everyone whose dead didn't follow plan,0
really fifa dead fish celebration,0
school shooting thursday left two students dead missed entirely incidents used,0
eh vontade de ver walking dead mesmo,0
icymi negan assaulted alexandria thewalkingdead comics,0
really fifa dead fish celebration,0
re dead meat locals threaten manus island asylum seekers via,0
m dead,0
muddy lullabies way droppin dead men,0
walking dead fandom right now,0
fun games till dead ass stop fucking,0
breaking least dead small plane crashes near miami executive airport,0
niyyy ain't gotta die dead,0
mean think going happen can't declare war people go home watch netflix,0
fun games till dead ass stop fucking,0
love waking dead sleep bc nicole's sims either fucking laughing,0
cali thewalkingdead making list daryl everyone whose dead didn't follow plan,0
open borders tried empirical fact terrorism increases many dead babies worth can,0
edddyt shit got dead asf,0
fun games till dead ass stop fucking,0
y still watch walking dead,0
clothes tropical rain forest peach blossoms beside olivedrab sugar always depressed hot dead hot fa,0
whew ok lets fuckin go first one popular demand akio ichikawa dead depressed best disas,0
jesus dead along billions ppl death cult known christianity murdered ruined lives,0
cali thewalkingdead making list daryl everyone whose dead didn't follow plan,0
cali thewalkingdead making list daryl everyone whose dead didn't follow plan,0
fun games till dead ass stop fucking,0
something ve learned past three years don't water dead plant relationships people,0
stares fucking xmas tree good bad ugly theme song plays cut tree cut,0
dead,0
fun games till dead ass stop fucking,0
really fifa dead fish celebration,0
miami drivers like sun shining god forbid ever snows bitch dead,0
school shooter leaves dead hot girl,0
fun games till dead ass stop fucking,0
legs boots outfit ok m dead,0
every dead body not exterminated becomes one gets kills people kills get kill,0
ve just watched episode walking dead lt tvtime,0
m done u swear god will last text send ur dead wym,0
walking dead mid season finale stressing tf,0
will long dead happens not going anywhere soon think d ok brown,0
bitch hope fuck d dead son bitch tell u,0
tonight jewish teenagers hide basement gothenburg synagogue firebombs thrown building,0
zombieapocalypse comedy bookreview drop dead funny wasn't just book,0
fun games till dead ass stop fucking,0
walking dead references freshman twd thewalkingdead,0
really fifa dead fish celebration,0
chris moore fifa dead fish celebration nflcelebrations,0
dead,0
need kingdom dead finite shit thewalkingdead,0
friends dead,0
cali thewalkingdead making list daryl everyone whose dead didn't follow plan,0
dead move,0
couple things reporters not moved told get away quint,0
just make pajamies m dead literally figuratively,0
fuckkkkkkkk nvm dead im pissed,0
call bs episode walking dead no way tables turned quick walkingdead thewalkingdead,0
iconic lyric m better ever man talks shit owe nothing th,0
fun games till dead ass stop fucking,0
cali thewalkingdead making list daryl everyone whose dead didn't follow plan,0
coroner ids woman found dead bay sunnyvale via,0
cali thewalkingdead making list daryl everyone whose dead didn't follow plan,0
tesla rather dead one,0
fun games till dead ass stop fucking,0
dead,0
late pornstar august ames shared struggles depression ostracization family rap,0
n preparada pro novo ep de walking dead,0
fun games till dead ass stop fucking,0
shoulda dead since like seasons ah,0
want goth gf r u sure ready one r u sure r u rly sure goth gf going target standing,0
twitter name m dead asf,0
mouth hell must crammed choking struggle's dead let us cram swiftly put end endeavour,0
pull pants shot till dead police supposed protect us not put us,0
fun games till dead ass stop fucking,0
beatsbynav m problem can fix type silent treatment shit dead grow learn commun,0
cali thewalkingdead making list daryl everyone whose dead didn't follow plan,0
really fifa dead fish celebration,0
report see many dead people vote many unregistered illegals vote dems get,0
fun games till dead ass stop fucking,0
cali thewalkingdead making list daryl everyone whose dead didn't follow plan,0
come back dead,0
fun games till dead ass stop fucking,0
walking dead references freshman twd thewalkingdead,0
don't care mccarron starts not want go get high pick new coach get wit,0
m dead,0
watching walking dead,0
go watching walking dead twd thewalkingdead tv amc,0
rip ucsb students ain't dead just gotta study finals break,0
dom zelda couple even game lil dead river stalking tyson whats new,0
irby im fuckin dead dude noooo,0
don't act like ain't get leveled halloween decorations dead door,0
can someone pls link walking dead tonight help,0
m sorry report walking dead jumped shark episodes back wasteoftime,0
fun games till dead ass stop fucking,0
dead homie one stfu dig amp ask,0
g herbo friends dead,0
dead ass not boyfriend took almost year realize giving nigga disappear,0
dead,0
gtfo get fuck stfu shut fuck mkmkomfgsfd miss keisha miss keisha oh fuckin god fuckin dead,0
m writing paper dismantling heroic myth amp masculinity america m watching walking dea,0
anthony walking dead best show idgaf don't,0
hate sleep wrong wake dead shoulder broken jaw like possibly fuck ha,0
cali thewalkingdead making list daryl everyone whose dead didn't follow plan,0
fun games till dead ass stop fucking,0
madison beer dead lyric video via,0
will cry episode walking dead likely,0
walking dead got like,0
dick nacos love lmfaooo dead,0
sparks fictional situation gives anxiety thewalkingdead,0
two can keep secret one dead,0
fun games till dead ass stop fucking,0
thewalkingdead mid season finale airs two hours watch exclusive scene hold,0
fun games till dead ass stop fucking,0
open borders tried empirical fact terrorism increases many dead babies worth can,0
lmao frfr thats madr new ts dead,0
dead,0
english dead londinium defeated stirling,0
open borders tried empirical fact terrorism increases many dead babies worth can,0
cali thewalkingdead making list daryl everyone whose dead didn't follow plan,0
open borders tried empirical fact terrorism increases many dead babies worth can,0
fun games till dead ass stop fucking,0
cali thewalkingdead making list daryl everyone whose dead didn't follow plan,0
probably doesn't realize dead,0
vem walking dead,0
just make pajamies m dead literally figuratively,0
dead,0
don't hit see flourishing especially left dead trying figure word,0
can't fix already dead,0
attention please will make publicly available audio video don's may interview,0
back bullshit come walking dead,0
heed not words ye lass kin heed not things said now ye lay amongst roses slumber,0
walking dead references freshman twd thewalkingdead,0
dead,0
aaron hernandez's brain shows no one play football ever,0
really fifa dead fish celebration,0
bruh continually get asses whooped walking dead annoying,0
dead ass will ruin life don't fucking try hoe m devil,0
alguem assiste walking dead em,0
rip everyone walking dead,0
really fifa dead fish celebration,0
pleading life trying comply shot dead anyway enough,0
cali thewalkingdead making list daryl everyone whose dead didn't follow plan,0
pleading life trying comply shot dead anyway enough,0
fun games till dead ass stop fucking,0
niyyy ain't gotta die dead,0
episode better end neegan dead m done thewalkingdead,0
walking dead playing emotions fuck mafuckas get expected couple,0
whole season walking dead avoided killed megan first episode n,0
friends dead,0
cnn's credibility dead don't let distract fact undertaker threw mankind off hel,0
fun games till dead ass stop fucking,0
dead,0
since dead can take off head recite shakespearean quotations jack skellington bookmarks,0
eighteen year old lady drop dead gorgeous morxonemusicfanfestatek,0
cant even call cops report astro heart stopping attacks today bc police officers im,0
yixing wants dead,0
fun games till dead ass stop fucking,0
m incredulous understand existing fake outrage toward russia fakestreammedia msm fsm,0
g herbo friends dead,0
back dead unpopular demand oc rebooted descriptive h p,0
really hate least right now may make later want dead rn,0
dinner anderson tonight place dead totally forgot anderson dry sundays,0
sales people motivated producing top producers dead weight non productive costing money valuab,0
fun games till dead ass stop fucking,0
cali thewalkingdead making list daryl everyone whose dead didn't follow plan,0
great barrier reef will dead says david attenborough's blue planet ii via,0
really fifa dead fish celebration,0
cali thewalkingdead making list daryl everyone whose dead didn't follow plan,0
definitely dead,0
cali thewalkingdead making list daryl everyone whose dead didn't follow plan,0
walking dead rn m shook thewalkingdead,0
dad said dictator dead right,0
can't stop won't stop kurlzz make booty drop can't stop won't stop funny make booty drop can't stop won't s,0
cali thewalkingdead making list daryl everyone whose dead didn't follow plan,0
cali thewalkingdead making list daryl everyone whose dead didn't follow plan,0
really fifa dead fish celebration,0
cali thewalkingdead making list daryl everyone whose dead didn't follow plan,0
pathetic,0
love day much leather jacket polka dot shirt want dead bad,0
cali thewalkingdead making list daryl everyone whose dead didn't follow plan,0
evolution banker outlook bitcoin bitcoin joke bitcoin dead blockchains not bi,0
study buddy said yeah buying food also ride several different ways m dead y,0
getting dressed dead winter no easy need stay warm look cool yet offer cool winte,0
drive hours go back dc find dead grandma's glove misplaced dropped somewhere ev,0
still gonna walking dead return h k,0
like sal clare going get matching tattoos month dead cute planner thing,0
stop comparing dead rappers alive rappers period fucking disrespectful,0
really fifa dead fish celebration,0
two things everyone slept year chargers ain't dead bitches protein mvp bolts,0
cali thewalkingdead making list daryl everyone whose dead didn't follow plan,0
niyyy ain't no sucka ass bitch m wrong ll apologize make right can m definitely not gon,0
cali thewalkingdead making list daryl everyone whose dead didn't follow plan,0
reedus punisher walking dead crossover lol,0
dead ass yo flip flops n,0
alleged incident happened buffalo d talk ass much,0
kiss m dead dominic piper new unique take classic noir detective story,0
god can make dry bones live can revive even dead consumerist back glory praise,0
peacock katydid resembles dead leaf wings closed eye spots vivid colors displayed whe,0
dead,0
journey world undead quantum heights thelivingdead underworldbloodwars,0
new walking dead game works overkill view thewalkingdead,0
michonne judith ll back ll bring daddy gonna bring shane back dead thewa,0
dec still dead,0
morgue worker sex dead body got pregnant porn,0
keep killing off favorite characters talking dead thewalkingdead walkingdead twd,0
cali thewalkingdead making list daryl everyone whose dead didn't follow plan,0
zelda zonk guys imagine possibilities vine kyle step fuck can raven swim jared ever learn read,0
maybe life doesn't end re dead gotta settle happy moments instead happy endings,0
morgue worker sex dead body got pregnant porn,0
michonne judith ll back ll bring daddy gonna bring shane back dead thewa,0
aaron enid better convince cyndie get feelings dead grandma side fast can thewalkingdead,0
cali thewalkingdead making list daryl everyone whose dead didn't follow plan,0
dead,0
hunterdixon re womb mid season finale walking dead thewalkingdead,0
walking dead episode anxiety high cmon save kingdom ass hats trusttheking,0
gtfo get fuck stfu shut fuck mkmkomfgsfd miss keisha miss keisha oh fuckin god fuckin dead,0
honestly don't know can watch walking dead anymore take l's every episode,0
y dead wrong,0
m watching walking dead gotta twd trakt,0
army,0
assistir aquele walking dead suuuussegadin,0
reason ms keisha dead,0
michonne judith ll back ll bring daddy gonna bring shane back dead thewa,0
girl dead ass,0
one kids m babysitting just yelled free shavacado m dead,0
no like dead karma real,0
dead asleep song comes,0
today lost groundbreaking journalist civil rights icon true american hero simeon booker devoted life s,0
hannibal burress arrested one cops said difficult cracking jokes hanni,0
cut off act like dead amp killing,0
niyyy ain't gotta die dead,0
find kid got clocked face rather read school just got shot dead,0
want goth gf r u sure ready one r u sure r u rly sure goth gf going target standing,0
cali thewalkingdead making list daryl everyone whose dead didn't follow plan,0
m really dead lmaoo,0
really fifa dead fish celebration,0
dead,0
going crawl skin watching walking dead twdmidseasonfinale talkingdead,0
like night living dead mariah keeps coming back marriedtomedicine,0
cali thewalkingdead making list daryl everyone whose dead didn't follow plan,0
loooooooooooool im dead,0
millander thought dead told d never leave soulmates outlanderfinale starz https,0
mean think going happen can't declare war people go home watch netflix un,0
cali thewalkingdead making list daryl everyone whose dead didn't follow plan,0
dead,0
round not sure better catch keenan made flea flicker playing dead one yard line w,0
dead,0
pop punk not dead,0
someone tell song looking since saw sc ages ago dead,0
open borders tried empirical fact terrorism increases many dead babies worth can,0
watching walking dead amp just get lammmeeeess,0
thrice taste buds humans capable controlling brain chemistry imitate anima,0
im dead,0
gtfo get fuck stfu shut fuck mkmkomfgsfd miss keisha miss keisha oh fuckin god fuckin dead,0
oh dead,0
holy crap walking dead just got real can't breathe can't watch heart pounding chest,0
really fifa dead fish celebration,0
im dead,0
walking dead episode absolutely incredible far,0
really fifa dead fish celebration,0
m dead college got us fucked,0
friends check big walking dead program tonight monumental one lots folks worked hard,0
cali thewalkingdead making list daryl everyone whose dead didn't follow plan,0
sprinkles bakloosh appreciation post depsite social capabilities dead tv remote fortunate enough,0
dead,0
people think can read basic arithmetic can hold basic conversation believe aren t,0
twd walking dead better not kill someone leave freaking cliffhanger without giving hope,0
m dead,0
im dead,0
ppl still watch walking dead apparently,0
walking dead s negan offers chat anyone bothering keaton jones,0
rev liveth dead behold alive forevermore amen keys hell,0
yep gonna one walking dead episodes facepalm award goes daryl amp tara way suck guys thewalking,0
get damn old certain goofy shit like dead ass,0
gonna get everyone killed lmao swear carl ve dead seasons ago always getting hi,0
playing catch walking dead tonight walking dog took longer planned twd,0
net neutrality net neutrality,0
im talkin bout walking dead bae lol,0
jon snow went wall became lord commander foles murdered men went kc reid ros,0
beyonc found dead ok now got attention text resist save net neutrality,0
dead,0
trying stay calm walking dead season finale amc thewalkingdead twd,0
dead assss though,0
shocking violent antifa protest dead woman's memorial via past time every,0
thegreat end dead,0
rate d will dead feet next drive ravensflock,0
amc last chance unlock new walker twdencounter app scan ad tonight's twd finale,0
cali thewalkingdead making list daryl everyone whose dead didn't follow plan,0
mckenna tiffany pollard queen hbic orchestrated greatest pop,0
dead,0
someone already exposed family confederate flags ig m dead,0
phones dead,0
walking dead already got edge,0
,0
liked video dg dead island tease,0
walking dead best show idgaf don't,0
jassssy faithful really not hard idc anybody says whole re young shit dead asf don't get f,0
gtfo get fuck stfu shut fuck mkmkomfgsfd miss keisha miss keisha oh fuckin god fuckin dead,0
no one killed pareshmesta says karnataka police fell lake died say next,0
negan ve dead like keep bitching m not,0
dead,0
gtfo get fuck stfu shut fuck mkmkomfgsfd miss keisha miss keisha oh fuckin god fuckin dead,0
walking dead killing anxiety rn,0
not bouta chase nobody relationship dead,0
nanii dead homie one stfu dig amp ask,0
madonna found dead malawi,0
dead end dead,0
cali thewalkingdead making list daryl everyone whose dead didn't follow plan,0
tragedy rumor aren't dead lost actually end island somewh,0
open borders tried empirical fact terrorism increases many dead babies worth can,0
gtfo get fuck stfu shut fuck mkmkomfgsfd miss keisha miss keisha oh fuckin god fuckin dead,0
cali thewalkingdead making list daryl everyone whose dead didn't follow plan,0
chris moore fifa dead fish celebration nflcelebrations,0
gtfo get fuck stfu shut fuck mkmkomfgsfd miss keisha miss keisha oh fuckin god fuckin dead,0
really fifa dead fish celebration,0
instead gave list confusing demands told anyone anyone ve en,0
beyonc found dead ok now got attention text resist save net neutrality,0
not repeating shit souls dead,0
ya think m playing m dead ass,0
hey keatonjones just saw video tough time re going not sure re walking dead fan,0
cali thewalkingdead making list daryl everyone whose dead didn't follow plan,0
vine miss keisha no longer dead jared learned read raven can now swim rebecca still won't hesitat,0
acc dead mas vou tentar reviver,0
welp walking dead officially jumped shark hopefully different writers m pi,0
adelee im dead,0
lacey simbaaa robins dead ahh lying neega,0
beyonc found dead ok now got attention text resist save net neutrality,0
watching season stranger things jonathan pullout m dead,0
cali thewalkingdead making list daryl everyone whose dead didn't follow plan,0
timeline dead m going sleep didn't homework idgaf,0
just sad gimple will able kill fear walking dead like killed show fear bette,0
cali thewalkingdead making list daryl everyone whose dead didn't follow plan,0
cali thewalkingdead making list daryl everyone whose dead didn't follow plan,0
chris moore fifa dead fish celebration nflcelebrations,0
amc hope won't say king dead not jerry,0
dead,0
cali thewalkingdead making list daryl everyone whose dead didn't follow plan,0
m dead,0
cali thewalkingdead making list daryl everyone whose dead didn't follow plan,0
agora vou ver walking dead,0
really fifa dead fish celebration,0
cali thewalkingdead making list daryl everyone whose dead didn't follow plan,0
really fifa dead fish celebration,0
niyyy ain't no sucka ass bitch m wrong ll apologize make right can m definitely not gon,0
cali thewalkingdead making list daryl everyone whose dead didn't follow plan,0
dead sea scrolls confirm accuracy popular accurate reliable,0
plants dead push edge,0
cali thewalkingdead making list daryl everyone whose dead didn't follow plan,0
please arent watching walling dead tonight stay twiiter will spoil,0
sometimes wish week walking dead worst thing happened rick forgot put th,0
kiss m dead dominic piper part mystery part int,0
today lost groundbreaking journalist civil rights icon true american hero simeon booker devoted life s,0
cali thewalkingdead making list daryl everyone whose dead didn't follow plan,0
yeah fear walking dead walking dead fan answer important questions,0
actually four years ago dan brown described manila novel inferno gates hell,0
dead inside til yuh,0
m already dead inside,0
late pornstar august ames shared struggles depression ostracization family rap,0
love possibly yes marriage way dead health ll take good health,0
genuine alr bet mf ig im dead,0
dead lmao pls question answered won't even no need argument starting,0
yung lobo im dead brb,0
amc uh fuck happened weren't saviors dead thewalkingdead,0
girl dead new bestfriend every week amp straight talks shit halls will like omg kenz hii love uuu foh,0
cali thewalkingdead making list daryl everyone whose dead didn't follow plan,0
let phone die let music go stuck dead phone no music,0
walking dead references freshman twd thewalkingdead,0
dead homie one stfu dig amp ask,0
michonne judith ll back ll bring daddy gonna bring shane back dead thewa,0
m saying possibly avoided entirely whi,0
wow re going dead guys now no one safe,0
things will drop probably m dead jojo part kingdom hearts stable berserk chapter release schedule robb,0
work dead ass just called cowboy bebop green day boy,0
stop walking dead spoilers,0
niyyy ain't gotta die dead,0
yow mi dead,0
destiny dead since released,0
cnn's credibility dead don't let distract fact undertaker threw mankind off hel,0
niyyy ain't gotta die dead,0
daryl vegeta walking dead now hubris actions made everything infinitely worse thewalkingdead,0
ain't no sucka ass bitch m wrong ll apologize amp make right can m definitely not g,0
gotta watching walking dead twd thewalkingdead tv,0
australian pelican sitting dead tree belvoir park lake wodonga australia stormhour thephotohour,0
want negan drop dead im not exaggerating shitty character no reedeming qualities idgi rlly,0
gtfo get fuck stfu shut fuck mkmkomfgsfd miss keisha miss keisha oh fuckin god fuckin dead,0
giampietrino dead cleopatra,0
just commercials walking dead used really annoying,0
phone dead day not sure can rip snap streaks,0
walking dead benefit shortened seasons way wouldn't week week filler t,0
dead,0
walking dead community's anger daryl right now twd thewalkingdead,0
pleading life trying comply shot dead anyway enough,0
cali thewalkingdead making list daryl everyone whose dead didn't follow plan,0
regime change advocates dead wrong syria,0
tate m off walking dead great night,0
tired stick rick company walking dead now m done deserve lose dumb,0
chris moore fifa dead fish celebration nflcelebrations,0
footage provided abc appears show papua new guinea locals possibly drunk coming new accommodation thr,0
bangladeshis shot dead indian bsf along rajshahi border,0
utah hit national hepatitis outbreak left dead california michigan,0
consider running class none students compelled tell private challenges make,0
dead homie one stfu dig amp ask,0
gtfo get fuck stfu shut fuck mkmkomfgsfd miss keisha miss keisha oh fuckin god fuckin dead,0
pretty rad agreed stay till m dead no one tell m not cool,0
cali thewalkingdead making list daryl everyone whose dead didn't follow plan,0
thewalkingdead mid season finale airs two hours watch exclusive scene hold,0
kailssss m dead capitalizing like used right word,0
gtfo get fuck stfu shut fuck mkmkomfgsfd miss keisha miss keisha oh fuckin god fuckin dead,0
dead,0
pretty much dead already made suffer far gone coda start finish hearts still beating gotta mid s,0
net neutrality net neutrality,0
dead counting,0
xanax not toy exstacy not toy promethazine not toy adderal not toy percocet not toy,0
gtfo get fuck stfu shut fuck mkmkomfgsfd miss keisha miss keisha oh fuckin god fuckin dead,0
yooong awesome betweenus needs appreciated rocks u off ur feet yonghwa composed song fuse rock elements,0
nanii dead homie one stfu dig amp ask,0
