beyonc found dead ok now got attention text resist save net neutrality,0
gimple talking dead ifs no,0
kev finally u admit kirk tanked team every game now showcase can,0
dead,0
estoy viendo walking dead gotta twd trakt,0
town like magnet drawin criminals rest indian oklahoma territory like bits,0
people literally hand scisscor cut off looking life support bitch dead,0
contrary popular belief kpp bypass not dead one strategies used doesn't work anymo,0
damn robin williams actually dead,0
ok guy plays ezekial gonna talking dead die,0
y know walking dead isn't reality show right right,0
niyyy ain't no sucka ass bitch m wrong ll apologize make right can m definitely not gon,0
gtfo get fuck stfu shut fuck mkmkomfgsfd miss keisha miss keisha oh fuckin god fuckin dead,0
wish walking dead still interesting,0
sentence tragedy thought stray nug dead mouse,0
tweedledee tweedledumbass drive truck sanctuary weren't going actually make sur,0
walking dead time tvtime,0
dead,0
one thing blows mind never see anyone walking dead eating worrying water mea,0
twitter not funny bib lame af shit dead,0
apparently tonight's episode walking dead will people talking days preferred season,0
dead fish celebration christian screaming one top fears,0
fun games till dead ass stop fucking,0
walking dead finale tonight thewalkingdead,0
liked video walking dead season alt skins kenny sarita walter,0
dead injured mini bus plunges gorge jammu kashmir news via,0
cali thewalkingdead making list daryl everyone whose dead didn't follow plan,0
reached life goal dead microsoft band connect dead microsoft windows phone control mu,0
justin jung jung new one cheng cheng not dead,0
serenity incident experience epic fantasy darkfantasy bookdiscovery ebook,0
cali thewalkingdead making list daryl everyone whose dead didn't follow plan,0
no matter find tonight's msf know ll okay survive tell,0
really fifa dead fish celebration,0
book week talking dead george noory rosemary ellen guiley paranormal afterlife,0
dead,0
dead,0
rt abbswinston israeli occupiers murdered palestinians gaza friday shooting dead bombing dead ap,0
cali thewalkingdead making list daryl everyone whose dead didn't follow plan,0
honestly im just gonna delete whole app ll dead till notice f x breathe disba d whatever,0
dead,0
dead,0
chris moore fifa dead fish celebration nflcelebrations,0
cali thewalkingdead making list daryl everyone whose dead didn't follow plan,0
self diagnosing webmd finding m already dead,0
band filming music video next single off new album generation dead evilones,0
get damn old certain goofy shit like dead ass,0
really fifa dead fish celebration,0
birdie god damn brain dead huhuhuhuh full screen safe block armor huhuhu,0
m dead post anything embarrassing now,0
officially dead,0
polar bear tweet dead detractors completely miss fact human ca,0
gtfo get fuck stfu shut fuck mkmkomfgsfd miss keisha miss keisha oh fuckin god fuckin dead,0
one person dead shooting east columbus,0
post dead,0
terrified watch episode walking dead,0
michonne judith ll back ll bring daddy gonna bring shane back dead thewa,0
im dead,0
anchorage police reported city's homicide year today means city now matched hom,0
ma bitch really dubbin ma shit back da day like m not one dem guys dead dis bitch now m salty lmao,0
im dead scared get frontal im going anyway now got find somewhere get good one,0
angela twilight actually walking dead now icymi,0
dead gon live forever vol ii photographer waseem noordien persons imaan abrahams justin february amp tk m,0
malcolmson m dead,0
plz silverman disrespected flag right haven't seen silverman burn flag,0
jerry rolling truck funniest thing ve seen walking dead twd,0
didn't realise walking dead casually got twitter waiting store,0
nice world everyone gets rest recover clones g,0
cali thewalkingdead making list daryl everyone whose dead didn't follow plan,0
m liberal agree sean hannity u s journalism dead couldn't un see bias welcome corrup,0
boys see bucket dead mackerel,0
black lightning cold dead hands black lightning back things not hometown cleveland,0
needed take break studying watch walking dead im hella glad negan saviors finally get wreck,0
kirby doesn't want watch walking dead,0
saviors arc not wrap soon negan ends dead can get fucking lives think,0
judith dead guys thewalkingdead,0
isn't done everyday something new clinton yet story goes dead,0
niyyy ain't no sucka ass bitch m wrong ll apologize make right can m definitely not gon,0
kellyguo postponed cancelled ucsb students just gonna experience dead week struggle january take finals agai,0
watchin walking dead amc nitie yaw thewalkingdead andrewlincoln normanreedus,0
woke dead sleep m couldn't go back bed added nelly song playlist,0
know better take quick turn went entire season standing necks w,0
m not threesome period tf niggas really begging girl like noooo cus now m dead bout brea,0
walking dead,0
gtfo get fuck stfu shut fuck mkmkomfgsfd miss keisha miss keisha oh fuckin god fuckin dead,0
negan's people pretty much dead charge eugene hate thewalkingdead,0
lmfaooo spot im dead,0
amc yo dead fucking ass,0
tokido isn't dead yet,0
cnn's credibility dead don't let distract fact undertaker threw mankind off hel,0
breaking missing year old found dead wooded area near area braeburn court bethesda mcp investigating https,0
eighteen year old lady drop dead gorgeous morxonemusicfanfestatek,0
can't beef dead,0
large pores concern try alpha hydroxy acid aha product ahas remove dead skin cells hardened oil plugs,0
chris moore fifa dead fish celebration nflcelebrations,0
cali thewalkingdead making list daryl everyone whose dead didn't follow plan,0
large pores concern try alpha hydroxy acid aha product ahas remove dead skin cells hardened oil plugs,0
walking dead fandom right now,0
tonight jewish teenagers hide basement gothenburg synagogue firebombs thrown building,0
gtfo get fuck stfu shut fuck mkmkomfgsfd miss keisha miss keisha oh fuckin god fuckin dead,0
dead woman walking sharon bolton hot air balloon ride disaster suspense crime,0
need mutual rt stan pierce veil palaye royale sleeping sirens crown empire tonight aliv,0
joy positivity love encouragement importantly fact no summer s,0
mash walking dead lord rings call walking tree's thewalkingdead,0
wslking dead,0
karl found dead ditch,0
dead ll get love bacon wrapped hot dogs,0
ve just watched episode walking dead tvtime,0
gtfo get fuck stfu shut fuck mkmkomfgsfd miss keisha miss keisha oh fuckin god fuckin dead,0
ain't proving nobody anymore man shit dead fuck,0
look like fucking dad dead years,0
gtfo get fuck stfu shut fuck mkmkomfgsfd miss keisha miss keisha oh fuckin god fuckin dead,0
dead ass will ruin life don't fucking try hoe m devil,0
cali thewalkingdead making list daryl everyone whose dead didn't follow plan,0
michonne judith ll back ll bring daddy gonna bring shane back dead thewa,0
just realized dog gave oscar worthy performance grinch stole christmas probably dead il,0
cali thewalkingdead making list daryl everyone whose dead didn't follow plan,0
ver walking dead,0
walking dead way celebrate christmas h o w twdmidseasonfinale,0
gtfo get fuck stfu shut fuck mkmkomfgsfd miss keisha miss keisha oh fuckin god fuckin dead,0
know polls almost dead balls accurate,0
smthn m dead af,0
shocking cessna pacific ocean islamic cult chicago family amp soviet spy ring hve common,0
watching movie d kill kyle door go hit tummy breaks hims ev,0
carlson think brain cells dead,0
open borders tried empirical fact terrorism increases many dead babies worth can,0
idk tf try talk people just try general not one person actually cares like can,0
open borders tried empirical fact terrorism increases many dead babies worth can,0
self explanatory bandwagon ll ic things person reference ll morning,0
cali thewalkingdead making list daryl everyone whose dead didn't follow plan,0
fun games till dead ass stop fucking,0
really fifa dead fish celebration,0
found dead,0
hey keatonjones just saw video tough time re going not sure re walking dead fan,0
liberals dead wrong not pursue electoral reform like conservatives scare,0
legs boots outfit ok m dead,0
cnn's credibility dead don't let distract fact undertaker threw mankind off hel,0
thewalkingdead enjoy last spoonful pudding carl,0
bad parents dead,0
try sing parts m dead,0
claims claims m dead,0
cali thewalkingdead making list daryl everyone whose dead didn't follow plan,0
icymi thewalkingdead comics carlgrimes die books,0
hahaha sky just hit bus sky dead im crying,0
no molestar walking dead,0
crazyfact eating tacos day healthy dead themoreyouknow,0
mahmoud al masri shot dead israeli occupation forces border protest trump's jerusalem decision,0
walking dead driving m nuts lovehurts,0
chris moore fifa dead fish celebration nflcelebrations,0
saw dads side family today didn't time bullshit re dead anyways,0
cali thewalkingdead making list daryl everyone whose dead didn't follow plan,0
really fifa dead fish celebration,0
fun games till dead ass stop fucking,0
beyonc found dead ok now got attention text resist save net neutrality,0
walking dead probably not best show watch bad anxiety,0
walking dead mid season finale calllense,0
m highkey getting tired walking dead,0
m dead,0
just aware everything happening walking dead right now daryl asshole killdaryl thewalkingdead,0
giampietrino dead cleopatra,0
great barrier reef will dead says david attenborough,0
great barrier reef will dead says david attenborough's blue planet ii via,0
will protect baby shpees costs m gonna go heavy no matter will protec dead,0
gtfo get fuck stfu shut fuck mkmkomfgsfd miss keisha miss keisha oh fuckin god fuckin dead,0
lun tse favourite base metal co took weeks disclose wall collapse one mines,0
dead brave come now,0
walking dead,0
dead,0
worst season walkimg dead ugh episodes suck keep watching though m invested,0
amount sass m dead,0
day dead bloodline,0
cali thewalkingdead making list daryl everyone whose dead didn't follow plan,0
vine miss keisha no longer dead jared learned read raven can now swim rebecca still won't hesitat,0
thewalkingdead omg watching walking dead make noise,0
now re positive wasn't democratic party cnn anything right might resemble dead mouse,0
maggie glenn walking dead,0
im dead,0
try sing parts bohemian raphsody,0
just people die people killing dead people friend jen petrie truthbombing walking dead,0
sousa dead fuck,0
breaking four people killed injured media dead silent denuded media via,0
m old enough remember didn't watch walking dead light relief real world,0
m dead sksk,0
angela twilight actually walking dead now icymi,0
cool jets illegals prerequisite get hired drug testing people making noise must dirty not,0
dead inside feels good,0
dead,0
im dead actually,0
chillychill murderer make one move re dead,0
dead inside feels good,0
cali thewalkingdead making list daryl everyone whose dead didn't follow plan,0
remember used keep genuine opinions feelings fear losing person dead,0
cali thewalkingdead making list daryl everyone whose dead didn't follow plan,0
dead,0
today lost groundbreaking journalist civil rights icon true american hero simeon booker devoted life s,0
niyyy ain't no sucka ass bitch m wrong ll apologize make right can m definitely not gon,0
cnn's credibility dead don't let distract fact undertaker threw mankind off hel,0
martini wouldn't stop whining no reason dad explained just anxious walking dead lmao,0
swear intensity walking dead turning drunk every sunday night thewalkingdead twd,0
time fly walking dead come,0
wish never broke plus shit amp go dead quick,0
need mutual rt stan pierce veil palaye royale sleeping sirens crown empire tonight aliv,0
options one thing makes walking dead unrealistic slow people drive wide open roads,0
exom stan hi exok stans stop trying edgy like exom bc re dead everyone bandwagons feel uni,0
walking dead shit stressing tf,0
no doubt reagan's somewhat controversial work led amazing eco,0
currently watching walking dead feel stressed neganisout,0
dead homie one stfu dig amp ask,0
don't speak dead,0
real dead true versus wars jurassic lord independance armagedon saving hawk man twilight potter,0
mueller witch hunt national embarrassment now,0
army,0
really fifa dead fish celebration,0
gtfo get fuck stfu shut fuck mkmkomfgsfd miss keisha miss keisha oh fuckin god fuckin dead,0
cali thewalkingdead making list daryl everyone whose dead didn't follow plan,0
hello best friend wrote song also peep voice background vocals even though can't sing also,0
promise ian tripping ab nun past niggas ts dead case,0
jordan henderson just might talentless player ever wear captain's armband zero footballing abili,0
lo fi officially dead burn home demo tapes book studio time howard benson,0
going watch gintama tmrw dead,0
m dead game night sooo funny nothing beats fiery board game night family friends,0
gtfo get fuck stfu shut fuck mkmkomfgsfd miss keisha miss keisha oh fuckin god fuckin dead,0
cali thewalkingdead making list daryl everyone whose dead didn't follow plan,0
plus ve fucked close women far different age groups cu,0
dead,0
im dead,0
cali thewalkingdead making list daryl everyone whose dead didn't follow plan,0
cali thewalkingdead making list daryl everyone whose dead didn't follow plan,0
want goth gf r u sure ready one r u sure r u rly sure goth gf going target standing,0
m dead,0
michonne judith ll back ll bring daddy gonna bring shane back dead thewa,0
bitch m dead,0
cover hair weird drag dead trees living room light corpses,0
yo dead ass tho every day,0
didn't go bed till super dead,0
anixbrands instagram story seohyun girls generation im dead seohyun,0
michonne judith ll back ll bring daddy gonna bring shane back dead thewa,0
operation complete success wonderful can see husband now no dead operation w,0
walking dead season alt skins kenny sarita walter via,0
glen died walking dead felt heart,0
pr overkill's walking dead finally gets game trailer d,0
says dead dad joke,0
ew walking dead pissing off,0
nah dead ass don't wanna look organism looks like grim reaper,0
cnn's credibility dead don't let distract fact undertaker threw mankind off hel,0
entire session felt like walking dead,0
can't watch walking dead no without u bc walking dead will nothing withou,0
dead ok seriously stop letting insecure men w tiny peckers make decisions arena k good htt,0
hey news making wait queue told wait another queue hour still no help no,0
bukowski thought d cuz thought hundley better wins drop dea,0
days straight hour shifts feel dead,0
open borders tried empirical fact terrorism increases many dead babies worth can,0
bitch started fucking laughing bye found dead,0
dead possum side road,0
dead inside feels good,0
large pores concern try alpha hydroxy acid aha product ahas remove dead skin cells hardened oil plugs,0
female bio's love life tyrone one tyrone bio free men rip dead men th,0
really fifa dead fish celebration,0
marquei como visto walking dead gotta bancodeseries,0
beatsbynav m problem can fix type silent treatment shit dead grow learn commun,0
rarely dark makeup think makes look dead m pale zombie lol m making goth vid,0
just take knee nick nfl dead,0
celebrate mid season finale twd will another giveaway retweet like get chance win spec,0
cali thewalkingdead making list daryl everyone whose dead didn't follow plan,0
peacock dead,0
really fifa dead fish celebration,0
thought dead told never leave jamieandclaire outlanderfinale,0
hey isis ain't glass spine obama military welcome trump card military wake re dead h,0
dead,0
khan know zeid difficult one collect dead bodies loved ones pakistan army abducting,0
nowplaying madison square garden new york ny grateful dead,0
dead morning comes living,0
confusion thought nabila dead kingdom massacre whatttt theee funkkkk,0
walking dead game official reveal trailer new fps zombie game via,0
dreamt kissing dead turtle goodbye like first dead turtle pangkor came haunt,0
lilac fire least horses dead others missing san diego county training facility,0
imagine walking home local melbourne pub saturday night getting chopped africans machete,0
walking dead just just much bro actual fuck,0
really fifa dead fish celebration,0
will gt kidnap torture white disabled boy no prison gt kill innocent woman illegal alien acquitted gt execute young fat,0
want dead,0
wow re going dead guys now no one safe,0
rj name lalit jagwani mobile landline rajasthan jaipur landli,0
one person dead shooting east columbus,0
m dead,0
really fifa dead fish celebration,0
dead,0
reedus hq,0
hannibal burress arrested one cops said difficult cracking jokes hanni,0
stop picking dead birds,0
overkill's thewalkingdead game looks absolutely epic every way,0
g herbo friends dead,0
jus ppl link pan regular fi ask good dead tomorrow ya go hear much good friend t,0
yep gonna one walking dead episodes facepalm award goes daryl amp tara way suck guys thewalking,0
viewers game dead right,0
sf bad marvel dead dbfz will die months tekken takes years load gg got boring patch gonna gar,0
dead tears lmaaoooo,0
really fifa dead fish celebration,0
omg y can't deal walking dead right now,0
m fucking dead omg,0
m dead,0
still can't believe morgan going fear walking dead,0
fox amp friends weekend one straightforward no frills productions shoots directly dead true point praisefox,0
dead,0
guess u r entitled wrong opinion save everyone lot time trouble u,0
m not threesome period tf niggas really begging girl like noooo cus now m dead bout brea,0
dead homie one stfu dig amp ask,0
cali thewalkingdead making list daryl everyone whose dead didn't follow plan,0
carlson think brain cells dead,0
use dead day study can use drink,0
rip sunny murray thanks gave us,0
niyyy ain't no sucka ass bitch m wrong ll apologize make right can m definitely not gon,0
hollen write funeral dead person's viewpoint character's dead mother learned lot,0
let mind take flight read phenomenon quantum heights darkfantasy scififantasy,0
ok m dead,0
cali thewalkingdead making list daryl everyone whose dead didn't follow plan,0
chris moore fifa dead fish celebration nflcelebrations,0
grateful dead shakedown street,0
walking dead,0
going vidme videos amp realized little vidme community cared everything e,0
roe shit used dead yo,0
cali thewalkingdead making list daryl everyone whose dead didn't follow plan,0
niyyy ain't no sucka ass bitch m wrong ll apologize make right can m definitely not gon,0
negan's whistle got everyone shivering thewalkingdead twd twdfamily twdmidseasonfinale,0
shit dead happen every fuckin time lol,0
fecking years yelling ignorant shit kill jews media silent years screach,0
dead,0
gtfo get fuck stfu shut fuck mkmkomfgsfd miss keisha miss keisha oh fuckin god fuckin dead,0
m dead officially dead go hear right vikas sirf pao rehgaya raat mein aaj k,0
b tejada m dead,0
can't beef dead,0
dead body,0
niyyy ain't no sucka ass bitch m wrong ll apologize make right can m definitely not gon,0
cali thewalkingdead making list daryl everyone whose dead didn't follow plan,0
someone important going die tonight walking dead,0
walking dead blowing,0
guys can't believe mahiru dead,0
someone already exposed family confederate flags ig m dead,0
man ever fired dead wrong coming thru nye black jesus onl,0
people still watch walking dead,0
brain dead opinion,0
whining shut hillary us world war iii already d dead,0
fuck aren't dead yet thingsiyellwhilewatching thewalkingdead,0
cali thewalkingdead making list daryl everyone whose dead didn't follow plan,0
tell anxious ass reads ahead happens old shows m watching netflix dead ass sit,0
cali thewalkingdead making list daryl everyone whose dead didn't follow plan,0
well don walking dead just bs new,0
gtfo get fuck stfu shut fuck mkmkomfgsfd miss keisha miss keisha oh fuckin god fuckin dead,0
squeezable sour cream dead,0
logic behind walking dead bad lol saviors enough ammo resources manpower kill thou,0
m dead,0
taylor cult climate change polar bear knut dead long live knut,0
cutting hair short feels like cutting off dead weight,0
gtfo get fuck stfu shut fuck mkmkomfgsfd miss keisha miss keisha oh fuckin god fuckin dead,0
reedus,0
aa carmack amp doom totally next year amp going ebay shareware floppies charity th,0
haha okay everyone just got walking dead's reward club,0
gonna name devil amp write twitter page like devil's homie don't kno,0
really fifa dead fish celebration,0
someone already exposed family confederate flags ig m dead,0
cali thewalkingdead making list daryl everyone whose dead didn't follow plan,0
ma bitch really dubbin ma shit back da day like m not one dem guys dead dis bitch now m salty lmao,0
back dead unpopular demand oc rebooted descriptive h p,0
niyyy ain't no sucka ass bitch m wrong ll apologize make right can m definitely not gon,0
gtfo get fuck stfu shut fuck mkmkomfgsfd miss keisha miss keisha oh fuckin god fuckin dead,0
niyyy ain't no sucka ass bitch m wrong ll apologize make right can m definitely not gon,0
really fifa dead fish celebration,0
dead asleep song comes,0
cali thewalkingdead making list daryl everyone whose dead didn't follow plan,0
new brief media bethesda conducting investigation missing man found dead near braeburn ct,0
cali thewalkingdead making list daryl everyone whose dead didn't follow plan,0
today lost groundbreaking journalist civil rights icon true american hero simeon booker devoted life s,0
cali thewalkingdead making list daryl everyone whose dead didn't follow plan,0
watching walking dead k amp j's red room boston ma w,0
dead,0
m dead,0
happy walking dead day rt ll watching minute mid season finale tonight,0
m highkey dead twitter got's attention like worth shook,0
dead ass will ruin life don't fucking try hoe m devil,0
m dead,0
worst anxiety walking dead,0
dead ass not boyfriend took almost year realize giving nigga disappear,0
se viene walking dead,0
yep gonna one walking dead episodes facepalm award goes daryl amp tara way suck guys thewalking,0
walking dead blowing,0
not king dead also bad poet,0
really fifa dead fish celebration,0
cali thewalkingdead making list daryl everyone whose dead didn't follow plan,0
cali thewalkingdead making list daryl everyone whose dead didn't follow plan,0
suspect sought police since incident bobby's bar plum road left savitri narine,0
open borders tried empirical fact terrorism increases many dead babies worth can,0
boy dead now,0
really fifa dead fish celebration,0
really fifa dead fish celebration,0
large pores concern try alpha hydroxy acid aha product ahas remove dead skin cells hardened oil plugs,0
watches walking dead anymore,0
blood pop dropped dog shot dead midland police officer,0
dead,0
walking dead season alt skins kenny sarita walter via,0
prezdent no love db s,0
may last season walking dead watch,0
ruru sang heart like anuna dead,0
hope fuck gonna dead son bitch ll tell,0
everyone always asks know certain song band always get shocked dont know dead ass re,0
cali thewalkingdead making list daryl everyone whose dead didn't follow plan,0
bro really thinks someone cares followed m dead,0
really fifa dead fish celebration,0
feel dead dnskdn bc,0
beyonc found dead ok now got attention text resist save net neutrality,0
cali thewalkingdead making list daryl everyone whose dead didn't follow plan,0
need mutual rt stan pierce veil palaye royale sleeping sirens crown empire tonight aliv,0
day dead bloodline red band trailer,0
legs boots outfit ok m dead,0
red dead redemption hype new one ft deadfred via,0
one favorites almost recite time kinda sad now movie contemporar,0
repeats talking dead just wait,0
dead ass sound just like,0
want dance iv spades want fall love ben amp ben want rnb chill james reid want feel happy ransom co,0
cali thewalkingdead making list daryl everyone whose dead didn't follow plan,0
today lost groundbreaking journalist civil rights icon true american hero simeon booker devoted life s,0
really fifa dead fish celebration,0
bad parents dead,0
lmfao deb always fighting m dead shameless,0
bad parents dead,0
dead,0
cali thewalkingdead making list daryl everyone whose dead didn't follow plan,0
y ve truly dead ve busy m sorry,0
erics dead,0
hate sleep wrong wake dead shoulder broken jaw like possibly fuck ha,0
remade mine just go casually p nice also follow handful,0
violent antifa protest dead woman's memorial,0
happening thewalkingdead mid season finale airs tonight get ever hyped watching trailer,0
bitch m dead,0
g herbo friends dead,0
great barrier reef will dead due human maltreatment oceans says david attenborough,0
no matter find tonight's msf know ll okay survive tell,0
thewalkingdead really hijab apocalypse dead getting pc,0
ain't proving nobody anymore man shit dead fuck,0
hate losing fantasy much throws touchdowns tomorrow night ll get face tattooed,0
gtfo get fuck stfu shut fuck mkmkomfgsfd miss keisha miss keisha oh fuckin god fuckin dead,0
airport following robbers nailed marlboro offramp shot dead arrested unlicenced firearms amp ml seized h,0
cali thewalkingdead making list daryl everyone whose dead didn't follow plan,0
tejada m dead,0
really fifa dead fish celebration,0
walking dead,0
ae hora de walking dead,0
gtfo get fuck stfu shut fuck mkmkomfgsfd miss keisha miss keisha oh fuckin god fuckin dead,0
not normal walking dead affects heart rate elevated sweaty palms nausea,0
ve just watched episode walking dead tvtime,0
btw live calif,0
well walking dead never fails make angry,0
nowplaying dead eyes opened tuans day goth gothic radio,0
people think neat cool word timberwolf forget nots darkolivegreen espi dead,0
