tv im walking dead fan u promise min special want min done damn commercials,0
gtfo get fuck stfu shut fuck mkmkomfgsfd miss keisha miss keisha oh fuckin god fuckin dead,0
show headass re dead thewalkingdead,0
dead,0
action comedy dead long live political comedy,0
gtfo get fuck stfu shut fuck mkmkomfgsfd miss keisha miss keisha oh fuckin god fuckin dead,0
guess democracy officially dead venezuela,0
m really dead lmaoo,0
really fifa dead fish celebration,0
cnn's credibility dead don't let distract fact undertaker threw mankind off hel,0
cali thewalkingdead making list daryl everyone whose dead didn't follow plan,0
dead,0
shits dead,0
michonne judith ll back ll bring daddy gonna bring shane back dead thewa,0
west dear lord today cut off extra branches around constantly bare no fruit cut dead weight lif,0
cali thewalkingdead making list daryl everyone whose dead didn't follow plan,0
walking dead mid season finale already giving heart attacks,0
cali thewalkingdead making list daryl everyone whose dead didn't follow plan,0
large pores concern try alpha hydroxy acid aha product ahas remove dead skin cells hardened oil plugs,0
open borders tried empirical fact terrorism increases many dead babies worth can,0
beyonc found dead ok now got attention text resist save net neutrality,0
im pretty sure ezekiel goner story arc dead no longer king army dead,0
haters fbi officially confirms true pundit's dnc hacking story dead democrats refused federal agen,0
going crawl skin watching walking dead twdmidseasonfinale talkingdead,0
cali thewalkingdead making list daryl everyone whose dead didn't follow plan,0
according comics ezekiel dead morgan dead father gabrial dead,0
zayn dinner anyone dead alive michael jackson,0
gtfo get fuck stfu shut fuck mkmkomfgsfd miss keisha miss keisha oh fuckin god fuckin dead,0
m dead,0
really fifa dead fish celebration,0
noaa believe mass mortality event sea lions caused poor immune systems apparently ho,0
can't stop won't stop charlie make booty drop can't stop won't stop johnny make booty drop can't stop wo,0
m dead capitalizing like used right word,0
really fifa dead fish celebration,0
m back dead people m back pleasure cuties openrp lewdrp,0
alec raeshawn smith age found dead apartment june rationing insulin aged h,0
really fifa dead fish celebration,0
expect least one thing ten minutes mutuals want drop dead,0
niyyy ain't no sucka ass bitch m wrong ll apologize make right can m definitely not gon,0
walking dead fandom right now,0
walking dead getting fucking crazy can't,0
friends check big walking dead program tonight monumental one lots folks worked hard,0
cali thewalkingdead making list daryl everyone whose dead didn't follow plan,0
dead,0
two things everyone slept year chargers ain't dead bitches protein mvp bolts,0
dead,0
say romance dead,0
dead,0
life not waiting storm pass learning dance rain dead acquired dan,0
dead,0
walking dead waaaaaay much tonight m getting sick like really sick walkingdead thewalkingdead amc,0
someone already exposed family confederate flags ig m dead,0
dead,0
church dead silent prayer throat starts itching cough,0
vine miss keisha no longer dead jared learned read raven can now swim rebecca still won't hesitat,0
walking dead episode horse shit far thewalkingdead,0
cali thewalkingdead making list daryl everyone whose dead didn't follow plan,0
simon looked g d hate want dead don't like simon,0
first trailer overkill's thewalkingdead finally overkilltwd,0
cali thewalkingdead making list daryl everyone whose dead didn't follow plan,0
walking dead really pissing off right now amc walkingdead,0
cnn's credibility dead don't let distract fact undertaker threw mankind off hel,0
m truly done tho m actually dead,0
yooo tweet dead tho,0
dead homie one stfu dig amp ask,0
chris moore fifa dead fish celebration nflcelebrations,0
gtfo get fuck stfu shut fuck mkmkomfgsfd miss keisha miss keisha oh fuckin god fuckin dead,0
bad parents dead,0
neighbor re lost forest need find place trees dead can hide night will fall soon,0
ex say wish dead already dead inside,0
never get want dead ass lol point idc,0
cali thewalkingdead making list daryl everyone whose dead didn't follow plan,0
starting thewalkingdead now hoping daryl finally bites dust doubt eugene sure dead hell,0
plants dead push edge,0
walking dead mid season finale killing omg someone going die,0
y promote dead jew worship among cultures wanting ur cake amp eat now,0
im sothy will missed imsothy im sothy rip,0
cali thewalkingdead making list daryl everyone whose dead didn't follow plan,0
cali thewalkingdead making list daryl everyone whose dead didn't follow plan,0
cali thewalkingdead making list daryl everyone whose dead didn't follow plan,0
amc doesn't give good guys narrative win walking dead clearly don't mind losing viewers,0
ve watched every minute walking dead yet absolutely zero clue going solid writing,0
jarvis mann pi another spine tingling adventure read free kindle unlimited dead,0
cali thewalkingdead making list daryl everyone whose dead didn't follow plan,0
gtfo get fuck stfu shut fuck mkmkomfgsfd miss keisha miss keisha oh fuckin god fuckin dead,0
walking dead references freshman twd thewalkingdead,0
took off dead sprint across road,0
vinny m dead,0
really fifa dead fish celebration,0
cali thewalkingdead making list daryl everyone whose dead didn't follow plan,0
cnn's credibility dead don't let distract fact undertaker threw mankind off hel,0
