americans spending less christmas gifts year poll,0
exo winter album giveaway details giveaway will end christmas kst flops u never saw,0
tn way get touch keaton's family arrange way send keaton c,0
christmas almost upon us people start match matchingclothes,0
christmas c christ center h honoring god r remembering promises inner peace,0
morrissey cancels tomorrow's kroq christmas show,0
like christmas,0
turned off hateful eight not quite ready hear many white people say nigger southern ac,0
wanna go christmas tree lane,0
miss way christmas felt lil,0
enter holiday celebration destination sweeps amp make christmas jolly w,0
y new episode unwritable rant podcast posts tomorrow around cst ll talking penalty,0
makada thank god christian president not afraid say merry christmas maga merrychristmas,0
christmas shopping done funnytee funnyshirt foodpuns dadjokes,0
aston huge christmas haul dollar tree one dollar zone via,0
wondering many professed christians alabama will walk polling site two weeks christmas cast,0
christmas classic house,0
new video react feels cover disney holiday celebration dinah leona lewis christmas medley https,0
christmas shit,0
primary rwa smt ready deliver christmas presents staff,0
want christmas sweaters,0
red velvet joy x nct doyoung first christmas,0
missed sir ricky's christmas party last night missing pau's anniv later m homebody bed rest really sucks,0
final day lincoln christmas market cancelled due bad weather,0
christmas party,0
christmas looking like whole thanksgiving day lord mercy please,0
y consider driving around looking christmas lights date,0
bae yunhyeong since christmas abs chanu noooooooooo promised show abs kkkk chanu quiet shut,0
liked video christmas shopping boyfriend,0
watching christmas movies day,0
picked older woman side road today ran gas drove around get gas got ho,0
enter universe one wears mask watch spider man spider verse trailer now theaters,0
get free calendar template via easy affordable robust pdf solution,0
christmas festivities st louis zoo st louis best penguin habitat america one,0
getting christmas money realizing m poor child needs survive,0
know henry wadsworth longfellow wrote words carol heard bells christmas day,0
since like days ago every president said u know re gonna say merry christmas thing,0
new train coming spirit giving know someone needs boost plz let kno,0
monitors party yule log burning mariah carey's want christmas repeat,0
california central coast friends favorite local christmas event,0
anyone trying go watch christmas lights not play emotions,0
one time greatest christmas songs original ms ap,0
watch arthur christmas let inner child make happy,0
seventeen carat bong giveaway rt follow enter ww ends christmas,0
re privileged equality feels like oppression get re not writing merry christmas every fuc,0
dude thats family's christmas movie yrs time classic,0
land peace christmas gifts bethlehem st jean baptiste nyc,0
alarming number teens disappearing enfield london spoke relative one missing boys,0
one favorite christmas videos,0
ask court not worry ye shall speak shall given hou,0
definitely one favorite christmas videos,0
used love looked forward andy williams christmas every year,0
happy early christmas us can't handle shay red clothes lips always breathtaking,0
balitree christmas new year no,0
just entered massive amp partner christmas giveaway featuring amazing products,0
mom just dropped baby's first christmas ornament floor re fight will update u,0
christmas countdown days,0
christmas cheer saturday office,0
birthday days pitch perfect days christmas days next christmas days time t,0
another memorable lexus oakville christmas party hubby mc d,0
case godfather best non die hard christmas movie ever,0
want make difference christmas rescue wishlist something every budget bag cob bag,0
let begin wishing every one merry christmas said rally last night,0
seeing commercials people get dressed celebrate christmas home makes wonder anybody actually,0
guuuuys christmas planning give peso worth brand new art materials doncha worry abt shipping,0
ve hoping life eng ver christmas album now,0
check clearance kids sticker christmas dalmatians bag xmas decal dogs puppies sale square via,0
new app store christmas moji amp animated emoj zahid hussain,0
cuddle blankets throw christmas movies day time year,0
awesome awesome awesome christmas came early merry christmas president trump,0
lottie team lottie travelling london heathrow virgin atlantic lounge new york flying home christmas,0
can't decide re christmas emo spirit,0
check days christmas specials going re even holding giveaway wo,0
roses red violets bluish wasn't christmas d jewish badholidaycards,0
looks good now just wait christmas promo upgrade,0
miss way christmas felt lil,0
guppy fun time christmas market sister havana sisters,0
parents damn difficult buy no idea get christmas,0
trumps christmas list destroy democracy obliviate rule law create violence middle east,0
stealing christmas,0
mother control y christmas tree roses amp baby's breath re real,0
thank christmas ornament will always greatful support shown fort mcmurray h,0
retweet para merry ang christmas mo year,0
liked video wham last christmas sonic genesis style cover,0
someone wants watch elf followed grinch drink hot chocolate go look christmas lights,0
fox news laura ingraham laments metoo movement killing fun christmas parties,0
spice things christmas win bestsellers spice set enter win retweet photo,0
jacks writing santa doesn't come night made think santa didn't visit christmas probably bab,0
since like days ago every president said u know re gonna say merry christmas thing,0
bts confirmed attend sbs gayo daejeon dec performing christmas day,0
world needs christmas dogs,0
almost christmas carols came store shopping,0
last night watched nigerian christmas movie bit mary told joseph pregnant joseph su,0
y consider driving around looking christmas lights date,0
anytime someone instagram something creative people no idea makeup assume re starting,0
wish merry christmas,0
another gift wrap nugget grandbabies awesome christmas customgiftwrapping,0
anybody else want just love christmas special pero wala pa din tickets tweet,0
eco guide christmas trees,0
instagram taeyeon ss christmas taengstagram,0
doubled christmas thing,0
fox news host laura ingraham thinks women reporting rape will make christmas parties less festive year,0
trump miracle american manufacturing added new jobs november years since election t,0
offi update cast crew details will revealed christmas first look wil,0
rajah travel corporation christmas party comic coni ibiza beach,0
leeleone christmas break seriously can't come soon enough,0
ultimate food drink christmas gift guide,0
christmas lights blanket snow fascinathings,0
true story year old daughter made snow girl using dead leaves tears crying kid becaus,0
just added closet poshmark ugly christmas sweater grisworld vacation via,0
anytime someone instagram something creative people no idea makeup assume re starting,0
fox news host laura ingraham thinks women reporting rape will make christmas parties less festive year,0
cute christmas stationary giveaway haul philippines janina vela via,0
aww new photo ophelia arrow christmas party source,0
bugger chris rea collapsed stage last night hope gets better soon got long drive get home christmas,0
enter universe one wears mask watch spider man spider verse trailer now theaters,0
get coupon next movie transformers megatron's christmas vacation,0
cuddle blankets throw christmas movies day time year,0
look amazing christmas card,0
dogs always find christmas gifts two bags treats toy destroyed,0
not even christmas yet calendar christmas,0
rt amp follow chance win funko shop days christmas exclusive firehouse huckleberry hound,0
compton mayor assemblyman mike gipson compton christmas parade,0
u good christmas,0
everyday feels like christmas m,0
new app store spanish christmas songs simon bogh holding aps,0
cant wait get first kiss christmas missile toe,0
trump miracle american manufacturing added new jobs november years since election t,0
christmas bout lit,0
rehearsal time abs cbn christmas special prod can't wait good luck amp edward,0
will james first christmas manila always celebrate outside country daw will,0
drive around lookin christmas lights chill,0
trump miracle american manufacturing added new jobs november years since election t,0
badholidaycards wish anal christmas happy lubed rear,0
blackgirl made christmas soul excellence,0
vinny first snow fall snow christmas white christmas two times acceptable,0
christmas party's lit,0
alex couldn't agree went grab last box put cart maybe get anoth,0
christmas parade good,0
enter universe one wears mask watch spider man spider verse trailer now theaters,0
days christmas giveaway days knives winners day shadow dagger fade retweet follow,0
jaclynhillchristmas go jaclyn's ig chance win days christmas goodies,0
beginning look lot like christmas middleburg virginia ashley busch's ponies charlie cayenne ciri,0
enter universe one wears mask watch spider man spider verse trailer now theater,0
supposed get iphone x big christmas present old iphone decided die got t,0
parents get exactly want christmas,0
merry christmas great prize doneproperly instax giveaway win,0
quite honestly m not feeling christmas year y already bought something can return get money back,0
ooohhhhhh gay christmas blinksssssssss blackpink sbsgayodaejeon,0
salam rss members went rampage amp attacked vandalised prayer hall coimbatore disrupting christmas celebrations,0
avelamerrychristmas m soooo looking forward putting decorations house seeing children s,0
want christmas sweaters,0
maxwell star hard buy christmas presents,0
cat just gave birth christmas tree,0
don't enough money left buy family christmas presents anymore don't blame not fault ha,0
dogs year anniversary christmas,0
need christmas mosh pit song need christmas,0
since like days ago every president said u know re gonna say merry christmas thing,0
can purchase robot version xxx merry christmas,0
twimbos kay semwayo website christmas promotion harare zimbabwe page,0
ak redline giveaway enter like video retweet tweet show proof mer,0
year old survivor texas church shooting wants christmas cards via r upliftingnews,0
boys paparazzi now christmas fucking cancelled,0
aye don't let louisiana fool gonna degrees christmas,0
want christmas wake without acne,0
tom merry christmas birkenhead loving christmasy pub gigs coming manchester soon,0
day days christmas competition win winter warmers set inc blanket scarf socks gl,0
lani moss m n performed tonight sierra high notes choral group christmas show reno,0
shop london lets people buy presents refugees just time christmas,0
retrospect war christmas one loudest clearest warnings toxically stupid politics b,0
cant wait get first kiss christmas missile toe,0
bought bitcoin will pick random people retweet give one mer,0
christmas sierra adorable don't ya think,0
christmas sale free shipping casual wear sportswear golf apparel dockers haggar foundry chaps izod s,0
almost christmas,0
junk bot like give guys early christmas presents will give guys gut knives,0
re wondering give christmas,0
jesus christ look fucking hard merry christmas makes happy,0
clark son scored like points life wants compression sleeve christmas looks savage,0
someone wants watch elf followed grinch drink hot chocolate go look christmas lights,0
since like days ago every president said u know re gonna say merry christmas thing,0
christian saturday seminars church signs shopping days till christmas december january speaking,0
christmas love boyfriend,0
liked video christmas tree skirt transformation diy holiday skirt,0
unusual corporate event na sisigaw ung mga tao look sarah g crowd want christmas,0
paypal giveaway enter rt tweet follow reloads picking winner,0
good cca really strong statement christmas time another transparent act show true colours,0
races re back sat sales villiers stks day christmas raceday santa amp helpers course also great,0
white people want christmas comes bar,0
hi loves another giveaway friday freebie bundle win gifts amp,0
since like days ago every president said u know re gonna say merry christmas thing,0
sydney trends now police christmas government turnbull liddell,0
dropped today w christmas story sure pull heartstrings amp also brought excerpt h,0
pleasure attend annual canada cyprus chamber commerce's christmas party congratulations f,0
christmas party's lit,0
just know ll sad looking bc poor christmas want newer styles bad,0
rt amp follow chance win funko shop days christmas exclusive silver mr monopoly pop ht,0
hey guys help get phone receive mailed polaroids exclusive christmas videos goal circle pay google w,0
make fun nose call ugly say no friends no child ever feel way,0
off aluminum led projector light pattern halloween christmas party outdoor g,0
cozy christmas party success,0
added video playlist question christmas tag lifeasloz,0
