us christmas killing liberals want women safe christmas parties horror watch fox,0
one favorite christmas videos,0
wanna spend christmas,0
want christmas two daddies,0
mother control y christmas tree roses amp baby's breath re real,0
dont add christmas movies december,0
bet speedy recovery guess ll thankful seeing christmas new year,0
christmas party's lit,0
anytime someone instagram something creative people no idea makeup assume re starting,0
td man fav place merry christmas,0
send thank cards letting us see true lindsey vonn sports,0
happy christmas want gf santa,0
best christmas oufit,0
anytime someone instagram something creative people no idea makeup assume re starting,0
honor christmas coming soon sister amp decided learn one favorite holiday songs ignore dan,0
bea arthur lgbt homeless shelter opens just time christmas another beautiful moment,0
enter universe one wears mask watch spider man spider verse trailer now theaters,0
adams welcome clickbait christmas,0
snsd girls generation merry christmas,0
imma just leave tl anyone wants get christmas,0
might last christmas hope not want survive keep writing keep loving wife fam amp friends keep fight,0
pensieve people pointing isn't james first christmas mnl kid really forgetful inaccurate dates,0
wife never forgets anything like married ghost christmas past,0
dad said wants christmas okay wellllllppp,0
tells children hospital asked santa clause peace world health love kindness,0
surprise cover kelly clarkson's every christmas youtube now single everywhere december,0
fish bowl lense actually comes handy zoolights christmas bilingualpride,0
one favorite christmas videos,0
m lil tipsy m sending funny christmas cards drop ur address want one lol,0
guess m getting christmas,0
happy early merry christmas everyone leave stockholm december december get money,0
pepero fansign op told sehun birthday christmas day stopped signing bit cr ddosehun,0
wanna order coffee maker blender christmas,0
can horn sound christmas bells pls,0
case wondering get christmas off everything free shipping,0
christmas special get discount every hair styles us season,0
since like days ago every president said u know re gonna say merry christmas thing,0
writing christmas wish list,0
junk bot like give guys early christmas presents will give guys gut knives,0
fowey senior citizens christmas lunch thank entertainment mysjaday,0
days christmas giveaway days knives winners day shadow dagger fade retweet follow,0
claiming tickets extended regiter now justlove,0
can christmas together make ornaments cookies ortega's dad,0
don't go broke christmas shopping nigga ain't,0
waldo christmas edition,0
abuelita says making one christmas que quieres,0
christmas time tampa,0
man just sent photo whole ass penis twitter dm's grandma follows twitter im realizing t,0
britt leighhh hahaha everyone understand christmas time,0
oh god please someone get christmas,0
first time don't know want christmas,0
mccoy de leon elisse joson unisilver christmas party,0
one favorite christmas videos,0
enter universe one wears mask watch spider man spider verse trailer now theaters,0
dear fbi witness hope safe upcoming testimony hillary's uranium one deal will make year t,0
christmas officially celebrate giving away festive radiance christmas gift set like amp retwee,0
bank stone set christmas tree brooch free just pay p amp p christmasgiveaway christmasiscoming gif,0
makada thank god christian president not afraid say merry christmas maga merrychristmas,0
since like days ago every president said u know re gonna say merry christmas thing,0
twitter minhyuk present please accpet t n accepted best christmas present ever,0
part want christmas don't understand,0
dear fbi witness hope safe upcoming testimony hillary's uranium one deal will make year t,0
want christmas sweaters,0
rt amp follow chance win funko shop days christmas exclusive freddy funko nutcrackers po,0
nickcordoba m giving everyone retweets puppy christmas,0
day seven adventgifts ealing mug know proud ealinger another great secretsanta idea ealing mu,0
bank accounts looking like family getting nice smile hug christmas,0
sang christmas songs yaaaaa,0
make fun nose call ugly say no friends no child ever feel way,0
rt amp follow chance win funko shop days christmas exclusive firehouse huckleberry hound,0
trump miracle american manufacturing added new jobs november years since election t,0
one favorite christmas videos,0
christmas shopping josh like,0
annual ugly christmas sweater party success calgary alberta,0
getting christmas spirit two favorite girls blessed girlfriend sister absol,0
anytime someone instagram something creative people no idea makeup assume re starting,0
anytime someone instagram something creative people no idea makeup assume re starting,0
dear fbi witness hope safe upcoming testimony hillary's uranium one deal will make year t,0
cant wait get first kiss christmas missile toe,0
played want christmas mariah carey warehouse party last night n whitest mosh pit broke https,0
next stars ang panday makiki christmas party asaphappyholiyey,0
trek remedy christmas tree just always wanted yaybikes instabike trekbikes,0
enter universe one wears mask watch spider man spider verse trailer now theaters,0
palestinian christians switch off christmas tree lights protest trump's claim jerusalem belongs israel http,0
world needs christmas dogs,0
want christmas sweaters,0
trump miracle american manufacturing added new jobs november years since election t,0
want christmas sweaters,0
miss way christmas felt lil,0
hey babes last minute lazy christmas look hope guys like please tag,0
fam please help really want christmas present rt like won't hurt rtxrt just dm,0
nathan n isabella astros christmas lights houston heights texas,0
ico investors christmas coming earlier contribute cointed ico project,0
want dad christmas want hug tell love,0
screw saying merry christmas people m going saying people now dinah leona christ,0
ooohhhhhh gay christmas blinksssssssss blackpink sbsgayodaejeon,0
merry christmas,0
enter universe one wears mask watch spider man spider verse trailer now theaters,0
tell gift want christmas vicious lol hehehe,0
hi friends followers mutuals ll mailing written notes christmas don't need best fri,0
selam lingerie christmas video funny cause every girl saying can't wait dress like man lol wa,0
dm twitter boo tell wanna unwrap christmas screen shot results,0
put santa hat head get christmas spirit,0
want christmas fn scar giving one away gungiveaway scar fde enter,0
christmas coming sk's christmas collection tap also feel free ch,0
true story year old daughter made snow girl using dead leaves tears crying kid becaus,0
entered christmas giveaway chance win makeup toys skincare,0
first christmas years m single m accustomed going amp spoiling someone yes,0
awesome speech pensacola florida potus speech great,0
days christmas treat sense habitat spa salon,0
two hearts find christmas asmsg iartg romance,0
enter universe one wears mask watch spider man spider verse trailer now theaters,0
christmas course,0
annual go go giveback charity christmas concert sat dec ft go go stars w,0
merry christmas mr president,0
hyers christmas,0
want christmas now get lol,0
idea christmas whether old fashioned modern simple loving others bob hope merrychristmas https,0
anniversary game christmas weeks m juiced,0
m sitting underwear eating applesauce cup watching nightmare christmas life,0
bitter hateful years obama administration sure refreshing see president absolut,0
bite win ll see christmas take canberra,0
christmas lights awesome,0
pastle bubble christmas day,0
katycats wig hey hey hey music video coming next week katy new christmas shoe collection now,0
trump miracle american manufacturing added new jobs november years since election t,0
early christmas present bf meet dolce,0
icymi year old survivor church shooting wants christmas cards,0
brother got girlfriend less month lush bath bomb set christmas m sick,0
timeless style made everyone order december receive items christmas,0
watch fox complains women reporting rape will make christmas parties less festive via,0
want christmas pug,0
hunt man loves christmas much,0
anytime someone instagram something creative people no idea makeup assume re starting,0
jenna amp tom queen victoria prince albert victoria christmas special,0
will james first christmas manila always celebrate outside country daw will,0
ford t bird happyholidays christmas,0
awww look baby total christmas mood singing christmas carols happy holidays,0
played want christmas mariah carey warehouse party last night n whitest mosh pit broke https,0
pepero fansign op told sehun birthday christmas day stopped signing bit cr ddosehun,0
bought bitcoin will pick random people retweet give one mer,0
world needs christmas dogs,0
enter universe one wears mask watch spider man spider verse trailer now theater,0
entered huge christmas giveaway check,0
pick n pay help need comes recipes christmas need hand,0
wanna go see christmas lightssss,0
vintage enesco santa's golf tips christmas ornament via veeseller,0
shy scared teen people just assumed asshole hated everyone now just,0
icymi payback donald trump jr just lit cbs news like rockefeller center christmas tree,0
make fun nose call ugly say no friends no child ever feel way,0
someone wants watch elf followed grinch drink hot chocolate go look christmas lights,0
tensions got high work christmas party tonight,0
update fortnight long vacation will celebrate christmas n's birthday december,0
fox news host laura ingraham thinks women reporting rape will make christmas parties less festive year,0
enter universe one wears mask watch spider man spider verse trailer now theaters,0
miss way christmas felt lil,0
want christmas vlogs,0
courageous stood feet heel spurs bravely saying merry christmas waaaaa,0
rt amp follow chance win funko shop days christmas exclusive flocked trix pop,0
omalley around say merry christmas people don't run lives hear sirens rejoice happ,0
last year december dropped mightelele dec dropping fresh hits christmas beyond eomalbum featurin,0
tis season m gonna grant christmas wish whoever nice list spoil make cut,0
christmas pillow christmas pillow festive decoration,0
christmas favorite holiday,0
bts confirmed attend sbs gayo daejeon dec performing christmas day,0
snows texas calls classy christmas celebration,0
merry christmas hope not store display,0
according poll college basketball fans feel every duke loss like christmas thanksgiving t,0
anytime someone instagram something creative people no idea makeup assume re starting,0
twitter shownu always like every year starshipplanet coming happy thay gather together t,0
kt just wanna watch christmas movies cuddle,0
christmas coming fast,0
still hoping christmas miracle will announce australian joanneworldtour dates,0
junk bot like give guys early christmas presents will give guys gut knives,0
wanna spend christmas,0
spicy christmas,0
not sure enough room giant christmas tree,0
enter universe one wears mask watch spider man spider verse trailer now theaters,0
m not going hide anything older either asks dad wasn't around m,0
pepero fansign op told sehun birthday christmas day stopped signing bit cr ddosehun,0
jitzel want watch christmas movies drink hot chocolate cuddle,0
always wanted go see christmas lights someone special nope probably ain't gonna happen,0
since like days ago every president said u know re gonna say merry christmas thing,0
watch fox complains women reporting rape will make christmas parties less festive,0
entered huge christmas giveaway check,0
official beatles fan club christmas records perfect retro gift santa mrs claus forbes,0
texted friends didn't come christmas party rubbed face missed best party year,0
want derrick rose jersey christmas new vans,0
christmas giveaway pt love album worldwide read info rt amp follow participate album amp ph o,0
us christmas killing liberals want women safe christmas parties horror watch fox,0
finally leader unafraid boldly proclaim two simple beautiful words merry christmas,0
still haven't seen christmas lights someone take,0
reallllllyyy want go see christmas lights zoo,0
iconic houston christmas shopping video,0
enter universe one wears mask watch spider man spider verse trailer now theaters,0
taeyeon's winter album christmas winter coming features eight tracks including lead track thischristmas,0
christmas beauty giveaway follow amp rt win simply follow amp rt pinned tweet win amazing u,0
jon kennedy goose getting fat nowplaying,0
mannnnn christmas break m trying,0
cold outside m trouble deciding whether stay home sit front fire stay warm amp wa,0
gibbss girl just said alexa know time confused someone bring amazon,0
christmas factory style,0
wants waifu pillow christmas,0
christmas little early get chance take winter intensive f r e e w,0
check beautiful must read romance date christmas novel,0
surprise cover kelly clarkson's every christmas youtube now single everywhere december,0
since like days ago every president said u know re gonna say merry christmas thing,0
m pumped christmas honestly real christmas gift gonna seeing boo,0
almost months grenfell government's promises lie tatters half grenfell families still hotel rooms,0
enter universe one wears mask watch spider man spider verse trailer now theaters,0
us christmas killing liberals want women safe christmas parties horror watch fox,0
public service announcement whoever keeps messing mom's christmas decorations firmly applaud please,0
fixed christmas year rudolph finally shuts santa ruthless opportunism,0
trump miracle american manufacturing added new jobs november years since election t,0
retweet snowflakes see tweet merry christmas liberal marxists storm unite con,0
haunted mansion super cool nightmare christmas stuff neat feel like see,0
people unaware celebrate christmas every day december just really feel bad people,0
mother control y christmas tree roses amp baby's breath re real,0
want christmas sweaters,0
went go see christmas lights tonight surprised many houses keep christ christmas lawns,0
bought bitcoin will pick random people retweet give one mer,0
hey hey come come lil closer listen real close hear jingle bells ch,0
kinda wanted get friends something christmas no money m little sad,0
actually nitwit obamas tweeted merry christmas every single year don't u tiny bi,0
listening christmas music hubz might stab dump side,0
tash christmas tree yay christmas christmastree,0
retweet love litecoin want see super sayin break christmas ltc litecoinnews,0
christmas shopping week,0
just retweet follow will entered win winner announced christmas rttowin follow rtandfollow,0
jesus christ born celebrate christmas celebrate jesus christ gift love joy peace happiness,0
helping set christmas tree,0
want christmas sweaters,0
happy holidays de leons dm christmas card bykuria,0
thank ksa warm hospitality happy grateful share success last night's concert,0
toronto hoodmans decorate christmas tree,0
wanna buy christmas socks somoeone,0
badholidaycards wish anal christmas happy lubed rear,0
pussy not christmas present,0
cooks yes say thank every last one merry christmas america h,0
please rt midwives maternity support workers obstetricians maternity staff will helping wome,0
nah man huge assed husky plushy christmas gift lol,0
last christmas gave chart next day gave away year save tears ll give,0
sweet girl pro love always good luck burgh c u christmas hugs gram,0
highley want christmas pt come,0
meze challenge everyone clothing line give random kid outfit clothing line free christmas,0
start making christmas cards bec want give fam friends want personalized,0
mom hey christmas movie wanna watch idk im kinda tired mom rankin bass,0
working christmas photos today m dreaming white christmas pinotgrigio sexysaturday,0
enjoying wehs fca christmas get together christian friends,0
enter universe one wears mask watch spider man spider verse trailer now theaters,0
christmas wwii via,0
not sure enough room giant christmas tree,0
truly obsessed christmas album,0
bubby said ever said merry christmas d end buffalo right,0
much awaited day kisston shippers re overjoyed sharking amp s,0
can tell m love twt btsarmy christmas christmasstocking doityourself,0
god good true commander chief bringing god amp merry christmas back white house wil v,0
cant wait get first kiss christmas missile toe,0
rt amp follow chance win funko shop days christmas exclusive firehouse huckleberry hound,0
company christmas party bonus next friday ugly sweater party next weekend great,0
really miss good ol days barack obama president saying merry christmas public punishable deat,0
also autographing special christmas photos holiday show,0
dominick donkey iconic christmas song just heard first time changes everything mov,0
merry christmas chemistree instructions cut copper triangles cut slit bottom one top slide t,0
actually got see skate previous winter olympics grade ye,0
catmas christmas cats thing,0
billion christmas cards end trash year see badholidaycards environment stop shit,0
feeling like christmas time at's jingleballnorth toronto ready htt,0
evolution war christmas play four acts,0
make fun nose call ugly say no friends no child ever feel way,0
want holiday season christmas album,0
christmas coming fast,0
make fun nose call ugly say no friends no child ever feel way,0
mother control y christmas tree roses amp baby's breath re real,0
full eng present edition members christmas wishes song reviews thanking speeches link,0
someone wants watch elf followed grinch drink hot chocolate go look christmas lights,0
just want make cute lil gingerbread house decorate cookies watch christmas movies amp listen christmas music,0
retweet snowflakes see tweet merry christmas liberal marxists storm unite con,0
merry christmas sperm bank,0
pepero fansign op told sehun birthday christmas day stopped signing bit cr ddosehun,0
dear fbi witness hope safe upcoming testimony hillary's uranium one deal will make year t,0
heads socal trying find connie home christmas got one least rt ht,0
snows texas calls classy christmas celebration,0
aj christmas lights aren't thing getting lit tonight,0
styles still feel like early say merry christmas just not,0
im excited christmas year,0
ryland lost mom two sisters sutherland springs church shooting family asking can send chris,0
want try iceskating christmas first time skate aids available hire help build yo,0
aint nobody getting shit christmas,0
junhoe christmas something want try jinhwan want try dating ikonxm,0
jam coming christmas,0
make fun nose call ugly say no friends no child ever feel way,0
hope someone gives pretty pup forever home christmas cold amp needs love warmth food amp p,0
almost christmas,0
enter universe one wears mask watch spider man spider verse trailer now theaters,0
writing christmas wish list,0
can't decide re christmas emo spirit,0
need christmas,0
santa joins lubbock bands volunteers street annual miracles christmas parade,0
bank accounts looking like family getting nice smile hug christmas,0
happy holidays pitcher elena valenzuela catcher alyssa rios ss savannah tourville senior year christmas party,0
badholidaycards really want see christmas release restraining order woul,0
nowplaying mill city radio finally christmas hanson christmasmusic,0
sent santa christmas list not sure m ll fulfilled,0
hi loves another giveaway friday freebie bundle win gifts amp,0
llexiiss need christmas socks asap,0
don't know want christmas,0
santa joins lubbock bands volunteers street annual miracles christmas parade,0
huge christmas makeup giveaway gift ideas via,0
junk bot like give guys early christmas presents will give guys gut knives,0
listen sing christmas smule singkaraoke,0
trump miracle american manufacturing added new jobs november years since election t,0
story christmas quite saga jesus poor immigrant d never welcomed us maga badholidaycards,0
hi happy holidays m lonely hoping someone will tweet back ive single yrs daughter needed long,0
christmas want free,0
cuddle blankets throw christmas movies day time year,0
someone wants watch elf followed grinch drink hot chocolate go look christmas lights,0
video celine dion sings chestnuts roasting new handbag dept store collection via,0
cuddle watch christmas movies type weather,0
hours upcoming week starting tomorrow come see m must list year,0
spoil christmas amp ll spoil back ll opening gifts chat room well,0
still needa get christmas gifts friends fuck,0
take christmas christmas movie get fucking movi,0
going christmas shopping money prank chris via,0
cool things abt tonight mt eddy covered strokes moshed christmas songs w regrettes went,0
cosy knits sparkling accessories pretty dresses shop ultimate christmas style store online now htt,0
merry christmas ateneo,0
will try release skyblock server around christmas,0
rt amp follow chance win funko shop days christmas exclusive firehouse huckleberry hound,0
tree won't thing lit christmas,0
chanwoo's christmas abs,0
enter universe one wears mask watch spider man spider verse trailer now theaters,0
ll home christmas tony bennett nowplaying,0
wants go christmas shopping soon lol,0
elf will forever greatest christmas movie,0
surprise cover kelly clarkson's every christmas youtube now single everywhere december,0
junk bot like give guys early christmas presents will give guys gut knives,0
exo special winter album giveaway free shipping international exo ls albums amp freebies ends,0
win christmas jumpers will force tonight rt enter chance win cadbury christmas ju,0
much awaited day kisston shippers re overjoyed sharking amp s,0
boat went christmas party instead watching stars lose sports way kicking,0
want set comfortable christmas pajamas,0
turned off hateful eight not quite ready hear many white people say nigger southern ac,0
uk secret santa made easy follow rt chance win stash fisherman's friend just time christmas,0
remind never go laura ingraham's christmas parties baby cold outside plays loop people,0
ly vlive share giveaway ll sharing vlive account armys early christmas follow rt dm t,0
little christmas tree cheer,0
cuddle blankets throw christmas movies day time year,0
christmas party's lit,0
keep catering ignorant base literally dozens videos obama saying merry chr,0
one favorite christmas videos,0
friend got bi pride flag christmas started sobbing,0
anytime someone instagram something creative people no idea makeup assume re starting,0
icymi payback donald trump jr just lit cbs news like rockefeller center christmas tree,0
bitcoin giveaway retweet like follow ll reveal winners christmas,0
world needs christmas dogs,0
miss way christmas felt lil,0
m small paintings friends christmas gifts whoever gets one better appreciate bc bee,0
ll meet christmas isle looked already getting full cart ran off t,0
beginning look lot like christmas newyorkcity nyc travel christmas xmas,0
miss way christmas felt lil,0
columbus trends now ohio marysville christmas trump jackets,0
yes true except djt enjoys good rape story also seems drawn towards incest tales well,0
turned off hateful eight not quite ready hear many white people say nigger southern ac,0
russ christmas wh smith can save now variety gaming pleasures retrogaming,0
game aaron sorkin's mollysgame makes's top best movies see select theaters christmas day everywhere j,0
pushpay christmas party fancy bell harbor international conference center,0
phoenix trends now trump valley arizona christmas president,0
feeling christmas break,0
icph ang bilis ng panahon days na lang bago mag pasko done christmas shopping yet not better star,0
will missing first time life annual joaquin christmas party saaaad,0
rt,0
first christmas tree gone syria's aleppo one year ancient city liberated obama hilla,0
surprise cover kelly clarkson's every christmas youtube now single everywhere december,0
bank accounts looking like family getting nice smile hug christmas,0
metoo movement becoming spoiler season's christmas parties words actually came,0
got many nieces nephews buying shit christmas bouta just get money call day,0
beautizmlove eyes magic lights amp sounds christmas one made spirit sing loud,0
carly rae jepsen comes christmas album u hoes,0
got christmas hat today blue instead traditional red love christmas winter,0
christmas just around corner ask congress give million american children early present,0
rt win christmas shopping must following ig urbanxdoll can gift cards paypal xo,0
buy christmas get older dump shelter lifelong commitment love whole,0
waddy little finger,0
cant wait get first kiss christmas missile toe,0
made christmas card ibm mainframe writing assembly program punch cards,0
bought bitcoin will pick random people retweet give one merry,0
rt amp follow chance win funko shop days christmas exclusive wonder woman pop,0
christmas candy best candy,0
not sure enough room giant christmas tree,0
nice pest character drinking trip woods barrel aged islay fog black christmas,0
turned off hateful eight not quite ready hear many white people say nigger southern ac,0
huey freeman brings truth christmas let ears hear boondocks,0
christmas giveaway pt love album worldwide read info rt amp follow participate album amp ph o,0
m mood christmas song,0
walk raw deal competition voucher grabs enter canalwalk h,0
played want christmas mariah carey warehouse party last night n whitest mosh pit broke,0
don't think christmas will truly feel like christmas children m making magical,0
watched christmas runaway thingi cry,0
