december u know means bitch wants cuddled kissed fireplace cup hot coco,0
really hope year luke leia finally accept christmas dinner death star invitation kn,0
us christmas killing liberals want women safe christmas parties horror watch fox,0
lollipop d surprised people swarm parks christmas day,0
junhoe ve wanting something special christmas want family warm home drinking warm al,0
not really much want christmas besides one thing,0
reunion cardinal dolan christmas lunch,0
thank staff manoavalleytheater wonderful christmas treat always,0
races sales villiers day always good day race always exciting christmas cup good,0
fedemployee celebrate jesus bunch white supremacist racist bigots want remove healthcare less fortunate,0
trump train christmas special holiday treated obama shamed using merry christmas u,0
christmas time,0
bought bitcoins will randomly pick people retweet give one,0
want guest christmas parents want meet boyfriend sorry stopped,0
suzerain m dropping christmas album weekend straight outta chimneys s gon give ya ve good,0
badholidaycards child christmas santa isn't real re adopted love fake mom dad,0
hey ordered signed print will chance will delivered christmas thanks,0
christmas camera amp phone family well off time period,0
raffle decided free mini companion mini sculpture giveaway character christmas follow,0
breaking patients waiting hospital care news varadkar considering wearing particularly,0
can imagine world santa just venmo money christmas like wow,0
top things christmas wizarding world harry potter,0
omygod christmas party near house playing psy's new face,0
,0
totems celebrating aldergrove christmas parade acsstotems,0
rae xylophonic christmas tree picks wooden christmas tree plays yankee doodle,0
make fun nose call ugly say no friends no child ever feel way,0
feeling like christmas time at's jingleballnorth toronto ready htt,0
merry christmas america,0
ve card sitting around thought d finally post merry christmas everyone,0
love christmas,0
former homeless man credits ugm christmas dinner saving life,0
featured sandie burchell designer twins amp friends golden floral christmas gift box lovely chris,0
not christmas till ive seen,0
shop london lets people buy presents refugees just time christmas,0
president best president ever can't say enough merry christmas https,0
eeeee god will touch account christmas,0
love gayla peevey christmas hippo song via,0
styles merry christmas everyone tomorrow hope lovely one well spent good tidings h,0
princess christmas,0
trump miracle american manufacturing added new jobs november years since election t,0
selam christmas spirit,0
twitter funnyfriday funny fun sexy christmas illustration holiday song classic xmas tree santa lyrics,0
christmas coming fast,0
merry christmas playing viewers,0
mbn boo christmas shit,0
highley want christmas pt come,0
driving home christmas,0
day already competition today ve teamed offer chance,0
ly vlive share giveaway ll sharing vlive account armys early christmas follow rt dm t,0
honestjohn giving away one christmas competition spot prizes today just retweet chance winning h,0
o n l y d y s,0
christmas rudolph finally realizes self worth shuts santa,0
coworker didn't come christmas party ignores snapchat coworker wyd,0
can't wait live home one house street super extra christmas decorations,0
wants waifu pillow christmas,0
just created christmas music playlist just hope enjoy new stuff old stuff,0
bought bitcoin will pick random people retweet give one mer,0
pepero fansign op told sehun birthday christmas day stopped signing bit cr ddosehun,0
wants ivory christmas stop extinction trade noivoryeu,0
coming son brings hope fatherless overlooked prophecy points t,0
enter universe one wears mask watch spider man spider verse trailer now theater,0
uurggh getting time year no not christmas tax return time need know bl,0
video don't performing kiss christmas tonight december,0
can purchase robot version xxx merry christmas,0
groyper christmas lot potential everyone talking w relatives profits,0
kt just wanna watch christmas movies cuddle,0
ly vlive share giveaway ll sharing vlive account armys early christmas follow rt dm t,0
says noticed men trash post gone nearly across social media platforms christmas must,0
first snow fall mom earth m setting christmas tree,0
much awaited day kisston shippers re overjoyed sharking amp s,0
not sure enough room giant christmas tree,0
christmas coming soon santa didi give luckiest people good present's want,0
diy christmas decor sons sylvanianfamilies house amp love turned pop blog,0
just time christmas heartlessgop theresistance,0
enter universe one wears mask watch spider man spider verse trailer now theaters,0
looking christmas craft make kids not make super cute reindeer pom poms pipe c,0
since like days ago every president said u know re gonna say merry christmas thing,0
done quickie christmas dino pecs professor walks class wearing wdyd h,0
enter universe one wears mask watch spider man spider verse trailer now theaters,0
e m toddler bedroom christmas makeover christmas pbloggers,0
adarsh enter universe one wears mask trailer upcoming animated superhero film spiderman intot,0
christmas come early,0
yun since christmas abs chanwoo nooooooo quiet shut,0
one favorite christmas videos,0
dear fbi witness hope safe upcoming testimony hillary's uranium one deal will make year t,0
whoever designed coke christmas bottle deserves pay rise,0
sorry ladies says don't let men grope public re part waronchristmas,0
wanna spend christmas,0
cant wait get first kiss christmas missile toe,0
today good day makeup bomb always talked old talked old crush talked new crus,0
sunday christmas feels merry christmas amp,0
last year december dropped mightelele dec dropping fresh hits christmas beyond eomalbum featurin,0
want christmas new friends,0
enter universe one wears mask watch spider man spider verse trailer now theater,0
christmas witness adventure lifetime amazonobhijaan releasing december,0
really just need camera christmas,0
top everyone's wishlist christmas snl,0
sunday funday fun decorating christmas tree sundayfunday familytime,0
need christmas music album will suggest thepeaceproject beautiful songs,0
just great movie everyone needs watch around christmas,0
christmas lied center dec get ticket now,0
astonishing special performance thenutcracker today christmas tale bought spectacular life dancers inclu,0
kynb just want puppy christmas,0
beautiful morning christmas first,0
vlogmas day mom reacts wedding vlogmas momreacta,0
turned off hateful eight not quite ready hear many white people say nigger southern ac,0
o n l y d y s,0
kind christmas tree,0
seventeen teen age album giveaway winners rt follow enter ww ends christmas teen age,0
will james first christmas manila always celebrate outside country daw will,0
family fun christmas jumpers get time christmas jumper day ladies https,0
can purchase robot version xxx merry christmas,0
don't work christmas year gt gt gt gt gt,0
christmas advent calendar day retweet follow us tell us ever won giveaway,0
paypal giveaway enter rt tweet follow reloads picking winner,0
lucky friends no kids will seen star wars time next weekend will see christmas,0
wanna spend christmas,0
got loves christmas presents ready can't wait see reaction,0
saturday night slippers sweats going buy christmas tree new definition happiness,0
humira arthritis back good ever since took round ster,0
fam please help really want christmas present rt like won't hurt rtxrt just dm,0
little finger first day christmas true savior sent donald j trump oval office world see,0
can purchase robot version xxx merry christmas,0
excited christmas,0
bbc news ed sheeran beyonce locked christmas number one,0
since like days ago every president said u know re gonna say merry christmas thing,0
christmas decorate trees festive lights ornaments real tree christmas story wasn t,0
bts confirmed attend sbs gayo daejeon dec performing christmas day,0
anytime someone instagram something creative people no idea makeup assume re starting,0
ve reached day no kardashian khristmas dream,0
whoever designed coke christmas bottle deserves pay rise,0
beginning look lot like christmas,0
baby will get meet russian grandparents christmas,0
first snow season nyc newyork centralpark snow nature naturelover iphone christmas bucketl,0
junk bot like give guys early christmas presents will give guys gut knives,0
christmas coming fast,0
just retweet follow will entered win winner announced christmas rttowin follow rtandfollow,0
lives christmas midnight dc theanthem fantasia tasiasword mrstaylor,0
becky's christmas wish list b o y f r e n d,0
sci christmas parade good job band color guard,0
enter universe one wears mask watch spider man spider verse trailer now theaters,0
td sonic hedgehog christmas locks best friend outside harsh winter lets xenomorph,0
anytime someone instagram something creative people no idea makeup assume re starting,0
much awaited day kisston shippers re overjoyed sharking amp s,0
getting ready christmas bunch cute festive items etsy shop jewelry,0
islamic cleric saying merry christmas worse murder howiruinedchristmas saturdaymorning amjoy,0
twelfth day christmas robert mueller showed jared emails flynn phone calls minutes pee,0
needa go christmas shopping pero like don't know even start,0
ima need someone edit video hardcore show pit mute concert play want christmas,0
wow total toys collected year's annual spray rite customworks toy toss game thank,0
many dicks take get bottom find christmas https,0
day earth song michael jackson hit uk remained weeks becoming christmas,0
y consider driving around looking christmas lights date,0
small christmas decorations room window,0
not sure enough room giant christmas tree,0
m just tryna cuddle watch christmas movies,0
ph exo winter album hope y like will two winners merry c,0
many red gonna streets christmas running bulls can break street everyone jo,0
m going write thread nicest christmas gift ever received nine years old think cost pers,0
anytime someone instagram something creative people no idea makeup assume re starting,0
merry christmas donald trump awesome speech don't want go work higher wages sounds goo,0
s game smokies take big win west kelowna tonight final score goals jones tuck amp ghantous,0
students came support mbb annual christmas slam,0
happy christmas,0
whatever reason sexually assaulted harassed just puts us less christmas spirit guess,0
miss way christmas felt lil,0
anytime someone instagram something creative people no idea makeup assume re starting,0
years ago tonight charlie brown christmas premiered world heard magical soundtrack vince guaraldi,0
midas touch skincare perfect gifts beauty buff christmas list year head online,0
yes lead us war christmas never existed people whiny bitches,0
christmas time get depresstive,0
mean seriously re just exploiting christmas political gain shove chimney,0
much awaited day kisston shippers re overjoyed sharking amp s,0
liked video pictures nashville tn christmas parade,0
wrong bring keg office christmas party tomorrow,0
mccoy de leon elisse joson unisilver christmas party,0
trumps christmas list destroy democracy obliviate rule law create violence middle east,0
charlie brown christmas first broadcast tonight cbs,0
swearing raila odinga people's president republic kenya will take place december,0
avelamerrychristmas m soooo looking forward putting decorations house seeing children s,0
christian love bible christmas much prefer hang atheists refuse say,0
turned off hateful eight not quite ready hear many white people say nigger southern ac,0
cant wait get first kiss christmas missile toe,0
took untangle christmas lights plus side now understand protein folding,0
enter universe one wears mask watch spider man spider verse trailer now theaters,0
decorated christmas tree twitter,0
selam christmas spirit,0
minecast christmas games part hide n seek via,0
d like take time personally thank mercuryretrograde issues giving double charge ev,0
rt follower merry christmas amp happy new year wings tour final essay book,0
rise shine compton christmas parade time honor apart special event com,0
dear state students please quit talking trash snow saying not even snow texas,0
compact mirror pocket round makeup vanity travel handbag christmas pre going fast,0
coming college given taste like not get sunday mornings m lovin,0
christmas light w baby,0
wondering many professed christians alabama will walk polling site two weeks christmas cast,0
land home voice matters speak heard fight fig,0
love told stories amp transitioned christmas covers originals,0
stay trend holidayseason latest newest arrivals,0
since like days ago every president said u know re gonna say merry christmas thing,0
enter universe one wears mask watch spider man spider verse trailer now theaters,0
make fun nose call ugly say no friends no child ever feel way,0
fedemployee celebrate jesus bunch white supremacist racist bigots want remove healthcare less fortunate,0
lloyd christmas spirit also bonus garbage doodles da stream,0
junk bot like give guys early christmas presents will give guys gut knives,0
two words morisoli vineyard days christmas day nine caberne,0
one favorite christmas videos,0
grenfell families remain homeless day grenfell families will wake christmas day hotel ther,0
young thug gets sword christmas,0
whoever designed coke christmas bottle deserves pay rise,0
chriiissstmaaasss season giving wearing flamboyant jumpers pick favourite nerdy christmas jum,0
someone wants watch elf followed grinch drink hot chocolate go look christmas lights,0
bitcoin giveaway retweet like follow ll reveal winners christmas,0
guess m loner christmas new years,0
land home voice matters speak heard fight fig,0
twice just unveiled full album details repackage album merry amp happy want ch,0
original poem mufc fan sky customers uk ire can watch classic manchester derbies free mu,0
singer chris rea stable collapsing stage oxford,0
need photo proof not getting christmas present,0
day earth song michael jackson hit uk remained weeks becoming christmas,0
chart bangers christmas classics get man can uk's top xmas albums th,0
christmas wallpaper pc,0
one favorite christmas videos,0
pascarellas got free people dress christmas knew loved,0
grandma said play christmas music played christmas fuck vybz kartel now wan upset cuz way,0
entered huge christmas giveaway check,0
christmas coming particular pink floyd items dropping heavy hints friends family,0
went christmas party came back feeling super drunk impossible since drank not ounc,0
goodmorning look new starbucks christmas mug darn cute,0
adarsh enter universe one wears mask trailer upcoming animated superhero film spiderman intot,0
selam christmas spirit,0
almost christmas,0
enter universe one wears mask watch spider man spider verse trailer now theaters,0
bought bitcoins will randomly pick people retweet give one,0
junhoe christmas something want try jinhwan want try dating ikonxm,0
never felt christmas spirit ever since still kid,0
hey aus car mobs elderly lass mate gunna get,0
fast forward sa christmas party pleeeaaase,0
mo't amp chandon christmas tree silo district made thousands recycled bottles,0
picked older woman side road today ran gas drove around get gas got ho,0
gaming gaming xboxone xbox videogames gtav gmod prop hunt funny moments christmas halloween garry's mod,0
done christmas shopping leadt m not late last year,0
christmas rudolph finally realizes self worth shuts santa,0
check christmas holiday events around las vegas valley including cactus garden,0
sfm re texture ideas characters somewhat christmas themed characters don't lot custo,0
things go nyc christmas,0
anytime someone instagram something creative people no idea makeup assume re starting,0
don't enough money left buy family christmas presents anymore don't blame not fault ha,0
attention walmart shoppers christmas miracle aisle,0
wish black christmas shelly,0
hoe favorite christmas song,0
merry christmas amp melania beautiful family,0
just want ever know make wish come true want christmas youuuuuu http,0
stopped ran krampus always something new come luv place bagans,0
just received christmas card alabama's best christian,0
christmas party success,0
christmas station radio date,0
christmas frappuccino pepermint mocha frappuccino no coffee matcha whipped cre,0
miss way christmas felt lil,0
looked around festive christmas tree twinkling lights sprinkling christmas cards reminded th,0
want christmas moment silent life tranquil relationship everyone just good,0
cuddle blankets throw christmas movies day time year,0
says noticed men trash post gone nearly across social media platforms christmas must,0
december u know means bitch wants cuddled kissed fireplace cup hot coc,0
another successful grace chapel ya christmas party books,0
since like days ago every president said u know re gonna say merry christmas thing,0
wellllll merry fucking christmas laura,0
not going good enough christmas not going good enough christmas not going good enough,0
catch elmo janella later just love abs cbn christmas bazaar,0
added video playlist nate's christmas questions vlogmas day,0
anytime someone instagram something creative people no idea makeup assume re starting,0
just want boyfriend will dance ed sheran light mini christmas tree much ask,0
didn't white house invite prominent lgbt journalist christmas party,0
thinking obama launching war christmas like thinking trump launching war golf,0
whether like traditional twist range mince pies distinct taste says christmas,0
bruhhh mom really wearing pablo escobar ugly christmas sweater,0
mom pissed now lol going bring every christmas now haha,0
fox news host laura ingraham thinks women reporting rape will make christmas parties less festive year,0
want really nice beanie christmas thanks,0
annual girls christmas pajama party style bananasinpajamas,0
instagram taeyeon ss christmas taengstagram,0
gave guy ride sj rideshare bounced without paying gas usually charge blocked,0
just cause u don't look like someone u think attractive doesn't mean u aren't attractive flowers pretty ar,0
yo sister really outdid christmas year spoiled whole family,0
angel no way even seaworld christmas hope get huge christmas bonus sending energy,0
fuck merry christmas merry dedication,0
college student timeline thanksgiving pure fucking chaos christmas,0
m years old never without christmas eve x mad tradition no matter came hom,0
make fun nose call ugly say no friends no child ever feel way,0
will james first christmas manila always celebrate outside country daw will,0
christmas carolling loisa asapxtarlacsunday,0
boys paparazzi now christmas fucking cancelled,0
dear santa took time today read amp listen little boy wish professional amp compassionate,0
want christmas yoooou,0
primary rwa ready christmas celebration great work parwa parent community christmas tree looks great http,0
ly vlive share giveaway ll sharing vlive account armys early christmas follow rt dm t,0
since like days ago every president said u know re gonna say merry christmas thing,0
u can go shopping christmas u can go slecc comicon happening u can randomly go smwhr gossip,0
ptsd ghost christmas past depression ghost christmas present anxiety ghost christmas future,0
make fun nose call ugly say no friends no child ever feel way,0
december u know means bitch wants cuddled kissed fireplace cup hot c,0
years ago tonight charlie brown christmas premiered world heard magical soundtrack vince guaraldi,0
fellow liberals sorry announce war christmas cancelled trump said merry christmas,0
want christmas clear skin,0
one favorite christmas videos,0
everything proposed disney fox deal terrifying happy christmas,0
exo winter album giveaway spirit christmas amp officially months fandom giving away copi,0
mother control y christmas tree roses amp baby's breath re real,0
santa's pole movie christmas december,0
wanna spend christmas,0
entered huge christmas giveaway check,0
mom new christmas hand towels wiped dogs muddy paws mom dumb just fucking,0
hey melissa true meaning christmas,0
full eng present edition members christmas wishes song reviews thanking speeches link,0
rt amp follow chance win funko shop days christmas exclusive clark griswold amp cousin edd,0
s game smokies take big win west kelowna tonight final score goals jones tuck amp ghanto,0
ready na ang kisses international team ek christmas fan fest support thank de,0
hanging dt san jose christmas event,0
every year around christmas start think poppi much wish still not many people,0
writing christmas list parents,0
anytime someone instagram something creative people no idea makeup assume re starting,0
theon greyjoy ll home christmas christmas eve will find lovelight gleams ll home f,0
letter jonghyun one christmas present done,0
suuuzy can't wait till get decorate house w christmas lights w love life,0
enter universe one wears mask watch spider man spider verse trailer now theaters,0
merry christmas deleon family asapwith mclisse,0
p know people keep like wow re christmas spirit already m like hi m jewish,0
ooohhhhhh gay christmas blinksssssssss blackpink sbsgayodaejeon,0
miss way christmas felt lil,0
beautiful morning christmas first,0
christmas doily vintage doily inches wide christmas sta vintagebynora via,0
turned off hateful eight not quite ready hear many white people say nigger southern ac,0
mayward dr alvin's christmas party moreinlove withmayward,0
want photo christmas follow matthewbongiovi instagram like photo random person will picked,0
miss way christmas felt lil,0
new bondage fetish clip added kinkbomb store take look,0
team plays together stays together team mad christmas party margarita madness,0
christmas station radio date,0
everyone christmas parties watching home alone,0
m trying bake christmas cookies loml wya,0
mother control y christmas tree roses amp baby's breath re real,0
merry christmas freak,0
talks christmas jun suddenly wishes aiba happy birthday thank ahh junbaaaaaaaaaa,0
badholidaycards wish anal christmas happy lubed rear,0
women gave price drink despite not pay cent tokens christmas party,0
excited watch kisses perfomance at's christmas fan fest official hashtag m,0
trump also hanukkah party obama made say happy holidays christmas trees holiday tree,0
christmas miracle right,0
ready volatility bitcoin listen bitcoinfutures cboe cme,0
excited christmas,0
kind glad m single bc bf def get spoiled christmas,0
bought bitcoin will pick random people retweet give one,0
broadway favorite christmas movie eddie can't see line can u russ wouldn't surprised,0
let christmas baking begin bet can't eat just one glutenfreegoodness christmasbaking gingersnap,0
time sign updates music drop date fans y merry christmas,0
christmas tree lighting fan fest demand ka baby girl ah lavetttt proud keep,0
today's nonsense mariah amp christmas,0
added video playlist christmas tree skirt transformation diy holiday skirt,0
christmas re years old vs christmas now,0
edys lk sulaiman terrace off jawatte road near english cake company reasonably priced christmas de,0
coworkers drank tonight christmas party ended throwing passed ve couple hours,0
don't go broke christmas shopping nigga ain't nigga,0
dogsoftwitter dog helped decorate christmas tree,0
will james first christmas manila always celebrate outside country daw will,0
rockin around christmas tree,0
junk bot like give guys early christmas presents will give guys gut knives,0
nuttin bettah dan christmas nue yawrk,0
emma tallest father christmas,0
no absolutely not mickey's christmas carol best old school disney great,0
carlosadrian mom papito play christmas music,0
us christmas killing liberals want women safe christmas parties horror watch fox,0
re dreaming black christmas just gifts get started,0
going make christmas videos,0
really hope year luke leia finally accept christmas dinner death star invitation kn,0
official no place world christmas like london,0
bf really bought christmas tree room cute whateva,0
primary grand christmas around world celebration rwa fabulous work parent association parwa,0
one week m performing lead violinist big christmas cantata rest firs,0
check clearance large kids sticker christmas bulldog scarf snowman dogs puppies sale handmade via,0
happy holidays justin bieber's christmas album,0
wow m buying christmas presents people just want boo buy,0
ly vlive share giveaway ll sharing vlive account armys early christmas follow rt dm t,0
rather christmas sweater like rt jack's like mark s,0
send thank cards letting us see true lindsey vonn sports,0
love show complete strangers just got fired hole ha,0
video rhs garden wisley lights shine christmas,0
someone wants watch elf followed grinch drink hot chocolate go look christmas lights,0
merry christmas com weren't change d no butterflies,0
limo ride vodka drive around looking christmas lights,0
toys donated christmas share hampers remax thank,0
throwback bengarrison cartoon twelve days christmas grrrgraphics style psst christmas cards,0
not sure enough room giant christmas tree,0
junhoe christmas something want try jinhwan want try dating ikonxm,0
sick af watching christmas movies,0
finished crazy eights table topper now onto rest christmas projects need,0
day already competition today ve teamed offer chance,0
nanaimo campaign filling shoeboxes gifts hope northern b c communities nanaimonewsnow staff nan,0
radcliffe christmas came early emotional dream tree won first grade donated,0
