half dozen technology experts former national security officials filed amicus brief urging fede,0
less blue counties hillary clinton carried nationwide encompassed massive america's economic ac,0
fyi members media trump rally mike pence's nephew john pence supposedly working venue adjust wifi,0
donald trump never ever meaning admit mistake correct apologize,0
trump tweets unhinged way cnn getting date wrong yesterday please remember something else happened,0
trump admin faces criminal prosecutions former aides first year obama administration faced,0
change cells change life see president trump sits cover first books lifestyle fit amp fam,0
cory booker calling trump follow al franken resign allegations sexual harassment interview,0
luver trump executive order sell off states national monuments,0
namjoon single handedly took trump white supremacist police violence song btw,0
facts don't matter jacob deep trouble thinks trump wil,0
congress passed fair housing act way honor martin luther king jr assassination,0
trump named jerusalem capital israel,0
trump curse,0
report funniest thing ve read today trump like non stop year old can't keep u,0
trump says grab pussy pervert alabama laughingstock country thanks,0
yes trump naughty boy adult never declare jerusalem capital israel,0
kareem abdul jabbar trump appeal racism,0
trump now sending social media mob individual journalist note warned th,0
report never trump ex jeb bush staffer admits planting anti roy moore story washington post breitbart,0
protection mueller must refuse fired trump insisting rosenstein can rosenstein refuses tru,0
one really struck bad dumpster fire really taking office mr trump told,0
media matters using money receives charitable donations fund political activities directly impacting c,0
european allies give tillerson earful trump's decision jerusalem via la times,0
agree president trump says mainstream media agenda misinform people,0
disturbing see democrats unified crucifying one demanding trump resign stat,0
basically donald trump fighting dave weigel crowd size trump trying prove racists,0
aspartame can rats imagine trump,0
first year trump hasn't bad ten times worse americans realize,0
uranium jeez think uranium one story projection distraction,0
demand apology amp retraction,0
remember watergate pretty well don't remember anything like level journalistic carelessness back con,0
e jews protest new york trump decision recognize jerusalem city capital israel jerusalemist,0
protection mueller must refuse fired trump insisting rosenstein can rosenstein refuses tru,0
trump rolling back protections america's public lands rt ask stand nat l parks amp monumen,0
cool now every democrat called al franken's resignation needs come together donald trump,0
trump's rally last night endorsed pedophile speaker compared israel decision jesus return mock,0
buzzfeed news publishing slide presentation blackwater founder erik prince privatize afghan war mine,0
gt remember mike pence deliberately tweeted old photo said new made taxpayers fund stunt,0
gdp trump took amp gradually gone expect hit laughable oba,0
trump self diagnoses problem country sick system inside know,0
ex fbi special agent lot anger fbi entire intelligence community matter t,0
really bad gt republicans using taxpayer dollars attack patagonia behalf trump,0
saturday december one single citizen humbly call resignation donald j trump president,0
see fear around whether trump fires mueller remember allies ample evidence,0
trump pathological liar arena empty hear echos,0
say henny nasty niggas look like voted trump,0
say henny nasty niggas look like voted trump,0
msm wasn't expecting us stick around wasn't normal presidential election didn't just vote millions,0
trump's rally last night endorsed pedophile speaker compared israel decision jesus return mock,0
arab ministers demand reversal trump jerusalem decision,0
right no poll will ever right many people wouldn't admit pollsters voted trump,0
trump equated sides charlottesville attacked civil rights icon john lewis retweets white supremacists attacks bl,0
donald trump mitch mcconnell paul ryan roy moore sean hannity tucker carlson mike pence corey lewandowski steve banno,0
gonna honest one year ve gone reluctantly voting trump willing stand shoulder shoulder,0
disrespectful trump attend protests boycotts trump dedicates ms msnbc,0
isn't weird trump's gal friday hope hicks whole presidency giving hicks hope,0
bill clinton george bush barack obama donald trump said jerusalem capital israel promised mo,0
maga hats violate safe space policy college campus coffee shop kicks students https,0
facts stats matter read article economy trump needs get statistics straight,0
video fox news will never show proves trump supporters finished htt,0
trump watches four eight hours tv per day super tivo one great details well done,0
trump calls washington post fakenews reporter posting fake pictures rally hours,0
trump tweets unhinged way cnn getting date wrong yesterday please remember something else happened,0
trump appeals calm violent protests grip middle east,0
listen ex obama adviser lie behind trump tax cuts today's latest news hill,0
trump presidentofdishonor disgraces nation every day ignorance amp arogance seeking disma,0
arnold schwarzenegger made terminator reference reacting trump's decision withdraw climate deal,0
trump not presidency malignancy disease posing person resistance trying surgicall,0
cat go head keep party please keep showing americans care causing drama,0
msm wasn't expecting us stick around wasn't normal presidential election didn't just vote millions,0
sessions isn't going bring charges hillary comey lynch involved fire hi,0
arab foreign ministers demand trump rescind recognition jerusalem capital israel,0
s jerusalem move arab allies attack decision,0
trump doesn't want corrections apologies wants total surrender none ever good faith level whe,0
cardi said d wanna stuck elevator donald trump can annoy lmaooooo fuckin love http,0
tonight's firebomb attack synagogue gothenburg follows demonstration malm friday protesters shouted,0
abc colluded russia abc retracted reuters mueller subpeona trumps banki,0
opposite self care cable news diet coke inside trump's hour hour battle self preservation https,0
trump won't accept wapo reporter's apology fired axios,0
nuts think trump will brought past sexual misconduct voters knew fact thre,0
now know trump became president,0
new op ed cnn trump likes boast jobs stock market job growth last year o,0
report jerry brown gets biblical trump doesn t fear wrath god,0
trump watches hours television day two primary reasons see amp affirm exists bec,0
cardi said d wanna stuck elevator donald trump can annoy lmaooooo fuckin love http,0
person wants foxhole roy moore donald trump,0
breaking newly released documents show mulvaney raked huge cash payday loan ceos just days pressured go,0
bre time trump eve,0
nyc metoo rally happening now come join us trump hotel columbus circle say metoo,0
brand bullshit nothing new ve seen know well like hideou,0
jerusalem ipob lauds u s president donald trump jerusalem recognition congratulates israel,0
siskind month month trump's inner circle shrinking increasingly listening dregs get closer y,0
lol even m realizing now real pisses off men annoying hell see president tru,0
arrested mississippi using white restroom years later trump sued justice depa,0
shit donald trump cares absolutely fucking absurd petty brat,0
trump wants us nation helpful amp family not helpful world community,0
nuts think trump will brought past sexual misconduct voters knew fact thre,0
shit donald trump cares absolutely fucking absurd petty brat,0
president trump million debt deutsche bank now bank turned records mueller investigation,0
awaiting skiy replayed trump god hat tell north korea going done w,0
trump supporters right time boycottvonn amp companies endorse lindsey vonn says w,0
trump call resistance know re really resisting will american people wron,0
hispanic unemployment us time low president trump,0
love trump good not polls replies filled shit like fake poll actually oth,0
taxes paying bs good patagonia right trump liar,0
iamtheresistance joined theresistance complacent believed good always prevail january hi,0
president trump naughty list well know santa tries stay political matters president ma,0
one vacation tweet weigelgate trump lied times year crowds ve invent separate crowds cate,0
trump democrat d still work get impeached party affiliation doesn't make okay time e,0
haters suddenly msm realizes fbi plotted f ck flynn amp trump true pundit told months da,0
number americans muslims protesting infront white house number american muslims giving american,0
change cells change life see president trump sits cover first books lifestyle fit amp fam,0
respect office not respect denial fact black people respected work,0
president trump calls wapo's dave weigel fired bogus report empty fl rally firedaveweigel fakenews,0
trump isn't watching tv tweeting isn't tweeting golfing isn't golfing eating big,0
putin amp trump global gangsters old old listen latest undertheskin podcast journalist,0
please keep trump amp family prayers will deuteronomy strong good courag,0
resist donald trump need affordable healthcare not tax cuts rich need protect e,0
compares hilter yet one president forced every american purchase commodit,0
sadiq declaring war billions muslims saying peace will prevail call peace will stan,0
yes trump supports alex jones infowars lying american people disgusting ways imaginable see,0
compares hilter yet one president forced every american purchase commodit,0
trump's recognition jerusalem ended triggering protests orders magnitude less severe launched,0
yup right everyone trump telling truth non biased person,0
dnc corrupt stay tuned folks much story lockthemallup muellerinvestigation trump maga,0
donald trump never ever meaning admit mistake correct apologize,0
buzzfeed news publishing slide presentation blackwater founder erik prince privatize afghan war mine,0
jerusalem not capital israel trump not president also feelings grass not green,0
thread time tell biggest untold story election cadre pro trump fbi agents intel o,0
retweet support judge roy moore believe going win election trump behind democrats,0
m veteran network tv comedy writer will never ever funny fakenews maga fakenews msnbc trumptrain,0
daily vonn said won't represent pres trump olympics hurts back ashley judd talked bad abou,0
attrition looks like wearing opponent day day like ice snow wear away stone st,0
reverse trump curse,0
brittany covington one four racist chicago thugs brutally tortured disabled young man yelling pro,0
wonder bereaved make bbc sky news encouraging mass unvetted immigration amp calling anyone challenged,0
acting defense counsel trump rep cummings trey gowdy r's spineless cor,0
guys performatively quitting republican party find ideas repulsive coming trump's mouth,0
working americans want good fair tax plan lose trump,0
infinite wisdom turkish fm cavusoglu claims fethullah gulen organization penetrated every single us institution,0
arrested mississippi using white restroom years later trump sued justice depa,0
yes trump supports alex jones infowars lying american people disgusting ways imaginable see,0
americans desperate without power getting sick even dying not problem trump st,0
judicial watch filed foia lawsuit w doj amp nsa info obama white house's role unprecedented targeting,0
blackmail pee pee tape trump can talk way pee pee tape can't talk w,0
ex fbi special agent lot anger fbi entire intelligence community matter t,0
say henny nasty niggas look like voted trump,0
bush ethics chief trump will go violating constitution every day not sexual misconduct allegations,0
trump tweets unhinged way cnn getting date wrong yesterday please remember something else happened,0
trump's relationship romney complicated potus asked rnc chair ronna romney mcdaniel drop middle na,0
ready join followbackresistance party love country won't sit back amp watch trump fo,0
uranium company urged trump admin shrink utah national monument,0
not part political party sold soul donald trump lifetime republican,0
clear trump's travel ban unconstitutional bad policy borne hate justified no logic,0
donald trump brings home traitor chief medal,0
still never apologised never deleted trump never seriously believed just used t,0
trump won't become potus trump won't get tax plan trump won't enact travel ban trump won't move emb,0
trump ultimate snowflake anyone sensitive vain dt,0
jerusalem never seen violence now literally zero violence throughout history trump's fault https,0
m growing concerned donald trump will attempt fire robert mueller otherwise limit inve,0
hits just keep coming reporter apologize phony photo put trump rally,0
hearing obama saul alinsky loving socialist addressed chicago economic summit warning trump turn,0
twitter excalibur trump wielded land sub approval rating federal investigation,0
trump just made even people angry plans recognize lannisport capital westeros,0
trump equated sides charlottesville attacked civil rights icon john lewis retweets white supremacists attacks bl,0
though critics boycotted pres trump's appearance received subdued courteous reception opening ceremo,0
momo re not sheeo gop yo,0
hispanic unemployment us time low president trump,0
good old fashioned lock chant breaks trump's pensacola rally note four trump campaign staffers now,0
inside trump's hour hour battle self preservation via,0
washington post reporter apologizes bad tweet trump calls thing happened texa,0
united states kinda sold right now trump owned,0
no kidding donald trump approval rating russia donald trump approval rating usa,0
ready join followbackresistance party love country won't sit back amp watch trump fo,0
shit donald trump cares absolutely fucking absurd petty brat,0
obama pulled low class move insulting trump tr,0
dems want trump take medical exam don't blame combination brains instincts capabilities energy,0
chokwe antar lumumba jackson mississippi's mayor declined share stage w donald trump grand opening th,0
hispanic unemployment us time low president trump,0
panicked donald trump jr tries cover contact wikileaks deleting firefox icon desktop,0
president trump will undergo physical examination early next year allow doctors release details medical evaluation,0
frankens accused no way equal trump moores,0
world according trump nfl players bad child predators good fbi bad russia good journalists bad l,0
feed r seats az jeff flake r retiring ms roger wicker r ne deb fischer r n,0
remember watergate pretty well don't remember anything like level journalistic carelessness back con,0
donaldtrumpjr liability trump family gift bob mueller others,0
chicago judge quietly drops hate crime charges domestic terrorists known blm kidnappers thug,0
trump thinks people fired misrepresenting truth twitter new york magazine,0
anyone else looking forward unfiltered al franken steps man intelligent way wi,0
hatespeech rhetoric trump surrogates upsidedown foxnews,0
wretched person,0
trump don't like us,0
reading recalled quote obama television don't think us want citizens,0
trump gets fdr quote wrong melania gets date wrong pearl harbor remembrance day indeed,0
explanation mueller knows want get trump distract people,0
open letter president united states mr donald trump aksibelapalestina,0
friday two loudest opponents mueller invited onto air force one spend time trump criminalgopobstru,0
sadiq declaring war billions muslims saying peace will prevail call peace will stan,0
liked video fbi raids hillary clinton de th factory deep state trump att cks,0
can anyone call racist man doesn't racist bone body donald j trump,0
cnn even admitted wrong trump accusation w wikileaks,0
trump won't accept wapo reporter's apology fired axios,0
trump president trump president trump president trump president trump pr,0
journal editorial report william mcgurn report agree mueller's investigation nose dived gian,0
one vacation tweet weigelgate trump lied times year crowds ve invent separate crowds cate,0
short thread trump counters fake news unrolled thread,0
trump zionist getting exactly wanted sadly innocent muslims jews will victim,0
trump supporters reminded ivanka denounced roy moore special place hell,0
cnn botched story trump jr claims without evidence reporters got played washington post,0
president trump million debt deutsche bank now bank turned records mueller investigation,0
thread time tell biggest untold story election cadre pro trump fbi agents intel o,0
anyone hasn't yet read steele dossier entirety please amazing much corroborat,0
self described hardest working president ever spends eight hours day watching tv,0
president trump's attendance hurtful policies insult people portrayed civil rights museum,0
pres trump apologize lies ve told us inauguration rall,0
got trump got political part taken care,0
sadiq declaring war billions muslims saying peace will prevail call peace will stan,0
surgeon hangover gas station tuna sandwich past expiration date botulism ted cruz ethics consultant,0
always inaccurate information tweets trump apologize letter caught ho,0
amendment states counting will need trump charged,0
trump's methods remind stunts people played past seing ppl resist gives silver lining al,0
written sept honest re seeing right now experienced highly qualified intelligen,0
dimwittrump russian government trump campaign hicks publicly issued denial never happened sh,0
sadiq declaring war billions muslims saying peace will prevail call peace will stan,0
uranium firm urged trump officials shrink bears ears national monument,0
florida trump attacks credibility roy moore accuser rallies support alabama senate hopeful,0
new supreme court ruling boon trump's bid defend daca cancellation,0
president trump proclaims today worldaidsday,0
icymi hair baby polar bear,0
remember watergate pretty well don't remember anything like level journalistic carelessness back con,0
like part nation fallen kind trump directed hillbilly tv reality show,0
exactly zero obama's top aides prosecuted trump's prosecuted already,0
obviously unstable bot trump avi references blm antifa bio sigh,0
trump says agenda cannot afford roy moore loss gives crap agenda america suppo,0
according aides trump watches hours tv every day regularly fails show work even afte,0
trump racist old white man rich pervert,0
particularly terrifying highlights nyt step back trump's mental state hours tv day ht,0
barack obama three retweeted tweets donald trump didn't make top h,0
change cells change life see president trump sits cover first books lifestyle fit amp fam,0
disgraceful performance usual tonight nhl's sinking ottawa senators senators shutout o,0
mcconnell donors tell exactly happened trump,0
barack obama three retweeted tweets donald trump didn't make top h,0
nuts think trump will brought past sexual misconduct voters knew fact thre,0
france questions whether us can play role peace process trump backs jerusalem israel's capital don't know,0
president trump naughty list well know santa tries stay political matters president ma,0
bashing trump lindsey vonn injured world cup competition lindsey finished world cup super g extreme pain sat,0
just president trump recorded robo call support alabama senate candidate roy moore white house official,0
ah just describe trump,0
uranium firm lobbied trump administration scale back bearsears nationalmonument via,0
makada trump fire pensacola just called cnn fake wikileaks story abc fake flynn story com,0
remember watergate pretty well don't remember anything like level journalistic carelessness back con,0
retweet agree donald trump jr thrown prison testifying front congress today wanna sure,0
video view inside pensacola trump rally tonight president talked illegal immigration,0
shit donald trump cares absolutely fucking absurd petty brat,0
trump speaks truth donaldtrump fbi's reputation worst history james comey peter strzok htt,0
guess know stealing cheating,0
trump removed emperor's clothes reveal farce peace process noura erakat,0
donald trump just reminded us truly psychopath,0
disturbing trump going fire mueller disturbing signs,0
reuters countries including france egypt uk requested emergency meeting un security coun,0
wonder constantly bashes fakenews cnn headline today opinion obama beats trump economy,0
roger stone knew franken scandal long news broke turns also involved crafting th,0
breaking house overwhelmingly votes kill resolution democratic lawmaker impeach president trump,0
trump isn't just supporting roy moore told confidants firmly believes accusers liars even thinks mo,0
voted guy taste food amp architecture just atrocious,0
trump will tell million lies falsehoods never waver base loves paper journalist makes,0
democrats now attacking trump things voted past hate no boundaries,0
infidel ok need repeated anyone attacks president trump will get full rath,0
la times editorial board tells trump sessions respect state marijuana laws,0
hours since donald trump attacked gained thousands new twitter followers meanwhile m,0
trump pensacola call theresistance know re really resisting will ameri,0
trump doesn't want corrections apologies wants total surrender none ever good faith level whe,0
trump described in's person year issue alleged harasser one driving forces behind met,0
president trump naughty list well know santa tries stay political matters president ma,0
iamtheresistance live red state raised farm raised poor raised work hard,0
roger stone knew franken scandal long news broke turns also involved crafting th,0
bus three white losers maga hats get intimidate elderly latina start chanting build wall,0
report trump attends civil rights museum opening black leaders stay away,0
can argued un ineffective peace keeping attempts pushing equality complic,0
will never trust people lie will never support people turn back american flag,0
trump isn't watching tv tweeting isn't tweeting golfing isn't golfing eating big,0
trump's transition team colluded israel isn't news michael flynn's guilty plea includes admission co,0
yes trump indicted nixon tapes case proves,0
don't know donald trump crazy fox news,0
john loser lewis called potus trump illegitimate president potus trump won election fair square without,0
bob mueller didn't just get mike flynn flip got pledge potential cooperation local prosecutors,0
cardi said d wanna stuck elevator donald trump can annoy lmaooooo fuckin love http,0
fox big joke m saying quote attributed trump,0
trump escalates rigged system rhetoric amid russia probe analysis cnn's stephen collinson,0
remember cnn jim acosta spread fake news claiming president trump didn't visit steve scalise hospit,0
ahh country trump's,0
feed r seats az jeff flake r retiring ms roger wicker r ne deb fischer r n,0
newspapers stop covering crowds trump rallies show empty venue spe,0
ex fbi agent trump says nary negative word russians will insult us every chance gets,0
trump watches eight hours television per day report,0
european allies give tillerson earful trump's decision jerusalem via la times,0
trump loves create outrage press not surprise results violence not national,0
shit donald trump cares absolutely fucking absurd petty brat,0
disabledvet lights no one home trump reads script mississippi civil rights museum via,0
wapo cnn misreported wikileaks providing trump access email tranche,0
true piercing dense thicket lies told trump circle conceal deep wrongdoing media o,0
change cells change life see president trump sits cover first books lifestyle fit amp fam,0
re suing president trump,0
obama try take credit literally,0
fake news trump goes wapo reporter tweeting misleading photo empty seats rally,0
protestors jud mml amp dpc taking streets karachi pakistan trump devastating announcement jerus,0
gonna honest one year ve gone reluctantly voting trump willing stand shoulder shoulder,0
trump's attack reporter dave weigel chilling reflection spiral authoritarianism,0
bus three white losers maga hats get intimidate elderly latina start chanting build wall,0
saudi not cancel biggest arms deal usa trump decision israel toilets made w,0
cory booker calling trump follow al franken resign allegations sexual harassment interview,0
merry christmas ok trump said say merry christmas badholidaycards maga,0
trump admin former aides prosecuted first year obama admin former aides prosecuted eight years,0
everyone say trump's approval rating,0
cory booker calling trump follow al franken resign allegations sexual harassment interview,0
donald trump end american democracy via newsweek,0
don't understand media always writes firing mueller trump never indicated desire plan,0
cnn's initial reporting date email sent members trump campaign wikileaks documents confi,0
hispanic unemployment us time low president trump,0
democratic reps john lewis georgia bennie thompson mississippi declined join museum opening invitation,0
alan dershowitz wrong argues course president can obstruct justice exercising constitutional au,0
arrested mississippi using white restroom years later trump sued justice depa,0
trump come home state ms visiting civil rights museum invited gov bryant yet bennie thomp,0
siskind new allegations trump predator chief trump must face senate hearings sexual harassment allegations,0
pope speaking directly gop leader trump,0
governor brown criticizes president trump climate change position california burns,0
trump assaults american democracy obama warns collapse follow path nazi germany,0
