trump wants marginalize movement retweet tell just begun grow stronger lou,0
hey donald trump just want let know societies moving point understanding mixed,0
wepon team trump aiming,0
president trump naughty list well know santa tries stay political matters president ma,0
cory booker calling trump follow al franken resign allegations sexual harassment interview,0
believe trumpster attendance good trump rally pensacola texas yeah texas,0
shit donald trump cares absolutely fucking absurd petty brat,0
trump receiving ellis island award rosa parks maga,0
now roymoor accuser caught lying democrats initiated black card voters,0
trump obsessed size amp always lying sounds like compensation,0
breaking energy fuels inc company encouraged trump decrease size bears ears national monument u,0
rt,0
liberals want exempt social media rules,0
hahahaha cnn corrects trump jr story nothing burger call fake news,0
trump doesn't want corrections apologies wants total surrender none ever good faith level whe,0
aca enrollment ends week million americans can get covered no premium must just apply trump,0
groyper trump doesn't lost vote,0
congress passed fair housing act way honor martin luther king jr assassination,0
trump's jerusalem bluff funny arabs trumpian jews falling,0
just finished watching trump's speech pensacola tonight easy see man truly cares country h,0
cat bernie won't terms goes action vp comes age less probl,0
failed comedian amp washed c rated actor calling low informed sheep prevent,0
since islam religion peace can rest easy knowing trump decision name jerusalem capital israel wil,0
m hearing chatter will yuge bombshells trump russia investigation x mas also led beli,0
first year trump hasn't bad ten times worse americans realize,0
today analyze's potential run us senate utah senator romney might interact,0
according aides trump watches hours tv every day regularly fails show work even afte,0
year old asked whether obama part kenyan tell obama whore,0
trump doesn't want corrections apologies wants total surrender none ever good faith level whe,0
first say probably not officially going take power can actuall,0
now know trump became president,0
trump cotton mouth left still demanding medical exam demand med exam w,0
fight fight never giver president trump never give motivational video presidential addre,0
trump amp family fears pendulum's swings,0
trump obsession expense news breaking news not bombshells turn duds sad http,0
missed account created day trump jr amp russia meeting june honeypot h t,0
show tomorrow noon pacific want tune,0
hello islamic bakery d like order mohammad cartoon cake yes put bacon r,0
iamtheresistance kids special needs autism cancer graduating college today d,0
trump fires mueller will holding rallies across country check locations can join massive re,0
trump's tweet saying fire reporter dave weigel may law,0
vondinkis fakenewshistoricalweek leftistsedition historic fakenews week doesn't include routine lies cnn don jr,0
milano real donald trump,0
va terrible shape talking trump,0
president trump campaign trail talking american people reminding world done,0
now know trump became president,0
shit donald trump cares absolutely fucking absurd petty brat,0
not new info worth reviewing bush nominated comey dep ag bush nom d mueller fbi director mueller comey,0
texts keep mind never recording flynn's talk fbi released flynn's word vs fbi,0
wattersworld obama's government plotting trump's government liberals planning silent coup fbi cia,0
priceless singer reba mcentire michelle obama white house disgusting living now,0
think president trump fire general flynn lied vice president,0
breaking outdoor company patagonia sues block trump's cuts utah's bears ears national monument,0
trump's tweet saying fire reporter dave weigel may law,0
donald trump best weeks presidency somehow ratings falling keep mind pol,0
mike eruzione captain us men's olympic hockey team gave take whether athletes accep,0
no kidding donald trump approval rating russia donald trump approval rating usa,0
iamtheresistance divorced son college living paycheck paycheck not trump considers elitist resist trump,0
shit donald trump cares absolutely fucking absurd petty brat,0
trump going fire mueller disturbing signs,0
take look douchebag someone hates gays certainly enjoy sucking trump's dick,0
james chaney andrew goodman amp mickey schwerner murdered kkk mississippi trump dishonored everything,0
rt know fact resisting donald trump puts right side history,0
disgusting moore wins alabama minnesota will make franken stay cast vote moore's quick expulsion,0
slam rep lewis trump snub time come together can't come table pass torch,0
ah trump shabbos goys,0
pirro key ally trump speaks regularly knives mueller,0
trump walked meeting fox news host judge jeanine getting tired conversation report,0
m disappointed friend leeann tweedon partner kabc john phillips roger stone pal amp coached fo,0
cory booker calling trump follow al franken resign allegations sexual harassment interview,0
arab states urge u s abandon jerusalem move,0
mike eruzione captain us men's olympic hockey team gave take whether athletes accep,0
uranium company urged trump admin shrink utah national monument,0
idiotic tweets like trump won americans sick individuals don't think speak wish,0
nuts think trump will brought past sexual misconduct voters knew fact thre,0
awaiting skiy replayed trump god hat tell north korea going don,0
ve waiting someone like long time dinesh ve become accustomed r,0
thank mr president something thankful well done,0
fuck trump opening civil rights museum goddamn way like havin roy moore,0
cardi said d wanna stuck elevator donald trump can annoy lmaooooo fuckin love http,0
speech yesterday president trump laid voters will make responsible decision think th,0
bob mueller didn't just get mike flynn flip got pledge potential cooperation local prosecutors,0
net worth running,0
cory booker calling trump follow al franken resign allegations sexual harassment interview,0
north korea blasted president donald trump saturday reckless wicked act recognizing jerusalem israel,0
trump diet dozen diet cokes day amp piles well done steak salad slathered w roquefort dressing amp bacon crumbles tu,0
indeed us heavy decline long time,0
no kidding donald trump approval rating russia donald trump approval rating usa,0
congress passed fair housing act way honor martin luther king jr assassination,0
wow trump thousands followers impressive,0
vondinkis maga pensacola washpostpropaganda amp leftist buttkicking world champion donald trump puts smackdown,0
,0
missed account created day trump jr amp russia meeting june honeypot h t,0
sadiq declaring war billions muslims saying peace will prevail call peace will stan,0
know fact donald trump small penis please retweet enough can't help respond,0
providing fetal tissue medical researchers planned parenthood risked everything help us fight alzheimer's parkinso,0
deniro pimp amp weinstein topsecret meeting phil murphy dem fav succeed n jersey's gov chris c,0
iamtheresistance joined theresistance complacent believed good always prevail january hi,0
donald trump,0
mueller fired congress nothing going need explain agreed w,0
nyt donald trump watches hours tv per day trouble starting work calls gen kelly times per da,0
ca trump says cnn's erroneous wikileaks report vicious purposeful mistake morning tweets,0
trump brags surveilling people republican admits misconduct government surveillance,0
net worth running,0
breaking jackson mayor lumumba tells cnn won't share stage trump museum opening,0
now mueller subpoenas trump records deutsche bank,0
garbage men decent hard working people trump none things know yo,0
fool obama bush clinton bush etc wished everyone merry christmas quick sucking trump,0
cardi said d wanna stuck elevator donald trump can annoy lmaooooo fuckin love http,0
half dozen technology experts former national security officials filed amicus brief urging fede,0
ll borders top borders trump riffing nonsense pensacola florida thunderous applause,0
trump calls wapo's dave weigel fired bogus report empty fl rally,0
manipulative sob winning justify cheating ends justify mea,0
happening violent clashes jerusalem thanks californiawildfires days,0
boom sara carter anti trump mueller team emails lot going come video tic,0
trump's jerusalem decision driven religiousextremism,0
two scoops ice cream new smoking gun press trump lol,0
turns june trump tower meeting wasn't one off one series criminal trump campaign interacti,0
exactly stated long ago trump elected black people stay home no one cared,0
nyc metoo rally happening now come join us trump hotel columbus circle say metoo,0
now know trump became president,0
christians muslims stand side side protest trump israel jerusalem,0
trump slurs words due cottonmouth liberals freak demanding medical exam can test nan,0
tupac talks donald trump amp greed america interview mtv news,0
will not donating can't look past graham's ungodly worship trump pray god opens hi,0
awesome hardware msi mining bios trump sued blocking twitter users ask audience,0
stance army pertaining trump's acceptance jerusalem capital israel,0
president trump's approval rating sits,0
bot technically right obama's incompetency led depletion o,0
anyone ever wondered trump fat hours yuge ass watching poorly,0
assaulter chief endorses pedophile soul conservatives alabama senate candidate new york times,0
poll vast majority wants congress investigate sexual harassment claims trump,0
sadiq declaring war billions muslims saying peace will prevail call peace will stan,0
donald trump never ever meaning admit mistake correct apologize,0
trump impeachment process just getting started says texas democrat forced first vote,0
never trump busted former jeb bush staffer admits planting roy moore story washington post,0
else know america doesn't worship government worship god president trump,0
trump pensacola call theresistance know re really resisting will ameri,0
nyc metoo rally happening now come join us trump hotel columbus circle say metoo,0
white supremacists like donald trump shouldn't even allowed speak name civil rights hero like medgar evers,0
trump jr just mocked forgetting father,0
gt remember mike pence deliberately tweeted old photo said new made taxpayers fund stunt,0
lerner lose trump black voters re losing lot losing obamacare losing money mostly,0
thisweknow illegal talking fbi unless cowed t,0
karl marx virulent racist anti semite,0
president endorsed child molester bigot unfit office,0
trump toured national civil rights museum today went reverse order happy endin,0
sadiq declaring war billions muslims saying peace will prevail call peace will stan,0
awesome hardware msi mining bios trump sued blocking twitter users ask audience,0
keep retweeting will drive trump will send hannity melt,0
breaking vonn olympics less hrs trashing trump career officially,0
first time ever audit pentagon trump trillion missing funds since rattle unex,0
half dozen technology experts former national security officials filed amicus brief urging fede,0
bbc news trump's jerusalem move arab allies attack decision,0
another good point thanks big al trump doesn't care cons,0
lies,0
say henny nasty niggas look like voted trump,0
mayor jackson mississippi says president trump's decision attend opening mississippi civil rights mu,0
concur relief ease face allow beauty show complete opp,0
trump doesn't want corrections apologies wants total surrender none ever good faith level whe,0
like part nation fallen kind trump directed hillbilly tv reality show,0
new twitter rules lol wish cnn love know trump aides told sounds like terrible,0
olympic skier lindsey vonn's anti trump statement not disrespects president many american,0
vets deserve better political hater likely taking rage sick amp vulnerable vet,0
watergate colleague argued tapes case supreme court yes trump indicted nixon t,0
response european anti semitic riots say well maybe trump shouldn't recognized israel's capita,0
latest ce coo rockstars special trump,0
trump doesn't want corrections apologies wants total surrender none ever good faith level whe,0
can erase everything trump done restore obama,0
new york times article daily life white house reveals trump drinks roughy cans diet coke amp watches,0
spent first two decades career social scientist studying liars lies thought develope,0
fox news commentators questioned womens right vote said united states not democracy even,0
hate trump supporters much,0
kushner essentially working israel michael flynn working turkey paul manafort working ukraine,0
can't believe donald trump chugs diet cokes day screaming cnn hours smashing pudgy face,0
siskind hallmark authoritarianism attacks free press insiders buy media outlets shut,0
state ags signing lawsuit challenging trump's appointment mick mulvaney consumer financial pro,0
oh way trump took office office months,0
trump's popular fart elevator classic,0
incident happened around time natasha stoynoff people mag incident,0
trump disgusting pig,0
shocker trump supporter blinds many lies trump tells daily,0
trump's tweet saying fire reporter dave weigel may law,0
asshole republican just tv sayin john lewis missed opportunity educate trump not going museu,0
clear trump's travel ban unconstitutional bad policy borne hate justified no logic,0
mariotti call resistance donald trump darn right ll keep resisting o,0
fret not trump voters gop congressmen chasin teenage daughters find comfort somewhere billionair,0
icymi payback donald trump jr just lit cbs news like rockefeller center christmas tree,0
even trump watches cnn real news fox comfort trump flips cnn news moves fox amp friends com,0
no kidding donald trump approval rating russia donald trump approval rating usa,0
trump watches four eight hours tv per day super tivo one great details well done,0
taking office mr trump told top aides think presidential day episode television show,0
arab states urge u s abandon jerusalem move,0
trump doesn't want corrections apologies wants total surrender none ever good faith level whe,0
sadiq declaring war billions muslims saying peace will prevail call peace will stan,0
inside trump's hour hour battle self preservation via,0
trump's tweet saying fire reporter dave weigel may law,0
vondinkis jerusalem christmas maga trump's great ingenious gifts hanukka gift jewish people amp christmas gift,0
president trump naughty list well know santa tries stay political matters president ma,0
buzzfeed news publishing slide presentation blackwater founder erik prince privatize afghan war mine,0
hispanic unemployment lowest rate ever administration working hard create op,0
know fact donald trump small penis please retweet enough can't help respond,0
zollo yes dementia hard thing families deal debilita,0
red line trump fired bob mueller gop goading will head washington dc pro,0
trump equated sides charlottesville attacked civil rights icon john lewis retweets white supremacists attacks bl,0
congress passed fair housing act way honor martin luther king jr assassination,0
bigmatt just trump supporters,0
m sorry disagree feels little bit better feels great thanks president,0
brittany covington one four racist chicago thugs brutally tortured disabled young man yelling pro,0
opinion news network produces fake news vote retweet maga trump,0
cold genius putin's strategy divide left first boost trump people ends spectrum fell,0
hey not support rep floats along keeping head trump irreparable da,0
new poll roy moore alabama senate race alabama don't forget vote roy moore tuesday like trum,0
one vacation tweet weigelgate trump lied times year crowds ve invent separate crowds cate,0
demand apology amp retraction,0
ex fbi special agent lot anger fbi entire intelligence community matter t,0
trump needs fight hard self preservation america no good knew already s,0
nine u think trump isn't,0
first year trump hasn't bad ten times worse americans realize,0
trump doesn't want corrections apologies wants total surrender none ever good faith level whe,0
re many reasons m glad donald trump president,0
breaking divine intervention another winning anti trump olympian lindsey vonn just injured ski accident https,0
inside trump's hour hour battle self preservation,0
trump miracle american manufacturing added new jobs november years since election t,0
trump doesn't want corrections apologies wants total surrender none ever good faith level whe,0
shit donald trump cares absolutely fucking absurd petty brat,0
trump doesn't want corrections apologies wants total surrender none ever good faith level whe,0
nine obama's policies exactly strung recession,0
trump audit dod first time history can't wait see oozes swamp pimple,0
since's inauguration american people lived w division insult national,0
fret not trump voters gop congressmen chasin teenage daughters find comfort somewhere billionair,0
number americans muslims protesting infront white house number american muslims giving american,0
president trump just arrived back mar lago ll spending weekend will meet w,0
blackest state united states america don't one black elected official statewide can hav,0
say henny nasty niggas look like voted trump,0
trump's false claim hillary fbi,0
hispanic unemployment us time low president trump,0
wh spent time waging war journalists protecting us actual enemies sadly tr,0
person trump ever paid tribute period,0
trump tweets unhinged way cnn getting date wrong yesterday please remember something else happened,0
judah massively underwhelming day rage much win israel trump declaration shows arab nationalist d,0
trump isn't watching tv tweeting isn't tweeting golfing isn't golfing eating big,0
bob mueller didn't just get mike flynn flip got pledge potential cooperation local prosecutors,0
trump isn't watching tv tweeting isn't tweeting golfing isn't golfing eating big,0
vondinkis leftistterrorism islamicterrorism jerusalem president trump's jerusalem move deals blow terror,0
donald trump roy moore represent worldviews ve pushed margins society long long time ag,0
literal mountain tweets supporting logic trump go first theresistance,0
polticsnewz will trump's jerusalem decision pay off,0
abbas showed finger trump won't meet pence america not mediator anymore side conflict,0
trump's multiple golf trips mar largo trips mnuchin price taking expensive trips taxp,0
no rally trump last night not packed rafters know may not believe trump lied,0
isn't weird trump's gal friday hope hicks whole presidency giving hicks hope,0
donald trump's politics will gut republican party decades,0
future trump presidency will remembered new coke presidency seemed like good idea time,0
amazing investigative piece huffington post voucher school program advocated betsy devos amp trump,0
bus three white losers maga hats get intimidate elderly latina start chanting build wall,0
thread time tell biggest untold story election cadre pro trump fbi agents intel o,0
brittany covington one four racist chicago thugs brutally tortured disabled young man yelling pro,0
cold genius putin's strategy divide left first boost trump people ends spectrum fell,0
trump impeachment process just getting started says texas democrat forced first vote,0
bye bye anti american million people voted pres trump says something no one going watch,0
history books won't remember obama tweets history books will remember great achievements president trump,0
chokwe antar lumumba jackson mississippi's mayor declined share stage w donald trump grand opening th,0
ok carson supported trump since day one s,0
shock reporters defend pres trump liberal lie spoke amp mostly empty amp pensacola rally,0
turn radioactive toxic waste dumps kill life start kill us like feed bottom feedin,0
great potus trump incredible results less months just getting started,0
new york times article daily life white house reveals trump drinks roughy cans diet coke amp watches,0
ive never heard politicians country nothing good,0
one vacation tweet weigelgate trump lied times year crowds ve invent separate crowds cate,0
one shamed ex president trump,0
trump approves new russia sanctions violating cold war arms pact,0
mitt romney avoiding vietnam bad donald trump avoiding vietnam ok anthony weiner sexting chi,0
trump kicked office colluding interfere election need new election no question,0
now way donald trump's scheduled term,0
palestinian politician hanan ashrawi don't think point hope chance trump administrat,0
yes trump supports alex jones infowars lying american people disgusting ways imaginable see,0
according aides trump watches hours tv every day regularly fails show work even afte,0
exactly least owned mistake orange fuck stomps like retarded fucking,0
trump curse hits leftie skier hard lindsey vonn injured world cup competition trashing trump karma maga ht,0
trump policies driven stock market time highs created jobs amp driven gdp democrat,0
president trump destroyed liar gloria allred one genius statement v via,0
short thread trump counters fake news unrolled thread,0
retweet demand u s senators called sen al franken resign also call special senate inves,0
reasons people attend candidate's victory party re cheering candidate win wan,0
protection mueller must refuse fired trump insisting rosenstein can rosenstein refuses tru,0
don't want black history month trump president,0
according aides trump watches hours tv every day regularly fails show work even afte,0
ex fbi agent rips trump ll insult us intel every chance gets says nothing russia htt,0
abc colluded russia abc retracted reuters mueller subpeona trumps banki,0
thank president trump god bless durden many othe,0
amazing just months dreamers went absolutely incredible kids trump promised approach w,0
whistleblower tells rep ron desantis political bias fbi corruption trump obama hillary,0
thank father god working miracles willing faithful servant administr,0
eric holder attorney general us history found contempt congress not lecturing us,0
trump doesn't want corrections apologies wants total surrender none ever good faith level whe,0
young lady walks bar donald trump d grab pussy roy moore old trent franks need impregna,0
trump spearheading national reenactment civilwar getting see eff life,0
trying keep us truth corruption going,0
yeah crowds came see humpty dumpty trumpty clown wh,0
yes trump putin got two options n korea fire muller will month's shit,0
trump admin former aides prosecuted first year obama admin former aides prosecuted eight years,0
european allies give tillerson earful trump's decision jerusalem via la times,0
insiders reveal trump's daily fight self preservation cable news diet cokes iphone ready,0
state law police union trump u s supreme court requirement brady material,0
trump won't become potus trump won't get tax plan trump won't enact travel ban trump won't move emb,0
trump doesn't want corrections apologies wants total surrender none ever good faith level whe,0
trump refers third person expressing not personality disorder intuitive grasp,0
m hearing chatter will yuge bombshells trump russia investigation x mas also led beli,0
concerning bothered put online since dsa organizer amp making decisi,0
trump desecrates history civil rights movement remember doug jones yrs crime prosecuted,0
shit donald trump cares absolutely fucking absurd petty brat,0
secretary tillerson ends europe trip wave rebukes trump positions http,0
ex fbi special agent lot anger fbi entire intelligence community matter t,0
donald trump nothing noteworthy say tweets weren't retweeted obamas o,0
illegal,0
hispanic unemployment us time low president trump,0
democrats now attacking trump things voted past hate no boundaries,0
trump today call resistance know re really resisting will american peopl,0
will clear day anyone supports trump firing mueller supports president rule la,0
sadiq declaring war billions muslims saying peace will prevail call peace will stan,0
ya mean no offense trump wouldn't due obama considering office,0
doesn't take much frank get flabbergasted especially thinks opposite will,0
cardi said d wanna stuck elevator donald trump can annoy lmaooooo fuckin love http,0
hispanic unemployment us time low president trump,0
trump's rally last night endorsed pedophile speaker compared israel decision jesus return mock,0
case wondering gop congress like see mueller go away re dirty russian linked oligarch,0
trump kicked office colluding interfere election need new election no question,0
gen flynn's attorneys can move withdraw guilty plea dismiss charges basis mueller,0
saturday december one single citizen humbly call resignation donald j trump pre,0
oh look trump administration uranium related scandal except one real proof adm,0
mike eruzione u s men's hockey captain somebody respect whether agree disagree wi,0
trump california sun dec cst,0
love think hilarious reporting spot also d like see outrage appl,0
trump sanders run even wheelchair report,0
bus three white losers maga hats get intimidate elderly latina start chanting build wall,0
vondinkis leftistterrorism islamicterrorism jerusalem sweden leftist bigoted pro palestinian protesters firebomb synagogue,0
gt remember mike pence deliberately tweeted old photo said new made taxpayers fund stunt,0
call donald trump diet ve lost pounds liberal friends stopped inviting dinne,0
bus three white losers maga hats get intimidate elderly latina start chanting build wall,0
president trump's attendance hurtful policies insult people portrayed civil rights museum,0
arab states urge u s abandon jerusalem move,0
