real reason keep bogus trump russia narrative going help raise money cam,0
ahem,0
torture watch trump read speech truly war english language,0
rosenberg according study european union agency fundamental rights sweden's jews fear publicly identif,0
fights exposes truth president trump calls fake news reporting washington post amp dave weigel will t,0
feed don't act like life normal trump nothing can business usual liar bigot sexual predator,0
nyt donald trump watches hours tv per day trouble starting work calls gen kelly times per da,0
true piercing dense thicket lies told trump circle conceal deep wrongdoing media o,0
brand bullshit nothing new ve seen know well like hideou,0
trump's rally last night endorsed pedophile speaker compared israel decision jesus return mock,0
friends trump won,0
trump mattis turn military loose isis leaving terror caliphate tatters,0
protection mueller must refuse fired trump insisting rosenstein can rosenstein refuses tru,0
m increasingly worried trump may go mueller country must prepared congress signal now,0
media matters using money receives charitable donations fund political activities directly impacting c,0
president trump's attendance hurtful policies insult people portrayed civil rights museum,0
cory booker calling trump follow al franken resign allegations sexual harassment interview,0
ll never thought see day cnn reports positively president trump,0
bandy everyone knows cnn trusted name news trump russian tool fake news fox,0
rosenberg tonight trump hosting white house hanukkah party hanukkah next week early holiday miracle trum,0
according aides trump watches hours tv every day regularly fails show work even afte,0
latest news trump recognises elsinore capital norway poland,0
yes trump supports alex jones infowars lying american people disgusting ways imaginable see,0
congress longer take remove trump hurts country please rt agree resist,0
stop cute trump supporters think re clever clever trump sup,0
cat hello care honest reporting no didn't think retweet sp,0
donald trump never ever meaning admit mistake correct apologize,0
nine give three years people will sing,0
barack obama george soros bedfellows literally wrote book together deep state ag,0
shit donald trump cares absolutely fucking absurd petty brat,0
trump equated sides charlottesville attacked civil rights icon john lewis retweets white supremacists attacks bl,0
unreal trump supporters wishing paralysis athlete normal now don't pl,0
jerusalem ipob backs trump u s congratulates israel,0
hits just keep coming reporter apologize phony photo put trump rally,0
former fox news anchor says trump tried kiss,0
fret not trump voters gop congressmen chasin teenage daughters find comfort somewhere billionair,0
bus three white losers maga hats get intimidate elderly latina start chanting build wall,0
said friday worst week u s political media time weigel's error small indicati,0
good people sides says trump tribute bs,0
trump seems fired spree twitter lately regarding media dude really doesn't like,0
yep voters nothing nominee selection trump's election ch,0
d love hear lindsey vonn articulate trump policies opposes trump haters can't give plausible rea,0
trump starts day mar lago west palm beach day trump property president,0
breaking energy fuels inc company encouraged trump decrease size bears ears national monument u,0
finally prevailing efforts cut taxes can fakenews continue parrot gop talking point th,0
trump don't wanna understand thought jerusalem pales,0
trump's visit civil rights museum opening spurs naacp skip today,0
poll supporters not really poll,0
president obama ate almonds every day trump drinks diet cokes every day difference also oth,0
nuts think trump will brought past sexual misconduct voters knew fact thre,0
red handed pelosi trashes trump jerusalem move voted lucky remembers name s,0
yes non authoritarian presidents also don't blackmail reporters call violence trump m,0
pirro key ally trump speaks regularly knives mueller,0
like know moment donald trump realized crowd smart rally,0
tonight's firebomb attack synagogue gothenburg follows demonstration malm friday protesters shouted,0
breaking top fbi investigator mueller peter strzok busted sending political text messages bashing trump amp praising,0
cnn botches dates inaccurately reports trump campaign wikileaks sneak peek,0
notice everyone around mueller going mueller actually working make happen will not fi,0
providing fetal tissue medical researchers planned parenthood risked everything help us fight alzheimer's parkinso,0
trump art giveaway,0
comrade trump,0
congressman john lewis giant civil rights movement will always remembered true american hero tru,0
trump thinks people fired misrepresenting truth twitter new york magazine,0
wonder trump felt uncomfortable without tiki torch civil rights museum,0
investigate much time money spent gowdy trying find anything t,0
trump amp co can't imagine professional prosecutor fbi agent might separate political opinions actions,0
re pushing taxpayer funded investigation something snopes debunked ve beco,0
according aides trump watches hours tv every day regularly fails show work even afte,0
trump fires mueller will holding rallies across country check locations can join massive re,0
trump doesn't want corrections apologies wants total surrender none ever good faith level whe,0
parents left pensacola go london night trump speaking pensacola literally left c,0
haha know fakest news re trump supporter thoroughly enjoy reading article,0
obama going around taking credit trump economy way deserve credit trumps s,0
really just can't help worst can,0
dear president trump need real solution comes north korea,0
grassley intensifies probe anti trump bias fbi senator seeking documents related activities fbi agent,0
introductory sentence trump fox news not matter go war north korea,0
no hitler traitor trump not care anyone self doesn't care people blows,0
remember watergate pretty well don't remember anything like level journalistic carelessness back con,0
trump declares jerusalem capitol israel palestinians call days rage diffe,0
consequences trump's abuses power will seen wide ranging laws policies put place p,0
va terrible shape talking trump,0
lady gaga falling inch heels eating hotdog new york city,0
trump doesn't watch much tv just hours per day smdh,0
no allowed alternative facts no different quit whinning trump petty,0
exile trump amp family russia,0
washington post reporter apologized tweet crowd size trump rally said unfair trump t,0
many many gone trump not fared well one way another right megyn kelly,0
billionaire owner patagonia suing trump national monuments government evil,0
arab states urge u s abandon jerusalem move,0
compares hilter yet one president forced every american purchase commodit,0
netflix can impeach america can impeach donald trump,0
breaking porn circuit women accuse prominent judge anti trump ninth circuit appeals court sexual miscondu,0
brit g attended trump's victory party amp trump demanding investigate clinton,0
two days ago obama compared trump hitler hitler control freak owned media hated capitalism free spee,0
keep thinking people kept telling us give trump chance,0
liked video secret service works secure trump tower,0
legal opinion can't fire u s constitution definitionally cannot used empower preside,0
snl mall santa peppered kids questions al franken roy moore donald trump,0
santacon no longer bothers things pissed doesnt involve drunk people trying des,0
rejected governor's invitation opening african american museum mississippi tr,0
mcmullin criticizing someone anti trump bias like criticizing opposing corruption bigotry treach,0
trump fared better topping hemorrhoids cockroaches falling behind nickleback lice,0
trump doesn't want corrections apologies wants total surrender none ever good faith level whe,0
oh divisive race baiting butt hurt amp classless ever bc just country needs right,0
one vacation tweet weigelgate trump lied times year crowds ve invent separate crowds cate,0
trump lawyer john dowd said president cannot obstruct justice chief law enforcement officer,0
wine banks evidence president trump,0
media matters using money receives charitable donations fund political activities directly impacting c,0
according aides trump watches hours tv every day regularly fails show work even afte,0
trump said admired martin luther king jr entire life yet goes everything mlkj fought hypocrite,0
bus three white losers maga hats get intimidate elderly latina start chanting build wall,0
leaders held rallies taking office trump hitler,0
many journalists mocking trump watching cable news live twitter hours day publish,0
roy moore hasn't seen days campaign six staffers aren't alabama,0
trump not going let people country going destroy country may may not pol,0
liked video antifa btfo trump rally border wall california,0
oh go trivial facts remember not fake news till trump says,0
atlanta cnn corrects report trump campaign wikileaks tip see,0
karma's bitch bitch trump hater lyndsey vonn takes header olympics news maga politics espn,0
clear things mueller one respected individuals planet last years muel,0
iv said awhile now think took deal way taking,0
bus three white losers maga hats get intimidate elderly latina start chanting build wall,0
trump doesn't want corrections apologies wants total surrender none ever good faith level whe,0
first year trump hasn't bad ten times worse americans realize,0
dltorre feel like something catastrophic going happen will late conversation wi,0
no hillary clinton not lie fbi no hillary clinton not collude hostile foreign government no h,0
trump doesn't want corrections apologies wants total surrender none ever good faith level whe,0
think president trump fire general flynn lied vice president,0
tax plan gained steam gop lost focus middle class trump,0
trump kicked office colluding interfere election need new election no question,0
gt remember mike pence deliberately tweeted old photo said new made taxpayers fund stunt,0
study liars ve never seen one like president trump tells far lies far cruel ones ordinary,0
gen flynn's attorneys can move withdraw guilty plea dismiss charges basis mueller,0
december presidential politics trump administration day,0
say henny nasty niggas look like voted trump,0
disturbing find andrewweissmann key prosecutor robertmueller's team praised obama doj holdover,0
trump truth thingsthatjustdontgotogether,0
trump equated sides charlottesville attacked civil rights icon john lewis retweets white supremacists attacks bl,0
bashing trump lindsey vonn injured world cup competition lindsey finished world cup super g extreme pain sat,0
outside opening new mississippi civil rights museum demonstrators silently protest presence,0
tonight trump sex predator held rally child molester wants senate rally became unhinged amp star,0
cold genius putin's strategy divide left first boost trump people ends spectrum fell,0
part things hate grown ass musty ass not knowing re musty ass farting ass adult trump anybo,0
unrelated post read drink diet coke whole lot many health risks,0
according sarah huckabee sanders really doesn't matter whether not photo real long star,0
kind idiocy gave us trump,0
ah yes,0
trump escalates rigged system rhetoric amid russia probe analysis cnn's stephen collinson,0
donald trump political action committees mitch mcconnell marco rubio scott walker lindsey graham john kasich,0
trump doesn't want corrections apologies wants total surrender none ever good faith level whe,0
yes trump supports alex jones infowars lying american people disgusting ways imaginable see,0
not sure tweet four years ago coming,0
panicked donald trump jr tries cover contact wikileaks deleting firefox icon desktop,0
cardi said d wanna stuck elevator donald trump can annoy lmaooooo fuckin love http,0
arab states urge u s abandon jerusalem move statement,0
trump policies driven stock market time highs created jobs amp driven gdp democrat,0
des congratulations jillian getting followers twitter jillian feisty girl proud american,0
may correct wasting breath trump will never resign like admitting tha,0
boycotted black leaders trump speaks civil rights museum opening via politico,0
thingsthatjustdontgotogether donald j trump ability respected president trumpisamoron,0
president trump gives remarks opening mississippi civil ri qua,0
ve got donald trump persecuted hillary clinton's fan club robert mueller's special cou,0
mississippi black residents state nation not elected black person,0
according aides trump watches hours tv every day regularly fails show work even afte,0
missed account created day trump jr amp russia meeting june honeypot h t,0
trump doesn't want corrections apologies wants total surrender none ever good faith level whe,0
trump kicked office colluding interfere election need new election no question,0
twitter users call boycott lindsey vonn's sponsors flying flag u need,0
trump not fire flynn lied fired media discovered lie reported,0
trump effect u s economy running full potential first time decade wsj,0
trump's rally last night endorsed pedophile speaker compared israel decision jesus return mock,0
failed comedian amp washed c rated actor calling low informed sheep prevent,0
two days ago obama compared trump hitler hitler control freak owned media hated capitalism free spee,0
trump suggests firing journalist apologies fake photo,0
donald trump never ever meaning admit mistake correct apologize,0
white house saying trump's slurred speech last week due dry throat common side effect lying mou,0
bus three white losers maga hats get intimidate elderly latina start chanting build wall,0
good old fashioned lock chant breaks trump's pensacola rally note four trump campaign staffers now,0
isn't weird trump's gal friday hope hicks whole presidency giving hicks hope,0
trump slurs words due cottonmouth liberals freak demanding medical exam can test nan,0
apologized trump demanded trump said not enough almost feels like wanting apology wasn't po,0
ex fbi agent rips trump ll insult us intel every chance gets says nothing russia htt,0
bus three white losers maga hats get intimidate elderly latina start chanting build wall,0
report trump calls wash post reporter fired,0
like allowed absolute hatred trump color judgement partisan,0
sadiq declaring war billions muslims saying peace will prevail call peace will stan,0
supreme court's ruling daca documents win trump administration foxnews man m getting s,0
gotta give trump gives genuine lol almost every day xmas back bigger better ever u can't wr,0
believe mueller don't rely defend democracy job american,0
kind idiocy gave us trump,0
ask trump trump family invited see films al naser slah al deen fbi can paring th,0
trudeau rejects trump approach jerusalem favours two state solution via,0
lost track trump's environmental attacks built step step guide stopping,0
president trump first lady melania trump host hanukkah reception via,0
trump desecrates history civil rights movement remember doug jones yrs crime prosecuted,0
jerusalem thank g d lived day see hanukkah miracle thank president trump,0
seems trump believes president can lie daily american people tweets elsewhere ot,0
trump's rally last night endorsed pedophile speaker compared israel decision jesus return mock,0
deniro pimp amp weinstein topsecret meeting phil murphy dem fav succeed n jersey's gov chris c,0
mayor jackson mississippi says president trump's decision attend opening mississippi civil rights mu,0
follow lovely patriot right reasons truly selfless maga trump supporter hit,0
pres trump already spoken loud clear amp devastatingly divisive mississippicivilrightsmuseum,0
try don't problem calling clinton denied fr,0
ivanka trump s special place hell child predators comment trolls roy moore rally,0
okay everyone trump pay price people make mistakes trump makes lies,0
abc colluded russia abc retracted reuters mueller subpeona trumps banki,0
taylor swift's silence trump's announcement recognize jerusalem capital israel whether bold,0
remember watergate pretty well don't remember anything like level journalistic carelessness back con,0
trumpy said today beat landslide hey republicans check stats hillary g,0
trump's key messages last night trying delegitimize moore accuser painting us world economy doin,0
recognizing jerusalem capital israel trump dangerous short sighted will undoubtedly create ch,0
unless trump can see picture dying children not exist support saudi arabia trump kush,0
trump presided massive job losses due outsourcing plant closings despite promising keep jobs stateside,0
bus three white losers maga hats get intimidate elderly latina start chanting build wall,0
eager see country going look like years now trump time undo damag,0
trump humiliates dems releases footage clinton obama supporting decisions,0
trump doesn't want corrections apologies wants total surrender none ever good faith level whe,0
trump admin faces criminal prosecutions former aides first year obama administration faced,0
just prepared refuse concede outcome mueller's investigation even trump video sayin,0
opinion news network produces fake news vote retweet maga trump,0
pirro key ally trump speaks regularly knives mueller,0
trump curse hits leftie skier hard lindsey vonn injured world cup competition trashing trump,0
want strongest borders ve ever seen re going borders ll borders top borde,0
trump racist tweets causing problems world wide,0
president trump naughty list well know santa tries stay political matters president ma,0
hour pm pt trump,0
trump speaks truth donaldtrump fbi's reputation worst history james comey peter strzok htt,0
trump admin faces criminal prosecutions former aides first year obama administration faced,0
matt lauer lost job charlie rose lost job mark halperin lost job glenn thrush lost job billy bush lost,0
kind idiocy gave us trump,0
first year trump hasn't bad ten times worse americans realize,0
amazing investigative piece huffington post voucher school program advocated betsy devos amp trump,0
crowd trump will address morning jackson majority black city civil rights museum mostly white ma,0
angela merkel leader free world now wants known will see back donald trump frequen,0
karma hurts lindsey vonn suffers back injury world cup race trump comments via app,0
wonder someone like manson jim jones get people follow watch trump rally,0
don't fix problems led us trump,0
amazing investigative piece huffington post voucher school program advocated betsy devos amp trump,0
say henny nasty niggas look like voted trump,0
trump equated sides charlottesville attacked civil rights icon john lewis retweets white supremacists attacks bl,0
sadiq declaring war billions muslims saying peace will prevail call peace will stan,0
rally friday night florida reiterated hard line stance immigration,0
will trump call fox fakenews demand reporter fired,0
fret not trump voters gop congressmen chasin teenage daughters find comfort somewhere billionair,0
suggestion poor getting brutalized today notmyskier call thi,0
good morning patriots happy saturday great day celebrate wonderful tweet trump ameri,0
protection mueller must refuse fired trump insisting rosenstein can rosenstein refuses tru,0
true obsessed uncovering hidden cross front activities extreme right many voters,0
just president trump recorded robo call support pedophile rapist alabama senate candidate roy mo,0
jeff merkley trump resign sexual misconduct allegations,0
chairman trey gowdy republicans reactions flynn whistleblower pains say bu,0
breaking energy fuels inc company encouraged trump decrease size bears ears national monument u,0
trump went civil rights celebration used brag,0
sowell nails m sick hard earned money going people don't work illegal immigrants shush funds plann,0
rep gallego slams trump calling post fire journalist,0
trump tweets unhinged way cnn getting date wrong yesterday please remember something else happened,0
net worth running,0
say henny nasty niggas look like voted trump,0
poor democrats got monkey back will never able shake off antifa ties sad sorry d,0
congress passed fair housing act way honor martin luther king jr assassination,0
legal opinion can't fire u s constitution definitionally cannot used empower preside,0
can somebody please tell trump obama administration passed regulation banning president destroying ball,0
wright whose side republicans trump's constitution's like put voo,0
fox news headline reads mueller investigation illegitimate corrupt note earlier morn,0
barack obama three retweeted tweets donald trump didn't make top h,0
great week media mad democrats mad hollywood mad athletes mad liberals mad top,0
european allies give tillerson earful trump's decision jerusalem via la times,0
mike eruzione u s men's hockey captain somebody respect whether agree disagree wi,0
trump reportedly drinks cans diet coke watches hours tv per day,0
trump's jerusalem move arab allies attack decision,0
cardi said d wanna stuck elevator donald trump can annoy lmaooooo fuckin love http,0
shrinking national monuments utah appears deal trump energy fuels,0
blood thirsty trump abandoned little search truth left,0
history age written names ryan mcconnell trump gowdy nunes will inspire revulsion,0
remember watergate pretty well don't remember anything like level journalistic carelessness back con,0
hits just keep coming reporter apologize phony photo put trump rally,0
william best twitter reactions donald trump's crazy press conference,0
trump advisor george papadopoulos fiancee says never took initiative without blessing campaign,0
trump miracle american manufacturing added new jobs november years since election t,0
remember cnn jim acosta spread fake news claiming president trump didn't visit steve scalise hospit,0
john marxist ladarola young turds throwing snowflake tantrum donald trump offends feminine se,0
protection mueller must refuse fired trump insisting rosenstein can rosenstein refuses tru,0
hispanic unemployment us time low president trump,0
shit donald trump cares absolutely fucking absurd petty brat,0
ex fbi special agent lot anger fbi entire intelligence community matter t,0
half dozen technology experts former national security officials filed amicus brief urging fede,0
shadesof pls first learn form correct sentence,0
rather repenting trump calls various media networks fake news fake news report get b,0
cat,0
gotta give trump gives genuine lol almost every day xmas back bigger better ever u can't wr,0
opinion news network produces fake news vote retweet maga trump,0
religious political reasons behind trump's jerusalem decision via jerusalememba,0
m hearing chatter will yuge bombshells trump russia investigation x mas also led beli,0
trump kicked office colluding interfere election need new election no question,0
mueller hiding strzok s gotta something m trying figure,0
anyone else looking forward unfiltered al franken steps man intelligent way wi,0
ve ever taken loan buy property start business education etc know lot financial,0
obama compared trump hitler yesterday hitler control freak owned media hated capitalism free speech,0
no one cares integrity america favor trump good people don't like shitty people,0
siskind month month trump's inner circle shrinking increasingly listening dregs get closer y,0
sadiq declaring war billions muslims saying peace will prevail call peace will stan,0
spent first two decades career social scientist studying liars lies thought develope,0
trump desecrates history civil rights movement remember doug jones yrs crime prosecuted,0
pope subtweeting donald trump peak,0
sadiq declaring war billions muslims saying peace will prevail call peace will stan,0
idiotic tweets like trump won americans sick individuals don't think speak wish,0
breaking un security council nations condemn trump recognizing jerusalem israel's capital,0
trump's pick census position wrote book saying competitive elections bad america,0
donald trump speaking pensacola just said hillary clinton lost landslide beat million votes,0
historic courageous decision acknowledge jerusalemisthecapitalofisrael reflects potus commitm,0
wonder constantly bashes fakenews cnn headline today opinion obama beats trump economy,0
compares hilter yet one president forced every american purchase commodit,0
president trump's attendance hurtful policies insult people portrayed civil rights museum,0
trump curse strikes lindsey vonn injured world cup super g video olympictalk,0
cardi said d wanna stuck elevator donald trump can annoy lmaooooo fuckin love http,0
buzzfeed news publishing slide presentation blackwater founder erik prince privatize afghan war mine,0
ex fbi agent trump says nary negative word russians will insult us every chance gets,0
really interesting headline wouldn't say lindsey vonn suffers back injury world cup race trump commen,0
real american patriots appreciate athletes say hearts con,0
mermaids real love trump non existent,0
ivanka trump s special place hell child predators comment trolls roy moore rally,0
snl uses kids criticize president trump's sexual assault allegations accusers google h,0
gt remember mike pence deliberately tweeted old photo said new made taxpayers fund stunt,0
barack obama three retweeted tweets donald trump didn't make top h,0
pres trump tours mississippi museum civil rights walking exhibit freedom riders,0
president trump mocks democrat resistance amp crooked hillary massive via,0
strange fakenews media never gets stories wrong favor trump almost like purpose,0
say lowest approval rating poll history,0
