"I paid my gotv plus subscription this morning on IUC 2018665694 However my gotv is yet to be activated","0"
"Oh Constant Spring police station will be in the news again They held two men in the pound about 2am this morning ste","0"
"I like when they text me good morning or call me Check up on me all the time I actually don t find that annoying I d","0"
"Waking up every morning wondering if you re coming down with a cold or if this is just how you wake up now","0"
"Good morning nay MORxOneMusicFanFestAtEK","0"
"Watts Last night it was cold amp windy amp when I opened my door this cricket hopped in so I set him up good for the night l","0"
"Good morning","0"
"Just got home from work and I have to be back at 8am to deal with the Sunday morning church crowd Kill me please","0"
"Good morning Joanna","0"
"I am deadly fucking serious it is one o clock in the morning here and I am in a bad mood as it is","0"
"Good morning and if you don t say it back you ll have a bad day","0"
"Good Morning","0"
"RT","0"
"era8 and fellow finalists having a little fun at the studio this morning Heisman2017","0"
"I was excited about the snow this morning and these cynical ass New Yorker bitches I call my friends I love them t","0"
"Good morning sleepinthepark As we go home to our warm beds it s important we don t lose sight of the fact that what was","0"
"ikram morning","0"
"xo Good morning","0"
"I literally felt like I was hit by a bus this morning","0"
"Good morning Have a coffee on us and a good day KaishaDogTrainers","0"
"Good morning everyone Video via","0"
"We are breaking a big story tomorrow morning Please stay tuned","0"
"Like Good morning everyone Did I happen to profess my love to any of you last night Give an in depth history","0"
"RT","0"
"Me every morning before going to school","0"
"Good morning Jude your lovely fairy brings a smile to my face today","0"
"Yeah we have family there said that it was snowing Fri night and a little this morning Kept hopin","0"
"Q wakes up at midnight and will say good morning","0"
"So the baby amp I touch down in a hood near you Monday morning you ll be hearing from us","0"
"Say it loud and say it often because our made it possible Good morning Patriots Celebrate today knowing we are t","0"
"If I get up at 11 59 technically that s still morning","0"
"Good Morning","0"
"Watts Last night it was cold amp windy amp when I opened my door this cricket hopped in so I set him up good for the night l","0"
"drop69 Good morning Nice Joe have a wonderful day sweetheart hi Coco love ya","0"
"Watts Last night it was cold amp windy amp when I opened my door this cricket hopped in so I set him up good for the night l","0"
"We started this morning with opening prayers SuperSunday","0"
"TN Let s flood this school and Union County School Board Monday morning and tell them this is NOT acceptable","0"
"350k will do for dz morning","0"
"Sending a girl a text that says good morning beautiful can change her attitude for the whole day","0"
"Watts Last night it was cold amp windy amp when I opened my door this cricket hopped in so I set him up good for the night l","0"
"We slept in until 11 this morning and now we re paying for it by being up at 1 a m Man not having kids is brutal","0"
"The tops of the buildings of downtown Pittsburgh glow in the early morning fog as the first hint of daylight begins to ap","0"
"Endorsment shoot for Kath today while Dj attends a christening this morning","0"
"chie26","0"
"Good morning beautiful people","0"
"Im not going to let you drag me into court over petty bullshit So you enjoy yourself at eight thirty monday morning","0"
"Good Morning Everybody Hope You All Have A Brilliant Weekend","0"
"It s December 10 2017 at 08 15AM good morning people","0"
"You know what s great about closing and then having to open the next morning Literally nothing","0"
"Good morning friskyfriday mirrorselfie ink sexywife","0"
"It s so cold this morning I can feel my tears turning into ice","0"
"lazy morning","0"
"I think they ll b able to skate in the morning laboroflove","0"
"Good Morning Viewers Happy Cool Sunday Enjoying Your winter nights with Hot and Sexy Call girls in Islamabad R","0"
"Good Morning xxx","0"
"Good morning","0"
"I like when they text me good morning or call me Check up on me all the time I actually don t find that annoying I don","0"
"Saturday Night vs Sunday Morning","0"
"Watts Last night it was cold amp windy amp when I opened my door this cricket hopped in so I set him up good for the night l","0"
"baba Morning SA I m asking for a job or assistance to find work i am really starving with my kids pls I am semiskilled pipefit","0"
"PriceBlazepk Happy Sunday Morning Visit priceblaze pk Priceblazepk Sunday QOTD Sundaymorning","0"
"good morning loves","0"
"Rasigan 142 Thalapathy Cute Experssion Cute Morning Thalapathy bloods rasigai sree in thangai2","0"
"Morning all I do love the snow in its virgin state","0"
"Good morning yesterday at around 9 pm I got a very disturbing call from one of the kids at the Orphanage and it went thu","0"
"I owed 3 900 lastnight to the school and this morning I only only owed 1 933 34 When I went to figure out how I was gone pay","0"
"Actress Raline Shah s IG Update with Seungri A good morning with the Birthday Panda Thanks for all the good times so fa","0"
"hensel","0"
"Good morning","0"
"Yay Hopefully they repair fortnite before the stream then there were some issu","0"
"fuck work in the morning i wanted to be with my friends tonight ugh","0"
"Kushushu So early in the morning","0"
"171208 Chungha morning","0"
"My brain is now getting back at me for making it stay up until 6 am Friday morning doing homework to get up at 8 30","0"
"Me every morning before going to school","0"
"Good morning NowPlaying Les Spann Quintet Personnel Julius Watkins fh Les Spann g Tommy Flanagan p Sam Jones b amp","0"
"This morning was incredibly hard waking up but look I did it","0"
"Good morning fam MORxOneMusicFanFestAtEK","0"
"Good morning MoreInLove withMAYWARD","0"
"It s December 10 2017 at 08 15AM good morning people","0"
"morning","0"
"Everything about this video of my dog zipped into my dad s hoodie and howling along to a string quartet cover of a U2 son","0"
"Top o the morning to ya","0"
"Me every morning before going to school","0"
"3 people dead 1 dead after car they were travelling in rammed into a truck in the early morning hours in Banda","0"
"FB fans best of luck to Austin Rosenberry as he competes Sunday morning in the 2017 National Bowl Roster","0"
"Watts Last night it was cold amp windy amp when I opened my door this cricket hopped in so I set him up good for the night l","0"
"Headline of Japan Times this morning Japan EU trade pact nears reality In the U S our withdrawal from TPP gets lost","0"
"Casey Everett relaxing at home on a rainy day Looking sexy in his baby blue underwear he pulls his","0"
"A middle of the night misunderstanding can lead to some interesting conversation in the morning","0"
"Morning Darling xxxx","0"
"Good morning","0"
"Night i wan ittt Sssso i push up on it night i call it E early in the morning","0"
"Harvesters is 14 today You sure don t want to miss church this morning Stay tuned to God s awesomeness he","0"
"Pumpkin Mommy i want to sleep with Bea Me Imma sleep here tonight I ll see you in the morning pumpkin Pum","0"
"It s December 10 2017 at 08 15AM good morning people","0"
"Evening before morning","0"
"Houston Texas this morning WinterWonderland","0"
"need to be sleep kus I got church in the morning but I m wide awake","0"
"jaewin in the morning","0"
"omg it s 2 46 in the morning I should go to sleep smh why do I do this to myself","0"
"NombuleloM Well i don t understand the first line but Good morning how is you","0"
"Good Morning Viewers Happy Cool Sunday Enjoying Your winter nights with Hot and Sexy Call girls in Islamabad R","0"
"Morning","0"
"Good morning Hell","0"
"good morning the snow is heavy as frick and it s cold and the road is white so I probably won t be going to the dan","0"
"Morning warm up sketch Wildcat thomasperkins characterdesigner earth2 wildcat","0"
"Sheriff All hat no cattle got his butt handed to him this morning","0"
"I ll deactivate in the morning Lemme say bye to some folks first","0"
"Shocking ultra rare tragedy reported in India Morning Ticker","0"
"Recurring meetings are so pointless Yes sometimes meetings are necessary but those happen organically not because it s 10 a","0"
"More snow hysteria reported in this morning It s been snowing in Scotland too","0"
"ISP investigating crash that kills teen Saturday morning","0"
"Good morning Twitterfriends","0"
"I didn t know if I wanted ravioli or a hot pocket so I made both says Kalah at 1 in the morning","0"
"naina Good morning HaPpy Sunday","0"
"nice place good morning","0"
"Read my Dec 10 Newsletter featuring 14 of the Best Morning Routine Hacks Proven to Boost Productivity","0"
"we told yall this is NOT a game there was literally traffic on my way to the bathroom this morning","0"
"Me every morning before going to school","0"
"Good morning please DM us the request number and a contact number with the full name to check and assistance","0"
"LOVEO6 Many people around the British Isles woke up to snow this morning Very festive weather","0"
"Good morning all Liverpool FC family It s derby Day Let s get right at these blue shirts from the very first minute","0"
"Every dark light is followed by a light morning","0"
"I love the smell of new iTunes reviews in the morning","0"
"Look at what s happening with this mans financial teaching GetMotivated tomorrow morning at 8 47 AM","0"
"Good morning and HappySunday","0"
"bruh i remember 2016 summer i went to bed at 7 in the morning holy shit it was fun and bad","0"
"View from my driveway this morning","0"
"I told Jacob all I wanted for our 4 year anniversary gift was for him to go stand in line at Schlotzskys at 8 am this mornin","0"
"GOOD MORNING Today is the day our bodies sore dancing in fancy dresses amp suits sjicbnprom17","0"
"Dhan Dhan Satguru Tera Hi Aasra Good","0"
"40 Nina says Good Morning Twitterworld Thanks to for donations to help CurePetCancer2017 this month Have a fa","0"
"I got home from work so late tonight but I hope P wakes up early in the morning because I miss him so much I just want to cuddle him","0"
"morning to rose","0"
"Morning U 2","0"
"Hina has been an amazing singer which you must have known by now Her favourite song is raabta besides lag jaa gale He","0"
"Good Morning Patriots Happy Saturday It s a great day to celebrate our wonderful So Tweet for Trump and Ameri","0"
"Good morning Happy Sunday","0"
"National 171208 SBS Morning Wide s ending song is BTS lt MIC Drop Remix gt twt","0"
"Me every morning before going to school","0"
"that morning text you get that has you feeling good all day yeah i didn t get that either","0"
"baba Morning SA I m asking for a job or assistance to find work i am really starving with my kids pls I am semiskilled pipefit","0"
"I m up like if i don t have work early in the morning","0"
"Ain t feeling good this morning","0"
"She hates bugs Her hobbies are watching the sky in the morning and cooking Umji s ideal type is Cha Tae Hyun","0"
"good morning Frank uwu","0"
"vamps16 rt or like if you stan Why don t we New Hope Club One Direction The Vamps Panic at the disco Selena Gomez Camila Ca","0"
"And to be able to wake up and say hi to her every morning","0"
"Good morning Sunday with a bunch of Smile from Me and the kids Represented smilefoundation at","0"
"Morning","0"
"Good morning sleepinthepark As we go home to our warm beds it s important we don t lose sight of the fact that what was","0"
"There you go lighting my phone up And I know what you re wanting Cause nobody likes a lonely at two in the morning","0"
"Brighten up your Sunday with Sunday morning coffee sunday weekend strong coffee morning","0"
"National 171208 SBS Morning Wide Entertaiment News BTS twt 3","0"
"The first person you think of in the morning or last person you think of at night is either the cause of your happiness o","0"
"Good morning have a good Sunday","0"
"Watts Last night it was cold amp windy amp when I opened my door this cricket hopped in so I set him up good for the night l","0"
"Shocking ultra rare tragedy reported in India Morning Ticker","0"
"tshabalala morning bra ya motho","0"
"Good morning KissTon fanmily This is THE DAY we ve been waiting for And we re just counting few more HOURS yet it feel","0"
"Morning guys Happy sunday","0"
"Sunday morning motivation","0"
"Good morning abolish the police prison industrial complex That is all","0"
"1 Good morning I m sure your excited about the holidays amp going home to your families I ll be spending some time w my","0"
"Hina has been an amazing singer which you must have known by now Her favourite song is raabta besides lag jaa gale He","0"
"There are hundreds of Republican Party members of Congress Each of them wakes up every morning and says to himself tod","0"
"Good morning friends We are playing the finals of Amity Polo Cup today 3pm onwards at Jaipur Polo Grounds Its going t","0"
"Gritters amp snowploughs are working hard but there is very heavy snow across all of Worcestershire this morning p","0"
"I had one foot out my front door when two dudes harrassed me yelling their number saying heyo beeras because I was wear","0"
"ok i kno it s four in the morning but if we ALL as an entire generation get a face tat they have to hire us we ca","0"
"Everyone is beautiful Your SMILE is the secret so don t hide it Good morning y all","0"
"morning skies","0"
"Good morning","0"
"I really hate it though that I m like the only one that can t do shit cuz I gotta work in the morning ugh being an adult sucks","0"
"Why Are Men So Horny in the Morning","0"
"Weather Rain in the morning and breezy until evening dress well and have a good day","0"
"Like I m in the mood to just get spanked fukd real quick and sent to bed bc a Betch got work in the morning","0"
"tahjtahj Please RETWEET my sister is missing and hasn t been home since yesterday morning she was last seen at a party in Daly City a","0"
"Me every morning before going to school","0"
"Sheela vijay szama","0"
"We had a very lit breakfast this morning thanks to the mimosas","0"
"Good morning","0"
"leave me questions to answer in the morning pls","0"
"There s NO reason what so Ever why he can t spend christmas morning with his child none","0"
"National 171208 SBS Morning Wide Entertaiment News BTS twt 2","0"
"About this morning skyperth fremantle southbeach sunrise perth australia","0"
"Good morning everyone","0"
"Thousands of people lining up for a free dental clinic at 4 in the morning here in Phoenix Perfectly normal thing that","0"
"Haan good morning","0"
"Morning all mudah andilancarkn","0"
"Watts Last night it was cold amp windy amp when I opened my door this cricket hopped in so I set him up good for the night l","0"
"Good Morning Today retweet leadership","0"
"Lamentations 3 22 23 22 Because of the LORD s great love we are not consumed for his compassions never fail 23 They a","0"
"Bitcoin Morning Brief w Jimmy Opendime Bitfinex ed Lawyers Up amp Price The brief also","0"
"New post Try these Morning Yoga Poses to Lose Weight has been published on Fun Shop Telugu","0"
"Larkie Hello Good morning kaha hain aap I vote HellyShah for Devanshi TVP","0"
"Excellent news I m glad to hear that hun I m just about to make my morning want one","0"
"it s one in the morning amp I m jamming out to the grinch soundtrack wyd","0"
"I walked out of Hotel this morning and this is the first damn thing I see","0"
"Good morning Today ground breaking of another 1263MW Punjab power plant inshaAllah Another step towards Roshan Pakista","0"
"9 things your baristas wish you knew","0"
"I m sorry General the line was just killer and I needed my morning latte whoa I see I missed","0"
"Morning people","0"
"RT","0"
"Morning workout Stretching lines and saving lives Jobs DoWork Firefighters","0"
"You and me in the morning sir LFC YNWA COYR GetOutOfMyPark","0"
"Good morning Have a blessed Sunday From Lebanon with","0"
"Early morning Sunday with it being this cold is hell literally the worst combo","0"
"National 171208 SBS Morning Wide Entertaiment News BTS twt 1","0"
"III Good morning i would like an iced cold coffee Zayn and his american accent","0"
"bestia96 Good morning text I do not know how that feel Only text I get is sprint talking bout my bill","0"
"Good morning Africa No matter how powerful a man he cannot make rain fall on his farm alone African Proverb Photo","0"
"Hina has been an amazing singer which you must have known by now Her favourite song is raabta besides lag jaa gale He","0"
"Ganaps on top of ganaps Naman naman at Edward LLS taping Naic Cavite Fiesta Guesting R","0"
"Watts Last night it was cold amp windy amp when I opened my door this cricket hopped in so I set him up good for the night l","0"
"Good morning Twitter world 13 days left fr the release of AmazonObhijaan Few painful moments from the shoot","0"
"If the Morning Started without Sun Urs Musics Would be enough to Light the Path Of our Day","0"
"I m glad I m seeing this trending It s 3 02 in the morning EST and the entire country is in military curfew The incumbent","0"
"Good Morning","0"
"Waking up every morning wondering if you re coming down with a cold or if this is just how you wake up now","0"
"It seems that it became clear that the awakening in the morning is made refreshing physiologically relaxing the elderly","0"
"Darshani Brahmins would not take food or water before having the darshan of emperor Akbar in the morning","0"
"Me every morning before going to school","0"
"Ind Told to act on him instead team sent him on some channels as spokesman have proof amp since morn","0"
"good morning","0"
"Takin moms to church in the morning again","0"
"morning","0"
"good morning everyone","0"
"Good morning This is a photo of a tiny owl who is best friends with a large dog Have a smashing day","0"
"Only Texas has snow in the morning and is sunny in the afternoon","0"
"70R","0"
"Interesting walk through O Bahn tunnel at Rymill Park this morning after we were advised that there was no emergen","0"
"feelings hi i have some big news but it must remain secret according to my fren very soon everything will be attacked by l","0"
"Good morning from photo by Rachael Webster","0"
"beauty7 Good Morning desi chicks htt","0"
"Babess Good morning My Beautiful Prince","0"
"Watts Last night it was cold amp windy amp when I opened my door this cricket hopped in so I set him up good for the night l","0"
"Romance is in the air for fantasy boyfriends Ben Masters and Joey Mills In a secluded cabin deep in the woods Ben wakes","0"
"I wanted to go jogging this morning but then I remembered that proverb 28 1 says wicked run when no man is chasing them","0"
"A Kafkaesque World With the inquisition spirit amp the criminalization of politics you will soon wake up every morning with th","0"
"Morning Sam amp Colin needed the loo now in bed with my headphones on listening whe","0"
"Morning","0"
"A cold day ahead with some heavy showers this morning turning wintery this afternoon with highs of 4 degrees","0"
"Good morning birthday boy HappyDanielDay","0"
"Mehta Sahib Good morning you were the one who broke the story ist of wockhardt PHARMA chikalthana","0"
"Yeah partying is great but have you ever slept for at least 8 hours again and felt so ready in the morning to take on every","0"
"Watts Last night it was cold amp windy amp when I opened my door this cricket hopped in so I set him up good for the night l","0"
"Good Morning World","0"
"Sitting in my gut this morning the price Mmatshilo Motsei paid for writing The Kanga and the Kangaroo Court Donor fun","0"
"I just realize I haven t eaten anything since I woke up this morning","0"
"Good morning from Budapest","0"
"Good morning","0"
"Beautiful morning Christmas First snowday2017","0"
"Good morning MarNigo fam Sadly as much as I wanted to go on a road trip to Sta Rosa Laguna with Team Live I have","0"
"KANG CHODING kicked ONG s rope while he was practicing amp it hit ONG but DANIK hugged him so fast Sorry sorry i m really","0"
"Gaza Good morning from Palestine 7 43 AM","0"
"WINONA Good Morning","0"
"Wake up every morning gotta show my breasts some love Could do with some help though","0"
"Programming is not easy like Sunday morning it is silent poetry Waseem Latif","0"
"Gooooooood MORNING my people It s gonna be poppin today here at CWL Dallas Let s get it","0"
"Morning","0"
"nivethathomas so cute good morning Nivetha","0"
"Watts Last night it was cold amp windy amp when I opened my door this cricket hopped in so I set him up good for the night l","0"
"Me venting at 3 30am on the morning of May 11th","0"
"Morning","0"
"Watts Last night it was cold amp windy amp when I opened my door this cricket hopped in so I set him up good for the night l","0"
"This will be hilarious Nobody could be more unwelcome in Alabama than Joe Actually I m wrong","0"
"GOOD MORNING ITS A SNOW DAY","0"
"Morning everyone","0"
"Watts Last night it was cold amp windy amp when I opened my door this cricket hopped in so I set him up good for the night l","0"
"BREAKING Kyle McLaughlan fined for being a pussy ass bitch in Brighton UK Confirmed dead at 07 15 this morning","0"
"I should probably get some sleep since I m workin a double tomorrow morning","0"
"Today Morning JANASENA IN ONGOLE","0"
"Hold onto everything blowing a hooley this morning even the cat is refusing to go out","0"
"baba Morning SA I m asking for a job or assistance to find work i am really starving with my kids pls I am semiskilled pipefit","0"
"when girls wake up in the morning after sleepovers we don t even talk to each other for a good 20 minutes we just sit on ou","0"
"CY Good morning all Don t forget to Pre order EXO winter album Thank you and Have a great sunday","0"
"Good morning","0"
"Im gonna bump that kagehina in the morning Lol oops posting at 1am","0"
"40 Nina says Good Morning Twitterworld It s 2 00AM and I m ready to play I think I ll wake up Dave Have a fun Caturday eve","0"
"me on Christmas morning walking straight to that tree","0"
"good morning","0"
"I owed 3 900 lastnight to the school and this morning I only only owed 1 933 34 When I went to figure out how I was gone pay","0"
"so i took a fresh one this morning as fresh as my well brewed coffee so here goes my sexy Javaco Melange coffee brewe","0"
"Everything about this video of my dog zipped into my dad s hoodie and howling along to a string quartet cover of a U2 son","0"
"Good morning gais","0"
"Around 5 30 each morning President Trump wakes and tunes into the television in the","0"
"p20 Sleep till noon To avoid morning regrets","0"
"Watts Last night it was cold amp windy amp when I opened my door this cricket hopped in so I set him up good for the night l","0"
"sakura ginghs inARTeam joan","0"
"My morning is perfectly beautiful","0"
"Don t you just love seeing nudes while drinking coffee in the morning","0"
"Kayyylaaaa just getting off and have to be right back in the morning","0"
"Good morning all beautiful souls at Twitter","0"
"If that school doesn t know it has a bullying problem it will on Monday morning So encoura","0"
"I saw SARS along Osogbo Ilesha Road this morning after looking at my papers the guy asked for my DRIVER LICENCE I told h","0"
"good morning Diane x have a good day xx stay safe xx","0"
"Morning","0"
"Morning Dew Almighty and merciful God let neither our daily work nor the cares of this life","0"
"Good morning family","0"
"Watts Last night it was cold amp windy amp when I opened my door this cricket hopped in so I set him up good for the night l","0"
"Morning should be like this","0"
"Good Morning Everyone Have a blessed amp beautiful Sunday Luv u all guys sunday weekend","0"
"Actress Raline Shah s IG Update with Seungri A good morning with the Birthday Panda Thanks for all the good times so fa","0"
"How to have your morning drive to work","0"
"They aren t alone proved that Juan Williams said this morning that what Brian Ross did was just","0"
"You Can Make Your Morning Easier","0"
"Good morning npower i was pre selected and i receive congratulatory message from npower but now i was not receive a","0"
"Good morning May your day be filled with Joy love and laughter today wednesday humpday goodmorning quote quot","0"
"Good morning love united","0"
"171208 Chungha morning","0"
"Quen at the airport this morning flying back to Manila cto IG","0"
"Good morning dear","0"
"Hina has been an amazing singer which you must have known by now Her favourite song is raabta besides lag jaa gale He","0"
"S R U Oh shoot I almost forgot Starting Monday Morning I m gonna be inactive until the 22nd for School amp Family related stuff B","0"
"Watts Last night it was cold amp windy amp when I opened my door this cricket hopped in so I set him up good for the night l","0"
"I m going to hate myself in the morning brownie sundae icecream icecreamsundae browniesundae dessert","0"
"Wishing you all a lovely lazy Sunday morning ThodaMatchThodaMismatch TheRangritiLife Sunday Morning Lazy","0"
"Good morning","0"
"Good morning Shilpians We Stand By Shilpa","0"
"That s all for tonight s CWLDallas Open broadcast We re back at it again tomorrow morning Broadcast start time is as follows","0"
"morning hollow Dantalian s Chariot Sun Came Bursting Through My Cloud","0"
"Nothing will be wasted good morning","0"
"Good morning zenobia","0"
"my geometry prof is the cutest old man and today he was using wikipedia to show us something and when the notice popped up as","0"
"Morning the season fall Wanaka Lake NewZealand by Jane Clancy","0"
"Me every morning before going to school","0"
"Beautiful morning Christmas First snowday2017","0"
"good morning i didn t die in my sleep","0"
"You know what s great about closing and then having to open the next morning Literally nothing","0"
"Good morning Let me show you something you like","0"
