"Growing up in the 90s my dad listened to Rush Limbaugh every morning owned books by Norman Schwarzkopf was an avowed cons","0"
"Me every morning before going to school","0"
"I like when they text me good morning or call me Check up on me all the time I actually don t find that annoying I don","0"
"gooch Morning Ron for you","0"
"That s all for tonight s CWLDallas Open broadcast We re back at it again tomorrow morning Broadcast start time is as follows","0"
"an361 Good morning Have a beautiful sunDay","0"
"She said why don t we both Just sleep on it tonight And I believe in the morning Paul Simon 50 Ways To Leave Your Lover 1975","0"
"ginghs inARTeam joan RTeam","0"
"Wow I can t wait for the massive nosebleed I m going to have in the morning from this weather","0"
"Every Atlanta nigga this morning","0"
"Good Morning","0"
"Morning","0"
"Morning I m having my usual Caramel Macchiato from","0"
"Good Morning Guys Click the link to enjoy me","0"
"ok i kno it s four in the morning but if we ALL as an entire generation get a face tat they have to hire us we ca","0"
"gOOD MORNING OMG AHHH I LOVE YALL","0"
