"morning don t make the mistake of making the same mistake","0"
"good morning taekook love each other very much","0"
"Mayo76 This is My drive to work this Lord Be still Praying for ppl up in those mountains LA County and myself this mornin","0"
"I guess im too hungry coz i didnt eat so well yesterday Cheese sandwich in the morning then 1 epok2 old chang kee","0"
"82 mph gust this morning in Corbett strongest so far this season Gorge Refrigerator Door wide open Cold air spill","0"
"To me For me With one morning to stalk one to behold Dancing from sandalwoo d they celebrate a different and three","0"
"surfer1","0"
"Sandy1","0"
"Gd morning Financial freedom is the 21st century definition of retirement Have a nice day","0"
"Morning from two lil boys with their daddy This so cute","0"
"At 1 19am Sunday Morning I Just Decided Hawaii In January","0"
"Glamour It s 1 20 in the morning where I live but I ll pause sleeping to watch Nikki videos","0"
"iamAftab yes2life sky","0"
"My ass thought I would speed up my morning a little by making my preworkout the night before and putting it on my beds","0"
"Good Morning Friends Let s Chat","0"
"A Kafkaesque World With the inquisition spirit amp the criminalization of politics you will soon wake up every morning with th","0"
"You know how disney princesses have birds that get them ready in the morning I just want someone to take my make up off every night","0"
"4 being drunk is just borrowing happiness from the next morning","0"
"CM Arvind Kejriwal Meets Public without Appointment Every Monday to Friday Spends his Sunday Morning visiting his Con","0"
"Go girl ignore u know better than anyone else kung Sino ka panira yan kya good morning blessed Sunday girl gogogo","0"
"Watts Last night it was cold amp windy amp when I opened my door this cricket hopped in so I set him up good for the night l","0"
"Just spent 15mins exhaustively looking for one tweet that popped up on my TL before it jumped This is not how I en","0"
"Everything about this video of my dog zipped into my dad s hoodie and howling along to a string quartet cover of a U2 son","0"
"Me waking up in the morning wondering if I actually need an education or not","0"
"Trump Released A BRUTAL Video This Morning Featuring Bill Clinton And Barack Obama Here s It Is","0"
"Early morning flight to Kiev for filming Cheers looking forward to it It s gonna be cold","0"
"Good morning only to Seungri who s having a blast in Amanpulo amp to his haters blasting their heads from jealousy","0"
"WINONA Good Morning","0"
"Good morning good afternoon or goodnight Twitter Followers","0"
"Hertford looking pretty this morning","0"
"What a season you had and a championship performance enjoyed seeing you dominate the highlight reel every Monday morning","0"
"I made one of the biggest decisions of my life this morning and am proud to say I ve committed and signed to Dordt Colleg","0"
"Very cold photographing these wild Barn Owls this morning A technically very challenging low light image Wide open at","0"
"Good Morning","0"
"4 of these sisters made their vows this morning Sisters of the Holy Rosary","0"
"QwetuKwasaKwasa good morning","0"
"There are hundreds of Republican Party members of Congress Each of them wakes up every morning and says to himself tod","0"
"We are breaking a big story tomorrow morning Please stay tuned","0"
"my last braincell at 3 in the morning","0"
"Good morning sunshine Just please send me back in my bed I want to sleep moooore","0"
"I listen to this song in this morning and i can t stop my hand to play it I know I still have","0"
"Good morning to all the AntiFa radicals and resisters ISIS AlQeada Taliban Hezbollah support you","0"
"Just wana wake you guys up this morning with good music and clean your ears","0"
"Each morning we are born again What we do today is what matters most Buddha","0"
"22 GOOD MORNING SUNDAY","0"
"Oleski 02 Someone didnt take their meds this morning","0"
"Good morning folk","0"
"Good morning just got off work going back in 8 hours god bless","0"
"khatri posture Chan Chan","0"
"Morning Dose","0"
"p20 Sleep till noon To avoid morning regrets","0"
"AirForce On the morning of 10 December after 39 2 years of service AP 3C Orion tail number A9 756 was transported by road to it","0"
"wait when did ghis happen this morning","0"
"Good Morning Sunshine tropicalsunrise sunrise florida wallart homedecor HHPhotographyof","0"
"A Kafkaesque World With the inquisition spirit amp the criminalization of politics you will soon wake up every morning with th","0"
"Did wonder how you robot dudes were getting on this morning","0"
"You know its time to leave some people alone when you say good morning and the response is what s good about this morning","0"
"Watts Last night it was cold amp windy amp when I opened my door this cricket hopped in so I set him up good for the night l","0"
"morning","0"
"Good Morning","0"
"My today morning cycling in central Delhi","0"
"Good morning my friend Have a nice Sunday","0"
"Me every morning before going to school","0"
"Does Working Out in the Morning Speed up Your Metabolism","0"
"Boris Johnson arrived in Iran this morning to press the Iranian regime for the release of jailed Iranian British aid worker","0"
"Cute anna Good morning Thalapathy Devotees","0"
"ralineshah update with Seungri in Amanpulo morning baby","0"
"kr 171209 SP JIU DREAMCATCHER in darkness she is all I see SUNDAY MORNING JIU SIYEON HAN","0"
"Headline of Japan Times this morning Japan EU trade pact nears reality In the U S our withdrawal from TPP gets lost","0"
"Good morning oh Nah today be your own Your mouth yabi yabi yestee Abi we all dey here","0"
"No matter how bad you think your life is you have to wake up each morning and be thankful for it","0"
"the equivalent of my alarm waking me up in the morning","0"
"Sunday Morning Made coolfm back for the SundayMorningOasis NP ONISE IYANU BY","0"
"The world becomes beautiful outside when we become stable inside Honesty does not always pay but dishonesty alwa","0"
"Hina has been an amazing singer which you must have known by now Her favourite song is raabta besides lag jaa gale He","0"
"Tallahassee is under a freeze warning until 9 AM Sunday morning It s currently 32 degrees and dropping same temperat","0"
"I like when they text me good morning or call me Check up on me all the time I actually don t find that annoying I don","0"
"Morning Queens Get ready with me this Christmas Book your appointments now to avoid","0"
"Morning is insulting but I will still say good morning to u","0"
"Hina has been an amazing singer which you must have known by now Her favourite song is raabta besides lag jaa gale He","0"
"At least once every Saturday morning I get the ball WIDE open and my entire team says go ahead shoot take that and","0"
"y all ever have a conversation so shocking you can t stop thinking about it here s mine coworker how are you m","0"
"Watts Last night it was cold amp windy amp when I opened my door this cricket hopped in so I set him up good for the night l","0"
"Lewis Good morning this little boy is the future of music","0"
"Something about LA at night and in the early morning And that s it","0"
"Is your mom really your mom if she doesn t get you 3 donuts and a hot chocolate at 1 19 in the morning","0"
"I miss seeing ur face everyday and waking up to u every morning","0"
"one in the morning i m making a myspace account let s fuckin get it","0"
"good morning good day good everysing","0"
"Good morning Dear ratna amp dearest sir Wonderful","0"
"I m a lot more anxious that I used to be now that is president I truly think he is making the country","0"
"Watts Last night it was cold amp windy amp when I opened my door this cricket hopped in so I set him up good for the night l","0"
"Watts Last night it was cold amp windy amp when I opened my door this cricket hopped in so I set him up good for the night l","0"
"Watts Last night it was cold amp windy amp when I opened my door this cricket hopped in so I set him up good for the night l","0"
"0 Me every morning","0"
"I owed 3 900 lastnight to the school and this morning I only only owed 1 933 34 When I went to figure out how I was gone pay","0"
"have you ever been so tired in the morning that you just kind of zone out staring at your food kind of forgetting to eat i","0"
"How are your ankles this morning","0"
"Morning all s","0"
"SaintRamRahim Initiative40 3DaysToFreeEyeScreeningCamp good morning guru","0"
"Morning sext I got us a table at the lib","0"
"A Kafkaesque World With the inquisition spirit amp the criminalization of politics you will soon wake up every morning with th","0"
"morning people vs me","0"
"Ulv Good morning and thank you","0"
"Good morning","0"
"9pm Going to bed early will be good for me I ll actually wake up in the morning like a human being 1am Well fuck","0"
"Beautiful morning Christmas First snowday2017","0"
"Every morning when I start game dev work","0"
"morning Loving the show no rain here in the midlands just heavy snow all day","0"
"in Good morning ji","0"
"Early Morning Reporting by Swiss Bank to our Visionary World Lane Leader Modiji","0"
"i dont remember D im sorry but it was in the morning","0"
"Top of the morning please follow back or at least open your dm","0"
"Harvesters is 14 today You sure don t want to miss church this morning Stay tuned to God s awesomeness here H","0"
"Sathyaraj ramya Gd morning to Sathya team Glad to hear the great r","0"
"We waaay in homerville at 1 inna morning","0"
"It s 12 15 in the morning and I m planning for our weekly meeting in yearbook on Monday","0"
"Good morning everyone","0"
"Good morning Aap congress mein as jatin to baat ban jatin","0"
"qasim Good Morning to all except Zainab baji","0"
"baba Morning SA I m asking for a job or assistance to find work i am really starving with my kids pls I am semiskilled pipefit","0"
"What do you see It s been a while now Good morning everyone","0"
"LilacFire update Fact sheet for the evening update Next post will be 7AM tomorrow morning","0"
"Pimp College Pimp Class Demonstration How Pimps Rest on Sunday Morning","0"
"Please send positive vibes to as she was hit this morning while being a pacer at Klang International Maratho","0"
"Pimp College Pimp Class Demonstration How Pimps Rest on Sunday Morning","0"
"kr 171209 SP JIU DREAMCATCHER in darkness she is all I see SUNDAY MORNING JIU SIYEON HAN","0"
"Morning","0"
"Sunday morning feels really special after a smooth 21km ride it was wonderful to meet Hemangi and Ganesh who were alr","0"
"baba Morning SA I m asking for a job or assistance to find work i am really starving with my kids pls I am semiskilled pipefit","0"
"Omg save me Tommy s singing 115 in the morning josh is playing a fake piano lord help me","0"
"bestia96 Good morning text I do not know how that feel Only text I get is sprint talking bout my bill","0"
"Carpinteria and Summerland will see smoke amp fire activity from ThomasFire Incident now thru morning and the fire will s","0"
"BOTD Dec 9 1909 DouglasFairbanksJr film star thespian humanitarian OBE and","0"
"Watts Last night it was cold amp windy amp when I opened my door this cricket hopped in so I set him up good for the night l","0"
"Good morning","0"
"Sometimes in a I see a Big Mac and I pause for a moment deep in thought and think to myself","0"
"Morning any snow None down here yet","0"
"Watts Last night it was cold amp windy amp when I opened my door this cricket hopped in so I set him up good for the night l","0"
"Watts Last night it was cold amp windy amp when I opened my door this cricket hopped in so I set him up good for the night l","0"
"Sitting in my gut this morning the price Mmatshilo Motsei paid for writing The Kanga and the Kangaroo Court Donor fun","0"
"Oh hello morning tears","0"
"Good morning May your day be filled with Joy love and laughter today wednesday humpday goodmorning quote quot","0"
"Good Morning Pakistan And we are here for the second day of National Youth carnival with some amazing perfor","0"
"juhi Super happy amp thrilled to start this garbage free initiative from the same place i spent 20 golden years of my life at A","0"
"I love spreading GIF on my toast in the morning Sometimes I sprinkle some PDF to give it some flavor","0"
"Morning Sharon","0"
"Assalam O Aleykum Very Good Morning all Friends","0"
"The first thing you do when you WakeUp in the morning should be productive that doesn t mean checking your EMAIL","0"
"Good morning dalia","0"
"William with two of the classiest people in Pro Sports Daniel and Henrik What a morning","0"
"You are beautiful but learn to work for you cannot eat your beauty African Proverb Good Morning SunFamily a happy Sund","0"
"Morning call","0"
"Watching the full popodyssey tour at six in the morning waiting for a reunion","0"
"This morning s hot coffee is tonight s iced coffee","0"
"Me every morning before going to school","0"
"Arthur Abraham fought with a broken jaw as did and In the early hours of this morning","0"
"You no go morning mass","0"
"Gaza Good morning from Palestine 7 43 AM","0"
"bestia96 Good morning text I do not know how that feel Only text I get is sprint talking bout my bill","0"
"Watts Last night it was cold amp windy amp when I opened my door this cricket hopped in so I set him up good for the night l","0"
"Me every morning before going to school","0"
"nothing beats chilling with bae after work because u gotta work again the next morning and the morning after that u got sch","0"
"Haan good morning","0"
"First thing i saw this morning Thanks YT notification Uh It will be good day Its raining but its kinda hot","0"
"Me every morning before going to school","0"
"Good morning friends","0"
"Work in the morning","0"
"Morning","0"
"Grab Monday morning by the Purdey s and ThriveOn AD","0"
"I m taking off to Lubbock at 4 in the morning","0"
"Wonkblog This morning Ryan called on Congress to target Medicare in 2018 We re going to have to get back next year at entitl","0"
"Watts Last night it was cold amp windy amp when I opened my door this cricket hopped in so I set him up good for the night l","0"
"Watts Last night it was cold amp windy amp when I opened my door this cricket hopped in so I set him up good for the night l","0"
"Saturday morning breeding","0"
"morning bro ob","0"
"Good morning Patriots From a snowy East Coast Remember to Enjoy the season Say MERRY CHRISTMAS Say MERRY","0"
"Kontroll On a scale of 1 to rekt where would you put yourself right now If it s morning 1 to half dead hungover is the new scale","0"
"niggas seen 7 snowflakes this morning and stepped out the house like this","0"
"Happy birthday to a dear friend morning who lives and breathes SHINee I am so happy you found each other","0"
"Watts Last night it was cold amp windy amp when I opened my door this cricket hopped in so I set him up good for the night l","0"
"Watts Last night it was cold amp windy amp when I opened my door this cricket hopped in so I set him up good for the night l","0"
"morning its 7am and I can t sleep","0"
"Morning try and keep warm x","0"
"good morning","0"
"he was christmas morning crimson fireworks and birthday wishes NCTzenSelcaDay","0"
"Good morning","0"
"Beautiful morning Christmas First snowday2017","0"
"Butyfull good morning","0"
"Morning","0"
"good morning I love matthew daddario harry shum jr and gabi","0"
"Morning","0"
"Good morning","0"
"Good morning","0"
"Tonight has been the night of head kick KOs Between Glory and the UFC man some dudes will have headaches in the morning Sports","0"
"I wanted to go jogging this morning but then I remembered that proverb 28 1 says wicked run when no man is chasing them","0"
"Good morning friends","0"
"Morning SleepInThePark Bit chilly this am Scotland just scraping the ice off the sleeping bag","0"
"Watts Last night it was cold amp windy amp when I opened my door this cricket hopped in so I set him up good for the night l","0"
"Atashi When I started out I made a ton of quickly Then one day there was FUD that jacked","0"
"Ignifer lum0s The first con","0"
"Good morning","0"
"Sunday night vs Monday morning","0"
"Me every morning before going to school","0"
"lol who offended you this morning","0"
"OO Ba Morning stay blessed","0"
"Good morning to all thala fans amp Friends Have a Nice day Happy sunday My what s up status","0"
"Hina has been an amazing singer which you must have known by now Her favourite song is raabta besides lag jaa gale He","0"
"the cutest good morning you ll ever hear","0"
"allise When you parents make you go to church on Christmas morning","0"
"Lewis Good morning this little boy is the future of music","0"
"It s December 10 2017 at 08 15AM good morning people","0"
"Fadnavis Nice to see great response to healthcare camp organised by MLA Prashant Bamb at Lasur Station in Aurangabad district this","0"
"Early morning fuck","0"
"Watts Last night it was cold amp windy amp when I opened my door this cricket hopped in so I set him up good for the night l","0"
"Shituuu 1504 511 4 prati Go","0"
"Everything about this video of my dog zipped into my dad s hoodie and howling along to a string quartet cover of a U2 son","0"
"DG STARZ Good morning morning can t w","0"
"It was Yikes Don t let me be up at 1 00 in the morning lmao","0"
"Good morning","0"
"I pity the foo variable in the car and I have to get up early tomorrow morning and I have to be at the forefront of","0"
"Good Morning brother Happy HumanRightsDay Advocate RanveerBajaj jii U played this character too very fantas","0"
"Good morning","0"
"My roommate s cousin Julia went to a bar got hammered and woke up to this video texted to her the next morning https","0"
"Watts Last night it was cold amp windy amp when I opened my door this cricket hopped in so I set him up good for the night l","0"
"lads it s 6 in the morning and my titties be freezing off","0"
"Watts Last night it was cold amp windy amp when I opened my door this cricket hopped in so I set him up good for the night l","0"
"Getting the morning after pill condom broke last night at in Rancho Santa Margarita CA w https","0"
"President Shri Ramnath Kovind Vice President Shri PM Shri and other dignitaries paid tributes","0"
"You are beautiful but learn to work for you cannot eat your beauty African Proverb Good Morning SunFamily a happy Sund","0"
"Watts Last night it was cold amp windy amp when I opened my door this cricket hopped in so I set him up good for the night l","0"
"Sunday Morning Made coolfm back for the SundayMorningOasis NP SPEECHLESS BY","0"
"what the fuck is 3 am in the morning i was reading cosas del se or of course how did this happen","0"
"Minister in the Jeff Radebe who is responsible for planning monitoring and evaluation is expected to hold a","0"
"Wake up in the morning tell myself that I will never trust a sole","0"
"Sunday morning routine","0"
"Morning American College of the Middle east ACM college in Kuwait City w 27","0"
"Good Morning HellyHolics I vote HellyShah for Devanshi TVPersonality2017","0"
"Watts Last night it was cold amp windy amp when I opened my door this cricket hopped in so I set him up good for the night l","0"
"37 You always surprises me by your Morning or night Messages","0"
"good morning its 1 20 am and im fucking awake and playing love live","0"
"Manchester Derby early tomorrow morning AUS time I m pretty sure fans of clubs in England ot","0"
"State Champs Legends featuring Coach Herrington airing tomorrow morning 12 10 2017 at 9 00 am on Fox Sports Detroit","0"
"Such joy to launch track early morning today along with Mayor ji MC Ajoy Mehta sir Pa","0"
"Each morning we are born again What we do today is what matters most Buddha","0"
"Maybe we should start calling him Chance the Meteorologist Or not Here s your morning forecast from","0"
"Ganaps on top of ganaps Naman naman at Edward LLS taping Naic Cavite Fiesta Guesting R","0"
"i just got home and laid down in bed with fresh warm sheets amp i m almost in tears because i already don t wanna lea","0"
"Nothin quite like making a comic at 1 in the morning but waiting to tweet it until morning because it s fanart and you gotta tag people","0"
"Good morning nams 3 http","0"
"He teased lightly then moved to dim the lights in the room You can measure it in the morning if you don t believe me","0"
"Watts Last night it was cold amp windy amp when I opened my door this cricket hopped in so I set him up good for the night l","0"
"Let us wake at the morning and be filled with Your love And sing songs of praise all our days For Your love is as high as t","0"
"Early morning flights messy hair and new shades go hand in hand Ps 10 am is early yes","0"
"Sitting in my gut this morning the price Mmatshilo Motsei paid for writing The Kanga and the Kangaroo Court Donor fun","0"
"Good morning","0"
"1 Good morning I m sure your excited about the holidays amp going home to your families I ll be spending some time w my","0"
"Happppie day Peppy morning","0"
"Good Morning","0"
"Coffeegasm noun that little rush you feel after that first sip of good strong coffee morning","0"
"A beautiful good morning to you all","0"
"shipper I can t imagine not being part of ADN anymore Even on my busiest days I ll find time to check in at least for a few m","0"
"Good morning y all should watch this video WaitForIt The last part killed me","0"
"I am making macaroni and cheese at 1 30 in the morning","0"
"women good morning beautiful day to all","0"
"Camps I play your soca mix every morning for work I cherish that CD really Get to it","0"
"Watts Last night it was cold amp windy amp when I opened my door this cricket hopped in so I set him up good for the night l","0"
"Me this morning","0"
"58 3","0"
"Don t wake up with the regret of what you couldn t accomplish yesterday Wake up with a smile thinking about what","0"
"Morning","0"
"Typically that it has come snow this morning when I have to work br mhult sweden","0"
"Watts Last night it was cold amp windy amp when I opened my door this cricket hopped in so I set him up good for the night l","0"
"Endorsment shoot for Kath today while Dj attends a christening this morning","0"
"How old is she now Yes Monday afternoon I have a OB appointment in the morning I m allll excited to meet her now","0"
"the cutest good morning you ll ever hear","0"
"Sunday Morning Made coolfm back for the SundayMorningOasis NP SPEECHLESS BY","0"
"Good morning May your day be filled with Joy love and laughter today wednesday humpday goodmorning quote quot","0"
"GOOD MORNING My Girl Hope this Cup Of Coffee Makes u khidkitod Whole Day Have a Nice day Go","0"
"Good morning everyone","0"
"Saturday Morning Breakfast Cereal tldr","0"
"amp tonight i don t now anything but missing you i m eagerly waiting for the morning to come amp feels somewhat like i","0"
"Watts Last night it was cold amp windy amp when I opened my door this cricket hopped in so I set him up good for the night l","0"
"dk Southern Denmark This Morning","0"
"i wake up now it s 9 18 morning","0"
"Watts Last night it was cold amp windy amp when I opened my door this cricket hopped in so I set him up good for the night l","0"
"Morning Made Narbhi ishqbaaaz","0"
"Me every morning before going to school","0"
"98 U never know when your day will come that s why you cherish everyday like it s a blessing and give all glory to God fo","0"
"Good morning","0"
"i made a study guide for my bio final all day today and its 18 pages and i only have a few more topics to add so it","0"
"Tallahassee is under a freeze warning until 9 AM Sunday morning It s currently 32 degrees and dropping same temperat","0"
"Good morning UK America World RT","0"
"my depressed ass hits play on the 10th vine compilation video on YouTube in a row at 2 in the morning the fbi agent","0"
"Good morning My Friend Have a beautiful day full of joy and Much Love Hugs","0"
"That s all for tonight s CWLDallas Open broadcast We re back at it again tomorrow morning Broadcast start time is as follows","0"
"Looking for a reason to drag yourself out of bed this morning Sorry we haven t got one We DO have a thrilling ebook th","0"
"Too much right Good morning Jyoti ji and Happy Sunday","0"
"Good morning","0"
"Me every morning before going to school","0"
"tune into the this morning we ll be singing and stuff","0"
"Maybe we should start calling him Chance the Meteorologist Or not Here s your morning forecast from","0"
"Good Morning Jesus","0"
"Morning warm up sketch Wildcat thomasperkins characterdesigner earth2 wildcat","0"
"Tallahassee is under a freeze warning until 9 AM Sunday morning It s currently 32 degrees and dropping same temperat","0"
"So this morning UT SHOWED UP AT MY DOOR GAVE ME A FULL TUITION SCHOLARSHIP and I m OFFICIALLY a business major at the McC","0"
"News good morning","0"
"GOOD MORNING AMERICA Air Force One is wheels up to Mississippi Today s TeamTrumpBTS he doesn t know yet is Stephen Mil","0"
"Good morning guys have a nice day","0"
"Lee xx Good morning","0"
"Good morning to all the beautiful ladies the smart fellas who watch anime amp read comic books and anyone who doesn t play FI","0"
"This is how I wake up in the morning stonesour yandt hydrograd summertimegirls","0"
"171208 Chungha morning","0"
"I am not a Morning Person that is the reason i get up at Noon","0"
"Watts Last night it was cold amp windy amp when I opened my door this cricket hopped in so I set him up good for the night l","0"
"Waking up every morning wondering if you re coming down with a cold or if this is just how you wake up now","0"
"AM22 The best and most beautiful things in the world cannot be seen or even touched they must be felt with the heart Good m","0"
"Good morning The president of italian parliament leader of governative party said in Italy there is a","0"
"Of course I would be in a creative artsy craft mood at 1 in the morning","0"
"I M SO COLD I M GONNA BE AN ICICLE BY MORNING","0"
"Sunday morning","0"
"Lewis Good morning this little boy is the future of music","0"
"good morning to MiChaeng only","0"
"Good morning","0"
