"A must read for all high school student athletes 100 truth","0"
"believes in s word magic","0"
"Recruiting Nation","0"
"no but seriously if you re a freshmen sophomore with straight As and a 4 0 trying to transfer to UCLA cherish thos","0"
"Recruiting 2018 UCLA QB Commit Dorian Thompson Robinson enjoying his time in Westwood during his official visit","0"
"I think im gunna try to be a paralegal at ucla fingers crossed again","0"
"WeLoveLA UCLA Michigan roars back from 15 down beats UCLA in OT 78 69 SportsRoadhouse","0"
"Recruiting 2018 UCLA QB Commit Dorian Thompson Robinson enjoying his time in Westwood during his official visit","0"
"UCLA bound RB breaks NATIONAL single season TD record Watch","0"
"LaMelo and LiAngelo Ball SIGN TO PLAY PRO IN CHINA LAVAR Pulls Them From UCLA","0"
"Recruiting Considering position very important prospect for ucla Former Alabama commit","0"
"UCLA salutes our 1967 Gary Beban on his 50th anniversary and congratulations to Baker Mayfield on joinin","0"
"Nation The offense is a two man team What kind of offense is Alford running Alford is not a very good coach His team","0"
"Nation Lazy play by UCLA Awful weak side defense And the offense has been stagnant for a while now Alford is not a go","0"
"That s because Alford isn t a good coach Been a two man team after going up 15 He played to try and keep the le","0"
"Recruiting 2018 UCLA QB Commit Dorian Thompson Robinson enjoying his time in Westwood during his official visit","0"
"Congrats to our nephew amp Godson Patrick and all the UCLA Water Polo players","0"
"jordan 20 As a fan he broke my heart But boy is he a great player","0"
"12 10 07 JUNE 2010 Megan Langenfeld of UCLA is congratulated","0"
"Rawsportz Media post State Playoff game interview with Tulare Union Star RB Kazmeir Allen UCLA bound Kazmeir Allen breaks","0"
"A big welcome billboard for UCLA s new coach Chip Kelly in downtown L A","0"
"PAC 12 STOCK REPORT Chip Kelly has the recruiting stock up at UCLA runs down the Pac 12","0"
"UCLA Football Josh Rosen having to avoid hits on and off the field","0"
"LaVar Ball on pulling his son off the UCLA basketball team That s one of the main reasons he went to UCLA is to play basketball","0"
"does she really go to UCLA","0"
"In collaboration with the local community and OptimismCan perform a groundbreaking hand transplant operation https","0"
"2018 UCLA QB Commit Dorian Thompson Robinson enjoying his time in Westwood during his official visit","0"
"Yo I just found a UCLA ticket from like 2 Years ago Ahhh memories","0"
"richesss Aye you know he don t wanna go to UCLA","0"
"UCLA Football Josh Rosen having to avoid hits on and off the field","0"
"UCLA Football Josh Rosen having to avoid hits on and off the field","0"
"UCLA Football Josh Rosen having to avoid hits on and off the field","0"
"UCLA Football Josh Rosen having to avoid hits on and off the field","0"
"UCLA Football Josh Rosen having to avoid hits on and off the field","0"
"LiAngelo won t return to UCLA after LaVar Ball pulls him from school amid suspension for shoplifting in China per","0"
"this Katieswift fan thinks she s dragging me but I got into UCLA","0"
"How do you talk to kids after during the trauma of these fires This app may help ThomasFire","0"
"My prediction for QB s drafted this year are 1 Browns Josh Rosen UCLA 2 Giants Sam Darnold USC 3 Broncos","0"
"NewProfilePic TheFuture DTR Dorian is the future I can t wait till he signs Let s show him some love Bruins","0"
"UCLA Football Josh Rosen having to avoid hits on and off the field","0"
"UCLA Football Josh Rosen having to avoid hits on and off the field","0"
"GBR Pretty hard to shank a driver And can u believe the Jays beat both of your teams this year UCLA and the skirts","0"
"Client Plays 3 5 2x play cashes Not good enough on to tomorrow CBB UCLA 6 5 CBB Valpo 2 5 CBB Provid","0"
"horton4 I said he d1 go to UCLA you was like idc now look at you","0"
"That was pathetic offense for UCLA I blame Alford for him trying to keep the lead instead of winning the game He pl","0"
"I said he d1 go to UCLA you was like idc now look at you","0"
"bell 99 Having a great official visit at UCLA 4sUp Bruins","0"
"UCLA Football Josh Rosen having to avoid hits on and off the field","0"
"UCLA Football Josh Rosen having to avoid hits on and off the field","0"
"UCLA Football Josh Rosen having to avoid hits on and off the field","0"
"I know I teach at ucla but I ll always root for my alma mater goblue UCLAvsMICH","0"
"ThingsThatJustDontGoTogether ucla basketball team and good at getting turnovers by stealing the ball","0"
"is bigger than LaVar Will this guy look in the mirror amp say I better grow up Teaching kids that when things don","0"
"UCLA Football Josh Rosen having to avoid hits on and off the field","0"
"Furious finish gives Michigan huge win over UCLA","0"
"Why did UCLA give him a scholarship and why was he rated a 3 Star player","0"
"Postdoc Fellowships Available in Math Physical Sciences Engineering at and for thos","0"
"UCLA Football Josh Rosen having to avoid hits on and off the field","0"
"Any reason why No association with unlv right Just UCLA","0"
"LiAngelo Ball s final UCLA career stats 0 minutes 1 steal","0"
"UCLA Football Josh Rosen having to avoid hits on and off the field","0"
"Ucla finally emailed me","0"
"Recruiting Top 2018 Target Bryan Addison is in Westwood on his UCLA OV this weekend A decision is looming for one of the nation","0"
"What does think about leaving","0"
"UCLA should have a crew of former players travel for big road games The boosters would probably love to hang with them i","0"
"UCLA Football Josh Rosen having to avoid hits on and off the field","0"
"imagine going to ucla and not knowing that that particular term is offensive","0"
"Wolverines WOLVERINES WIN 78 69 over UCLA with 13 4 OT run in key game for tourney hopes Wagner 23pts Matthews 20pts 8rebs","0"
"LiAngelo will not return to UCLA after LaVar Ball pulls him from school following suspension for shoplifting in China via","0"
"Sophomore Kyle MacLean son of former Simi Valley and UCLA standout Don MacLean had 43 points for Westlake in 82 51 win","0"
"12 9 Contradog Recap Nevada ML UCLA 5 Appalachian State ML St Joes 10 5 Pennsylvania 6 5 Prov","0"
"616 Isn t that SO FRUSTRATING Also thanks for beating UCLA","0"
"BRH RACE Who will win the race for new 5 Star DB Brendan Radley Hiles amp discuss","0"
"gtr UCLA Royce Hall we are ready See you tonight","0"
"UCLA Football Josh Rosen having to avoid hits on and off the field","0"
"JOHN MCLAUGHLIN UCLA Royce Hall","0"
"UCLA salutes our 1967 Gary Beban on his 50th anniversary and congratulations to Baker Mayfield on joinin","0"
"Sophomore Kyle MacLean son of former Simi Valley and UCLA standout Don MacLean had 43 points for Westlake in 82 51 win","0"
"AUDIO HIGHLIGHTS Listen to s top calls as Michigan comes back to defeat UCLA LISTEN","0"
"Can we get THIS election right TONY THURMOND for California State Superintendent of Public Instruction Let s get","0"
"When the next UCLA Heisman winner likes 2 of your posts U C L A UCLA Fight Fight Fight","0"
"Sophomore Kyle MacLean son of former Simi Valley and UCLA standout Don MacLean had 43 points for Westlake in 82 51 win","0"
"Georgia tight end on his UCLA official visit","0"
"across Oh no the three UCLA idiots he brought back from China were appreciative of what he did it","0"
"Thanks to and all of our great fans for helping us get the W today vs UCLA Appreciate your support home a","0"
"Will he transfer to Michigan Who knows but 1 was front row at today s game vs UCLA","0"
"He had Kentucky UCLA and many more i think I was surprised IU was even a consideration compared to all the other teams","0"
"Recruiting Top 2018 Target Bryan Addison is in Westwood on his UCLA OV this weekend A decision is looming for one of the nation","0"
"Who was the little entitled kid near the OKC bench with his Westbrook UCLA jersey He must have been 8","0"
"Recruiting 2018 Defensive End Abdul Malik McClain a longtime UCLA commit is on campus this weekend for his official visit 4s","0"
"LaVar Ball guest stars on a 5th Quarter episode about a boy banned from UCLA via","0"
"Recruiting 2018 Defensive End Abdul Malik McClain a longtime UCLA commit is on campus this weekend for his official visit 4s","0"
"LaVar Ball pulls his son LiAngelo out of UCLA so they can concentrate on the NBA Draft Call me crazy but I m hard press","0"
"ICYMI Zavier Simpson with the ridiculous layup to keep Michigan within 2 points late in the comeback victory against UC","0"
"Michigan was 8 for 22 at the free throw line today and yet somehow miraculously beat UCLA","0"
"UCLA researchers find that the simple act of petting an animal is good for your mental and physical health","0"
"Wagner We just got to work on that and don t take that as just like a little byproduct It s very serious stuff espec","0"
"Nation Alumni Welcome to","0"
"Sophomore Kyle MacLean son of former Simi Valley and UCLA standout Don MacLean had 43 points for Westlake in 82 51 win","0"
"Our work on a Semantic Loss function for deep learning with unlabeled data and or complex constraints Now in the learning with","0"
"In state RB Jeremy Banks lands Tennessee offer Also has offers from Arkansas Ole Miss Texas A amp M UCLA and USC https","0"
"Thank you UCLA for the chance to educate and empower your students on the subject of sexual appropriateness","0"
"Colgan UCLA bail study finds price of freedom too high for poor L A families","0"
"Colgan UCLA bail study finds price of freedom too high for poor L A families","0"
"Recruiting Top 2018 Target Bryan Addison is in Westwood on his UCLA OV this weekend A decision is looming for one of the nation","0"
"In state RB Jeremy Banks lands Tennessee offer Also has offers from Arkansas Ole Miss Texas A amp M UCLA and USC https","0"
"Haven t seen snow for 4 years NYUSocialMedia","0"
"In state RB Jeremy Banks lands Tennessee offer Also has offers from Arkansas Ole Miss Texas A amp M UCLA and USC https","0"
"Rawsportz Media post State Playoff game interview with Tulare Union Star RB Kazmeir Allen UCLA bound Kazmeir Allen breaks","0"
"What a joke LAPD went tactical alert I live here day BEFORE 1 fire broke out in LA Co then 1 broke","0"
"Michigan fans troll UCLA with LaVar Ball cutout","0"
"A few years ago we were at the UCLA Stanford football game Luck s senior year and the Stanford band did","0"
"Jimmy Herring and The Invisible Whip UCLA Royce Hall","0"
"But UCLA needs to steal more wins","0"
"UCLA salutes our 1967 Gary Beban on his 50th anniversary and congratulations to Baker Mayfield on joinin","0"
"Michigan overcomes a 15 point deficit and wins in overtime vs UCLA 78 69 Wolverines win GoBlue UCLABeat http","0"
"UCLA salutes our 1967 Gary Beban on his 50th anniversary and congratulations to Baker Mayfield on joinin","0"
"Will he transfer to Michigan Who knows but 1 was front row at today s game vs UCLA","0"
"Rawsportz Media post State Playoff game interview with Tulare Union Star RB Kazmeir Allen UCLA bound Kazmeir Allen breaks","0"
"LiAngelo Ball s final UCLA career stats 0 minutes 1 steal","0"
"Had to snag this picture of these signs at the UCLA game today lmao","0"
"Congrats to my lil 6 6 285 lb nephew on accepting a full ride to play OL HardWork Sweat D","0"
"In state RB Jeremy Banks lands Tennessee offer Also has offers from Arkansas Ole Miss Texas A amp M UCLA and USC https","0"
"In collaboration with the local community and OptimismCan perform a groundbreaking hand transplant operation https","0"
"UCLA doesn t have dead week with no classes we have DEATH week where classes overlap with finals and everything is on fu","0"
"If I changed I became a better version of myself 4 sUp","0"
"So he lives in the UCLA dorms","0"
"UCLA stans are the Russia stans of the NCAA world","0"
"WeLoveLA UCLA Wolverines overcome 15 point deficit beat UCLA 78 69 in OT SportsRoadhouse","0"
"ICYMI Zavier Simpson with the ridiculous layup to keep Michigan within 2 points late in the comeback victory against UC","0"
"PAC 12 STOCK REPORT Chip Kelly has the recruiting stock up at UCLA runs down the Pac 12","0"
"So surreal here this week Three more days of heavy winds Fyi UCLA is closed today","0"
"The NEW ERA at UCLA 4sup 8Clap","0"
"A special day in history 50 years ago today Gary Beban was awarded the Congratulations","0"
"This makes me proud to be an alumnus","0"
"Sophomore Kyle MacLean son of former Simi Valley and UCLA standout Don MacLean had 43 points for Westlake in 82 51 win","0"
"Georgia tight end on his UCLA official visit","0"
"UCLA Football Josh Rosen having to avoid hits on and off the field","0"
"Yay gonna sleepover with my UCLA girl friend","0"
"If you want to know why the TaxScamBill2017 is a train wreck for graduate students look no further than this op ed in","0"
"Recruiting richesss Nation","0"
"PAC 12 STOCK REPORT Chip Kelly has the recruiting stock up at UCLA runs down the Pac 12","0"
"You d think the three UCLA Basketball Players will say about Rep","0"
"Rawsportz Media post State Playoff game interview with Tulare Union Star RB Kazmeir Allen UCLA bound Kazmeir Allen breaks","0"
"Follow up research needed so much Our study with UCLA cancer researchers found certain types of comedy helps kids","0"
"WATCH Wolverines Wagner Simpson Matthews amp Beilein spoke minutes ago after their 78 69 win over UCLA","0"
"Among the many problematic things with 24 is Jack Bauer s edu background He studied English at UCLA and Criminolog","0"
"Alumni Here are two of our ornaments one of retro and from when I was a student","0"
"GoBlue UCLA vs Michigan with performing the Anthem today","0"
"Congratulations for getting your degree Help UCLA win the Cactus Bowl Help everyone give 100","0"
"UCLA s Thomas Welsh was a late blooming big man in HS Made noise as a rising senior at amp had an effort to r","0"
"Welcome to Westwood defensive coordinator Jerry Azzinaro and linebackers coach Don Pellum 4sUp","0"
"Sophomore Kyle MacLean son of former Simi Valley and UCLA standout Don MacLean had 43 points for Westlake in 82 51 win","0"
"Recruiting 2018 Defensive End Abdul Malik McClain a longtime UCLA commit is on campus this weekend for his official visit 4s","0"
"Guess you could say Michigan stole a win from UCLA","0"
"CHOMP CHOMP No 2 Florida advances to the regional final with a 3 1 victory over No 15 UCLA NCAAVB","0"
"Guess you could say Michigan stole a win from UCLA","0"
"High speed rail study finds that remote cities benefit from connection to global hubs UCLA","0"
"McClure Wishing you a very very Happy Birthday You are an outstanding Coach human being I want to","0"
"Learn how families can cope after the wildfires","0"
"A parent is asking me if i like Ucla do i lie","0"
"BUTLER 2H OV 79 5 1 UCLA 2H OV 76 5 2 ARMY UN 45 2 DEPAUL 2H UN 76 1 DRAKE OV 157 1 DRAKE 2H OV 84 5","0"
"For anyone at mednips or BigNeuro who hasn t gotten enough amazing machine learning neuroscience you should check out Ne","0"
"UCLA and GT barely even got to tip off before Bill Walton apologized on behalf of the entire human race for LiAngelo Ball","0"
"It was the only way the Muslim patient could wipe his ass","0"
"Vivi from UCLA I ve missed you babygirl","0"
"Jordan Howard s recipe for receiving the attention of NBA scouts","0"
"gtr UCLA Royce Hall we are ready See you tonight","0"
"Sophomore Kyle MacLean son of former Simi Valley and UCLA standout Don MacLean had 43 points for Westlake in 82 51 win","0"
"The legacy of Jackie Robinson lives on at the iconic Fun facts Jackie Robinson played football for Pa","0"
"everyday we get closer to this","0"
"UCLA s Thomas Welsh was a late blooming big man in HS Made noise as a rising senior at amp had an effort to r","0"
"Aaron Holiday s 25 points ties a career high UCLA leads Michigan 60 58 with 3 05 left in the second half GoBruins UCLAvs","0"
"CHE Yo Tyreek Evans been killing Roberson smh And Westbrook ain t made a shot since UCLA SMH","0"
"He is but he need to go to UCLA lonzo","0"
"Sophomore MF Jessie Fleming has been selected as a finalist for the UCLA s 3rd finalist in the last 5 year","0"
"UCLA s Thomas Welsh was a late blooming big man in HS Made noise as a rising senior at amp had an effort to r","0"
"SUCk Recruiting I can fam Be apart of something special 4sUP 8Clap","0"
"I m so mad Johnny and Peter went to Fake Marvel Colleges meanwhile Bobby Drake over here is living it up at UCLA","0"
"UCLA only stole twice today making improvements","0"
"Shea Patterson was the main attraction inside Crisler Center Saturday And then a basketball game broke out One that John","0"
"Champions Sports Center is proudly owned and ran by international elite gymnast actor and motivational speaker Aim","0"
"Here for 7th yr in a row HotChocolateNutcracker UCLA to Redondo Beach DADA We the show","0"
"UCSB amp UCLA on fire San Diego schools earthquakes Professors even if this is the apocalypse the final still won t be curv","0"
"Yo Tyreek Evans been killing Roberson smh And Westbrook ain t made a shot since UCLA SMH","0"
"Proud Ram former student intern amp media staff member Nic Hallisey getting national kudos for make believe hoops tweets https","0"
"Newz Kareem Abdul Jabbar Q amp amp A Athlete Activism and All That Comes With It","0"
"For anyone at mednips or BigNeuro who hasn t gotten enough amazing machine learning neuroscience you should chec","0"
"Oklahoma could have a 10 win Army squad and an 11 win FAU squad on their OOC slate Also Chip Kelly and UCLA","0"
"Looks good on ya and your family can watch you play at the Rose Bowl 4sUp 8Clap UCLA","0"
"Loma Wow","0"
"Wagner We just got to work on that and don t take that as just like a little byproduct It s very serious stuff espec","0"
"Nice counter by OKC to Hawk set Melo amp Abrines flipped what s normally the UCLA cut screen for an Abrines 3","0"
"LaVar Ball is teaching his kids that you can escape consequences reacts to LaVar pulling his son LiAnge","0"
"Somebody has been naughty","0"
"BIG 12 STOCK REPORT Which teams are up steady down in Big12 examines the conference top to bottom https","0"
"BOO T Eight Kidnapped them took em to IHOP and flew back for the UCLA basketball game","0"
"Watched Michigan Vs UCLA BB Game CBS talked about 3 players getting out of jail in China and gave 0 credit to President Tr","0"
"One of the best pass rushers out west and a UCLA commit Abdul Malik McClain","0"
"UCLA Basketball The force is not strong with the Bruins in OT loss to Michigan","0"
"Hey Alec Welcome to UCLA If you pick UCLA you ll be get","0"
"Watched Michigan Vs UCLA BB Game CBS talked about 3 players getting out of jail in China and gave 0 credit to Pres","0"
"stbrown Recruiting I think most of us bruins fans respect your decision no","0"
"In collaboration with the local community and OptimismCan perform a groundbreaking hand transplant operation https","0"
"Will he transfer to Michigan Who knows but 1 was front row at today s game vs UCLA","0"
"Thanks to and all of our great fans for helping us get the W today vs UCLA Appreciate your support home a","0"
"Recruiting 2018 Defensive End Abdul Malik McClain a longtime UCLA commit is on campus this weekend for his official visit 4s","0"
"UCLA doctors use magnetic stimulation to rewire the brain for people with depression UCLA","0"
"Poor Huntington Park kids are jet lagged","0"
"She s free like the wind she disperses the clouds or illuminates them with the lightning flash of her gaze Octavio","0"
"UCLA Basketball The force is not strong with the Bruins in OT loss to Michigan","0"
"stbrown Recruiting This is your home Get a good education conquer the field 4sUp","0"
"Why did I apply to UCLA","0"
"Will he transfer to Michigan Who knows but 1 was front row at today s game vs UCLA","0"
"UCLA Basketball The force is not strong with the Bruins in OT loss to Michigan","0"
"Kareem Abdul Jabbar Q amp amp A Athlete Activism and All That Comes With It","0"
"Will he transfer to Michigan Who knows but 1 was front row at today s game vs UCLA","0"
"Will he transfer to Michigan Who knows but 1 was front row at today s game vs UCLA","0"
"BIG 12 STOCK REPORT Which teams are up steady down in Big12 examines the conference top to bottom https","0"
"The defense was great today holding UCLA under 44 Michigan shot 46 9 from the field 34 5 from 3 36 4 from the","0"
"I m raising money for UCLA OR BUST Click to Donate via","0"
"In collaboration with the local community and OptimismCan perform a groundbreaking hand transplant operation https","0"
"Well done young man make UCLA proud Beatsc","0"
"Thanks to and all of our great fans for helping us get the W today vs UCLA Appreciate your support home a","0"
"Gators HC Dan Mullen stopped by team s win over UCLA tonight Photos via","0"
"Made it look so easy The boy should atleast did 2 more years at Ucla BuzzCity","0"
"LaVar Ball is teaching his kids that you can escape consequences reacts to LaVar pulling his son LiAnge","0"
"Hope you select to go to UCLA We have a top rated academic rating great football coaches great campus great we","0"
"QUIT BUYING 1500 DOGS FROM PET STORES WHEN THERE ARE 60 DOGS IN SHELTERS THAT NEED HOMES AND ARE BEING MISTREATED","0"
"after the fresno state game vince young played a amp m and struggled we all knew after that it was over reggie ran f","0"
"ramsey The LOSER is not worthy of wearing the UCLA uniform May he rot in Europe","0"
"ICYMI Zavier Simpson with the ridiculous layup to keep Michigan within 2 points late in the comeback victory against UC","0"
"UCLA only stole twice today making improvements","0"
"A must read for all high school student athletes 100 truth","0"
"Just got to Tampa and saw Michigan beat UCLA Let s go","0"
"LiAngelo Ball says his UCLA teammates started shoplifting first so he joined in","0"
"This is very reminiscent of the 82 UCLA game EnnisWhatley RollTide BuckleUp BamaAfterDark","0"
"How much is Wasserman worth Don t tell me UCLA is cash strapped because of the football coaching change","0"
"UCLA only stole twice today making improvements","0"
"UCLA only stole twice today making improvements","0"
"It s better than watching UCLA lose over and over","0"
"LiAngelo Ball s final UCLA career stats 0 minutes 1 steal","0"
"stbrown It gets better and better every time S1ORM8RUIN 4sUP GoBruins","0"
"weekendgetaway step three concert terabottorff lifeisgood californiadreamin UCLA Royce Hall","0"
"UCLA chemists synthesize narrow ribbons of graphene using only light and heat","0"
"Exciting Opportunity Postdoctoral Fellow Latin American Caribbean Studies","0"
"Welcome to UCLA I ve forward to having you with us You should fit righ","0"
"Recruiting 2018 Defensive End Abdul Malik McClain a longtime UCLA commit is on campus this weekend for his official visit 4s","0"
"ucla girls be on tinder heavy","0"
"BIG 12 STOCK REPORT Which teams are up steady down in Big12 examines the conference top to bottom https","0"
"Will he transfer to Michigan Who knows but 1 was front row at today s game vs UCLA","0"
"Recruiting 2018 Defensive End Abdul Malik McClain a longtime UCLA commit is on campus this weekend for his official visit 4s","0"
"Recruiting 2018 Defensive End Abdul Malik McClain a longtime UCLA commit is on campus this weekend for his official visit 4s","0"
"WeLoveLA UCLA Michigan Wolverines Go Hard in Overtime to Beat UCLA 78 59 SportsRoadhouse","0"
"ICYMI Zavier Simpson with the ridiculous layup to keep Michigan within 2 points late in the comeback victory against UC","0"
"UCLA basketball at Michigan Preview scouting report how to watch","0"
"Thanks to and all of our great fans for helping us get the W today vs UCLA Appreciate your support home a","0"
"1 The state prolonged the depression 2 The middle class wasn t created by the government a","0"
"Lonzo needed at least one more year at UCLA to fix his shot and mature Stop rushing these kids to play with","0"
"Guess you could say Michigan stole a win from UCLA","0"
"Nation","0"
"bell 99 Recruiting Need some nasty ass lineman Kevin gogan and incognito style","0"
"How would you ranked it as UCLA being UCLA","0"
"UCLA only stole twice today making improvements","0"
"this girl s bio says that she goes to ucla focus on studying for finals or whatever instead of being a jerk towa","0"
"Willie Taggart AND Chip Kelly are coming after the Oregon class HARD Source tells me that one of the UO commits on the","0"
"UCLA only stole twice today making improvements","0"
"ZachShaw Scoring 10 points in seven minutes shutting down Aaron Holiday and even emulating a past Ohio point guard who wore No 3 Z","0"
"BIG 12 STOCK REPORT Which teams are up steady down in Big12 examines the conference top to bottom https","0"
"44 Brendan Radley Hiles outta UCLA just sounds nice LocalBoy GoBruins","0"
"Thanks to and all of our great fans for helping us get the W today vs UCLA Appreciate your support home a","0"
"GALLERY Michigan takes down UCLA in OT 78 69","0"
"Nation","0"
"If I changed I became a better version of myself 4 sUp","0"
"2018 Defensive End Abdul Malik McClain a longtime UCLA commit is on campus this weekend for his official visit","0"
"Looking for a fun video for the weekend s Dr David Jewitt visited All Space Considered to describe the strange","0"
"One of the best pass rushers out west and a UCLA commit Abdul Malik McClain","0"
"Just love getting all the UCLA revruits pop up on my feed cause of amp","0"
"BIG 12 STOCK REPORT Which teams are up steady down in Big12 examines the conference top to bo","0"
"ucla just sent me the email saying they received my app i cant believe i get to wait 4 months for my rejection now","0"
"","0"
"On Monday Michigan blew a 20 point lead to lose to Ohio State Today Michigan overcomes a 15 point second half deficit","0"
"In collaboration with the local community and OptimismCan perform a groundbreaking hand transplant operation https","0"
"UCLA collapse at Michigan today shows that developed 4 year talent is better than one and done talent any day of t","0"
