"Really sad Those smoke clouds are from San Diego The one in LA was off Wilshire in Beverly Hills Very close to UCLA","0"
"What quality wins left do you refer to besides Wichita SMU and UCLA are OK but nothing the committee will care about","0"
"UC absolutely has to win at UCLA or best case scenario is probably a 6 seed","0"
"Michigan Wolverines overcome 15 point deficit beat UCLA 78 69 in OT","0"
"Guess you could say Michigan stole a win from UCLA","0"
"Guess you could say Michigan stole a win from UCLA","0"
"Alaskan dropkicker I was actually at the store today debating whether to buy a shirt for the dog I don t have lmao","0"
"Lol Look you have 4 really 3 Non conference games anyone will give any shits about You ve already shit the","0"
"So Cincinnati is now 0 2 against KenPom Top 100 teams Bearcats better beat Mississippi State and UCLA","0"
"Guess you could say Michigan stole a win from UCLA","0"
"Alaskan But then you gotta get that ucla dog swag He looks like he has demon eyes amp like dropkicker moose p","0"
"All DTR 14 wants for Christmas is his UCLA playbook","0"
"SEC Kentucky transfer Charles Matthews went for 20 8 and 3 today for Michigan and hit the overtime dagger 3 pointer agains","0"
"But then you gotta get that ucla dog swag He looks like he has demon eyes amp like dropkicker m","0"
"Wolverines Down by 15 in the second half and Michigan comes back and beats UCLA in overtime What a win GoBlue","0"
"See our latest LosAngeles CA job and click to apply Anesthesia Technican Healthcare Hiring CareerArc","0"
"Proud Ram former student intern amp media staff member Nic Hallisey getting national kudos for make believe hoops tweets https","0"
"bell 99 Having a great official visit at UCLA 4sUp Bruins","0"
"LaVar Ball is teaching his kids that you can escape consequences reacts to LaVar pulling his son LiAnge","0"
"Recruiting Top 2018 UCLA OL target with HC Chip Kelly","0"
"Spring Grove native Eli Brooks just hit two HUGE free throws to send Michigan s game against UCLA into OT","0"
"Recruiting 2018 Tight End Target Tommy Tremble is currently on his UCLA Official Visit 8CLAP","0"
"Oklahoma could have a 10 win Army squad and an 11 win FAU squad on their OOC slate Also Chip Kelly and UCLA","0"
"Heisler At least UCLA s done with LaVar Ball the Lakers aren t","0"
"Lambda Messes with Fireball Wednesday Creates Fireball Week","0"
"Michigan had some big non confrence wins before today against UCLA On December 6th 2008 Michigan beat Number 4 Duk","0"
"Miss St and UCLA are now must wins","0"
"On Monday Michigan blew a 20 point lead to lose to Ohio State Today Michigan overcomes a 15 point second half deficit","0"
"Michigan Wolverines overcome 15 point deficit beat UCLA 78 69 in OT","0"
"Thanks to and all of our great fans for helping us get the W today vs UCLA Appreciate your support home a","0"
"Michigan Wolverines overcome 15 point deficit beat UCLA 78 69 in OT","0"
"Michigan Wolverines overcome 15 point deficit beat UCLA 78 69 in OT","0"
"Michigan Wolverines overcome 15 point deficit beat UCLA 78 69 in OT","0"
"Michigan Wolverines overcome 15 point deficit beat UCLA 78 69 in OT","0"
"Michigan Wolverines overcome 15 point deficit beat UCLA 78 69 in OT","0"
"Michigan Wolverines overcome 15 point deficit beat UCLA 78 69 in OT","0"
"Michigan Wolverines overcome 15 point deficit beat UCLA 78 69 in OT","0"
"Michigan Wolverines overcome 15 point deficit beat UCLA 78 69 in OT","0"
"Why are we stirring the pot over leos Is Utah going to publicly apologize for their fans","0"
"Shea Patterson was the main attraction inside Crisler Center Saturday And then a basketball game broke out One that John","0"
"Tonight I met a guy from UCLA and he was so sweet","0"
"BRH RACE Who will win the race for new 5 Star DB Brendan Radley Hiles amp discuss","0"
"dropkicker Not to boast but UCLA totally cultivates leaders OMG Just had an awesome class the instructor c o 94 was inspir","0"
"Colgan UCLA bail study finds price of freedom too high for poor L A families","0"
"YOU GUYS WE ARE SO CLOSE TO THE GOAL OF 25 000 please retweet Kendra Perez Memorial Scholarship","0"
"Recruiting Top 2018 UCLA OL target with HC Chip Kelly","0"
"bell 99 Having a great official visit at UCLA 4sUp Bruins","0"
"Thanks to and all of our great fans for helping us get the W today vs UCLA Appreciate your support home a","0"
"Recruiting Considering position very important prospect for ucla Former Alabama commit","0"
"LOOK Michigan fan taunts UCLA with disembodied LaVar Ball head","0"
"LOOK Michigan fan taunts UCLA with disembodied LaVar Ball head","0"
"UCLA bound RB breaks NATIONAL single season TD record Watch","0"
"OnThisDay December 9 1998 attended the Fire amp Ice Ball at Universal Studios in Hollywood benefitting the U","0"
"Johnson80 Another great one earlier today in Michigan vs UCLA https","0"
"Thanks to and all of our great fans for helping us get the W today vs UCLA Appreciate your support home a","0"
"Thanks to and all of our great fans for helping us get the W today vs UCLA Appreciate your support home a","0"
"Rawsportz Media post State Playoff game interview with Tulare Union Star RB Kazmeir Allen UCLA bound Kazmeir Allen breaks","0"
"UCLA gymnasts shine at Meet the Bruins preseason intrasquad Recap GoBruins","0"
"Recruiting 2018 Tight End Target Tommy Tremble is currently on his UCLA Official Visit 8CLAP","0"
"SEC STOCK REPORT amp discuss where each team in the league stands as signing day approaches https","0"
"Colgan UCLA bail study finds price of freedom too high for poor L A families","0"
"Lavar Ball s dad says it no big deal that his son was caught shoplifting in China With a dad like that easy to see why","0"
"A must read for all high school student athletes 100 truth","0"
"Johnson80 Another great one earlier today in Michigan vs UC","0"
"Michigan Wolverines overcome 15 point deficit beat UCLA 78 69 in OT","0"
"beat North Mecklenburg 85 79 to move to 11 1 6 9 5 Jaemyn Brakefield 20 was a machine with 30","0"
"THIS IS NOT OKAY THAT INSTRUCTORS TEXT STUDENTS FIX YOUR SHIT","0"
"I checked in at UCLA on Yelp","0"
"Thanks to and all of our great fans for helping us get the W today vs UCLA Appreciate your support home a","0"
"Michigan Wolverines overcome 15 point deficit beat UCLA 78 69 in OT","0"
"Michigan Wolverines overcome 15 point deficit beat UCLA 78 69 in OT","0"
"Michigan Wolverines overcome 15 point deficit beat UCLA 78 69 in OT","0"
"Michigan Wolverines overcome 15 point deficit beat UCLA 78 69 in OT","0"
"Michigan Wolverines overcome 15 point deficit beat UCLA 78 69 in OT","0"
"It s not your father s UCLA just sayin","0"
"FALL FINAL REVIEWS UCLA","0"
"007 THE PIG EATS KFC TACO BELL AND WATCHES PORN","0"
"beat North Mecklenburg 85 79 to move to 11 1 6 9 5 Jaemyn Brakefield 20 was a machine","0"
"Orange Co ARTS Michigan Wolverines overcome 15 point deficit beat UCLA 78 69 in OT","0"
"Michigan Wolverines overcome 15 point deficit beat UCLA 78 69 in OT","0"
"Thanks to and all of our great fans for helping us get the W today vs UCLA Appreciate your support home a","0"
"In collaboration with the local community and OptimismCan perform a groundbreaking hand transplant operation https","0"
"Thanks to and all of our great fans for helping us get the W today vs UCLA Appreciate your support home a","0"
"Ukrainian author of Manafort op ed says sought input to avoid errors reuters ucla nba","0"
"bell 99 Having a great official visit at UCLA 4sUp Bruins","0"
"Wolverines overcome 15 point deficit beat UCLA 78 69 in OT","0"
"DAHLin Ok minus the sex tape But in its place highlight tapes from AAU thru UCLA tapes lol","0"
"WATCH Highlights from Michigan s overtime victory over UCLA via","0"
"Listening to 247Sports College Football Podcast Rick Neuheisel talks playoff Chip Kelly UCLA coaching carousel vi","0"
"Thanks to and all of our great fans for helping us get the W today vs UCLA Appreciate your support home a","0"
"Thanks to and all of our great fans for helping us get the W today vs UCLA Appreciate your support home a","0"
"Lavar Ball s dad says it no big deal that his son was caught shoplifting in China With a dad like that easy to see why","0"
"What are speech disorders Up to 9 of U S children will develop one Here s everything you need to know","0"
"Check out this Q amp A with Jesus Martinez M F A 08 who worked as the layout and animation manager on the film","0"
"some people are just better suited on ground level","0"
"Wolverines overcome 15 point deficit beat UCLA 78 69 in OT","0"
"Andrew Lopez Meanwhile LSU offers 2020 QB Jack Miller out of Arizona Miller already holds offers from Arizona Arizona State Fl","0"
"Wolverines overcome 15 point deficit beat UCLA 78 69 in OT Sports","0"
"Wolverines overcome 15 point deficit beat UCLA 78 69 in OT","0"
"Lavar Ball s dad says it no big deal that his son was caught shoplifting in China With a dad like that easy to see why","0"
"UCLA vs Michigan NCAA Basketball 2017 09 12 2017 via","0"
"Will he transfer to Michigan Who knows but 1 was front row at today s game vs UCLA","0"
"Can t wait for ncaa Gymnastics season UCLA is ready MeetTheBruins","0"
"On a run in SD while wearing a den shirt I just passed a middle age man wearing a UCLA sweatshirt and said go Bru","0"
"Thanks to and all of our great fans for helping us get the W today vs UCLA Appreciate your support home a","0"
"Bird battle trash talk between AJ Who is best or Alshon Check the history Sou","0"
"Wolverines overcome 15 point deficit beat UCLA 78 69 in OT","0"
"I loved your product and my School UCLA is one of your teams I WILL NOT BUY UNDER ARMOUR AGAIN TILL L","0"
"007 and even that taxes his abilities","0"
"NCAA MBB 12 9 Boston College 89 Duke 84 F Wichita St 78 Oklahoma St 66 F Xavier 96 Colorado 69 F Wyoming","0"
"Can y all see it GoBruins","0"
"Bless Ruta Lee for her great work with Thallians tonight for UCLA amd our Men Women of our military Love her Ann Andy","0"
"Rawsportz Media post State Playoff game interview with Tulare Union Star RB Kazmeir Allen UCLA bound Kazmeir Allen breaks","0"
"UCLA game at 9am I dont get out the bed befo 2 30 dont start the game so early next time","0"
"Postdoc Fellowships Available in Math Physical Sciences Engineering at and for thos","0"
"Not to boast but UCLA totally cultivates leaders OMG Just had an awesome class the instructor c o 94 was i","0"
"TFT That s what friends are for","0"
"GALLERY Several Michigan targets commits players coaches and staffers were all at Crisler Center for the Wolverines b","0"
"Thanks to and all of our great fans for helping us get the W today vs UCLA Appreciate your support home a","0"
"Thanks to and all of our great fans for helping us get the W today vs UCLA Appreciate your support home a","0"
"GALLERY Several Michigan targets commits players coaches and staffers were all at Crisler Center for the Wolverines b","0"
"JOB Cardiac Surgeon Heart and Lung Procurement UCLA School of Medicine Los Angeles CA healthcare careers","0"
"Guess you could say Michigan stole a win from UCLA","0"
"Thanks to and all of our great fans for helping us get the W today vs UCLA Appreciate your support home a","0"
"Stat Leaders Huntington Prep Jaemyn Brakefield 30pts 7rebs Kenneth Nwuba UCLA commit 10pts amp 6rebs Michael Christmas 13pts amp 6rebs","0"
"ICYMI Zavier Simpson with the ridiculous layup to keep Michigan within 2 points late in the comeback victory against UC","0"
"And my son told me he s getting his scholarship to UCLA and then leaving California because the Le","0"
"UCLA bound RB breaks NATIONAL single season TD record Watch","0"
"UCLA men s basketball team whose biggest challenges have come off the court faces its toughest test yet","0"
"LaVar Ball is teaching his kids that you can escape consequences reacts to LaVar pulling his son LiAnge","0"
"Thanks to and all of our great fans for helping us get the W today vs UCLA Appreciate your support home a","0"
"Thanks to and all of our great fans for helping us get the W today vs UCLA Appreciate your support home a","0"
"TIL reporting this story that the does not publish same sex couples totals by city","0"
"3 Lonzo Ball is the first point guard from UCLA to go 0 1 then hit a three over Kemba Walker","0"
"Postdoc Fellowships Available in Math Physical Sciences Engineering at and for thos","0"
"1983 who was 1 in Pauley Pavilion a few days after Coach Bryant died I was 10 and listened on a clock radio","0"
"Will he transfer to Michigan Who knows but 1 was front row at today s game vs UCLA","0"
"Thanks to and all of our great fans for helping us get the W today vs UCLA Appreciate your support home a","0"
"Guess you could say Michigan stole a win from UCLA","0"
"Three star receiver Geordon Porter de commits from Notre Dame Would assume regime changes at UCLA ASU and maybe Oregon","0"
"Thanks to and all of our great fans for helping us get the W today vs UCLA Appreciate your support home a","0"
"Thanks to and all of our great fans for helping us get the W today vs UCLA Appreciate your support home a","0"
"Little known fact I did one year of summer school at after my rookie year but now I hire film students on the r","0"
"FINAL Game 4 82 Michael Christmas 22 Jonathan McGriff 17p 7a 4r Kenny Nwuba 15p 8r UCLA","0"
"u said Obama wasn t a legit president we remember how u treated the CENTRAL PARK 5 Colin Kaepern","0"
"bell 99 Having a great official visit at UCLA 4sUp Bruins","0"
"And my son told me he s getting his scholarship to UCLA and then leaving California because the Le","0"
"Thanks to and all of our great fans for helping us get the W today vs UCLA Appreciate your support home a","0"
