"DAHLin Good debate we got going Im Enjoying it Gelo not flashy like his 2 other Bros I agree","0"
"Are the rumors true about Tua transferring to UCLA I hope not but I don t","0"
"What petting a dog can do for your mentalhealth and physical according to UCLA research","0"
"Recruiting Top 2018 Target Bryan Addison is in Westwood on his UCLA OV this weekend A decision is looming for one of the nation","0"
"bell 99 Having a great official visit at UCLA 4sUp Bruins","0"
"Thanks to and all of our great fans for helping us get the W today vs UCLA Appreciate your support home a","0"
"So Michigan beat UCLA today GoBlue","0"
"gtr UCLA Royce Hall we are ready See you tonight","0"
"What petting a dog can do for your mentalhealth and physical according to UCLA research","0"
"Michigan Basketball vs UCLA Comeback Win Highlights via","0"
"UCLA Basketball The force is not strong with the Bruins in OT loss to Michigan via","0"
"Thanks to and all of our great fans for helping us get the W today vs UCLA Appreciate your support home a","0"
"Rawsportz Media post State Playoff game interview with Tulare Union Star RB Kazmeir Allen UCLA bound Kazmeir Allen breaks","0"
"What petting a dog can do for your mentalhealth and physical according to UCLA research","0"
"Thanks to and all of our great fans for helping us get the W today vs UCLA Appreciate your support home a","0"
"i would argue that the vast majority of Calipari recru","0"
"UCLA Royce Hall we are ready See you tonight","0"
"workmode ucla roycehall confluence is a very talented group of college students UCLA","0"
"UCLA gymnasts shine at Meet the Bruins preseason intrasquad Recap GoBruins","0"
"Josh Rosen s stellar night for UCLA ends in frustration Education","0"
"Thanks to and all of our great fans for helping us get the W today vs UCLA Appreciate your support home a","0"
"LiAngelo Ball s final UCLA career stats 0 minutes 1 steal","0"
"Guess you could say Michigan stole a win from UCLA","0"
"Thanks to and all of our great fans for helping us get the W today vs UCLA Appreciate your support home a","0"
"UCLA only stole twice today making improvements","0"
"Thanks to and all of our great fans for helping us get the W today vs UCLA Appreciate your support home a","0"
"You mean Florida Atlantic UCLA and Army have to play Kyler Murray","0"
"I saw Mr Jones casually walking at ucla whattt lol","0"
"theD School shooting UCLA uhhhh students take your finals Bomb threat UCLA uhhh summer school is still in session Fire UCLA","0"
"Telemedicine clinics allow patients to talk to their doctors remotely without having to make the trip to see them in pe","0"
"No 7 UCLA falls to Goodwin Oklahoma State Dec 08 2017","0"
"Telemedicine clinics allow patients to talk to their doctors remotely without having to make the trip to see them in pe","0"
"MichiganBasketball 3 takeaways from the comeback win over UCLA via Wolverine","0"
"Michigan beats UCLA in OT 78 69","0"
"MichiganBasketball 3 takeaways from the comeback win over UCLA via Wolverine","0"
"Josh is trash you guys want that guy from Wyoming or some low school lower than UCLA for sure","0"
"Thanks to and all of our great fans for helping us get the W today vs UCLA Appreciate your support home a","0"
"I m not saying he should have beat Mayfield but 5th Zero love for the left coast if you are not SC","0"
"Ouch UCLA forgets how to play basketball the last minute of the 2nd half and get beat on a 13 4 run 2nd loss of the w","0"
"I liked a video Michigan Basketball vs UCLA Comeback Win Highlights","0"
"Current UCSB amp UCLA students during finals week","0"
"Postdoc Fellowships Available in Math Physical Sciences Engineering at and for thos","0"
"grimes studying dance at UCLA","0"
"Wolverines overcome 15 point deficit beat UCLA 78 69 in OT Dec 09 2017 via","0"
"Top 2018 Target Bryan Addison is in Westwood on his UCLA OV this weekend A decision is looming for one of the nat","0"
"All DTR 14 wants for Christmas is his UCLA playbook","0"
"bell 99 Having a great official visit at UCLA 4sUp Bruins","0"
"What do you think about Lavar Ball pulling Liangelo from UCLA and Lamelo","0"
"Postdoc Fellowships Available in Math Physical Sciences Engineering at and for thos","0"
"Browns must draft QB Lamar Jackson or UCLA Rosen","0"
"Can you please talk about the horrific UCLA side boob training leos on your next episode","0"
"I wasted the first part of my day watching Michigan come back from 15 down to beat UCLA in OT","0"
"Thanks to and all of our great fans for helping us get the W today vs UCLA Appreciate your support home a","0"
"RSP Boiler Room No 90 QB Josh Rosen UCLA Eye Discipline And Patience","0"
"Nice win today Big comeback and great win over a good UCLA team GoBlue Michigan","0"
"Colgan UCLA bail study finds price of freedom too high for poor L A families","0"
"Thanks to and all of our great fans for helping us get the W today vs UCLA Appreciate your support home a","0"
"Remember this 44 10 ucla 34 point comeback","0"
"Shea Patterson will visit Michigan for the Michigan UCLA game","0"
"Sounds like we have some Bruins that aren t used to a TrueBruin greeting Keep up the good work BruinProud","0"
"Exciting Opportunity Postdoctoral Fellow Latin American Caribbean Studies","0"
"Thanks to and all of our great fans for helping us get the W today vs UCLA Appreciate your support home a","0"
"Earlier in the week we reported that UCLA QB Josh Rosen refuted reports that he had declared for the NFLDraft It s p","0"
"Michigan s inability to throw the ball in the ocean from the beach is the only reason UCLA is even in this game","0"
"I m here to stay","0"
"UCLA salutes our 1967 Gary Beban on his 50th anniversary and congratulations to Baker Mayfield on joinin","0"
"Thanks to and all of our great fans for helping us get the W today vs UCLA Appreciate your support home a","0"
"Mr get Loose gonna do great at UCLA look forward to watching Kaz get loose at the next level congrats Brad","0"
"bell 99 Having a great official visit at UCLA 4sUp Bruins","0"
"18 4 seconds left UCLA leads 64 63 with the ball Let s GoBlue","0"
"trigonis30 RT latsondheimer Sophomore Kyle MacLean son of former Simi Valley and UCLA standout Don MacLean h","0"
"I think Baker s an ass but it s clear that not only was he the best player but that his team will go through hell","0"
"UCLA salutes our 1967 Gary Beban on his 50th anniversary and congratulations to Baker Mayfield on joinin","0"
"ACC STOCK REPORT Rob look at where ACC teams stand from a recruiting perspective","0"
"Sophomore Kyle MacLean son of former Simi Valley and UCLA standout Don MacLean had 43 points for Westlake in 82 51 win","0"
"UCLA only stole twice today making improvements","0"
"Michigan rallies to beat UCLA in OT","0"
"UCLA only stole twice today making improvements","0"
"LiAngelo Ball says his UCLA teammates started shoplifting first so he joined in","0"
"RSP Boiler Room No 90 QB Josh Rosen UCLA Eye Discipline And Patience","0"
"Exciting Opportunity Postdoctoral Fellow Latin American Caribbean Studies","0"
"Can you cite any analysis of 2A from the time period of ratification which found the right protec","0"
"UCLA Football Josh Rosen having to avoid hits on and off the field Via By","0"
"MICHIGAN WINS Michigan takes the 78 69 victory over UCLA GoBlue","0"
"We have one Caleb we just dont get payed for it","0"
"BruinNation is anti UCLA","0"
"Dear Dr Mesgaran I am trying to reach you to invite you to speak at UCLA Iranian Studies Program as p","0"
"UCLA only stole twice today making improvements","0"
"Thanks to and all of our great fans for helping us get the W today vs UCLA Appreciate your support home a","0"
"On Monday Michigan blew a 20 point lead to lose to Ohio State Today Michigan overcomes a 15 point second half deficit","0"
"Can y all see it GoBruins","0"
"bell 99 Had an amazing conversation with Chip Kelly about where He sees me benefiting the program","0"
"All DTR 14 wants for Christmas is his UCLA playbook","0"
"Sophomore Kyle MacLean son of former Simi Valley and UCLA standout Don MacLean had 43 points for Westlake in 82 51 win over Golden Valley","0"
"lmk if you re applying to ucla","0"
"ZachShaw Michigan mounts epic comeback downs UCLA in thrilling overtime win Story","0"
"Your expectations aren t to be in the 8 9 game again To get top 4 seed we need these games MSSt and U","0"
"WeLoveLA RT UCLA UCLA salutes our 1967 HeismanTrophy Gary Beban on his 50th anniversary and congratulations to","0"
"WeLoveLA UCLA UCLA Football Josh Rosen having to avoid hits on and off the field SportsRoadhouse","0"
"WeLoveLA UCLA Wolverines overcome 15 point deficit beat UCLA 78 69 in OT SportsRoadhouse","0"
"UCLA salutes our 1967 Gary Beban on his 50th anniversary and congratulations to Baker Mayfield on joinin","0"
"UCLA shows three 10 0 starts layout 1 5s from Hano and Hall tucked 1 5 from Kramer Yfulls from Tratz Ross and Denni","0"
"UCLA has one year left on their contract with Rebecca s Mom and has a carve out for their deal with Under Armour Next y","0"
"ICYMI Zavier Simpson with the ridiculous layup to keep Michigan within 2 points late in the comeback victory against UC","0"
"Alumni The NEW ER","0"
"ZachShaw Scoring 10 points in seven minutes shutting down Aaron Holiday and even emulating a past Ohio point guard who wore No 3 Z","0"
"UCLA Guards top two","0"
"Four E passes from UCLA Ohashi and Hano DLO Dennis dbl Arabian Tratz full in","0"
"UCLA salutes our 1967 Gary Beban on his 50th anniversary and congratulations to Baker Mayfield on j","0"
"Gigantic coward pulled his kid out of UCLA 3 days before he had to come to Ann Arbor and fight me Sad","0"
"Blink and you might have missed the Michigan men s basketball team s comeback","0"
"CoachPop Stat Leaders Huntington Prep Jaemyn Brakefield 30pts 7rebs Kenneth Nwuba UCLA commit 10pts amp 6rebs Michael Christma","0"
"This job might be a great fit for you Clinical Trials Coverage Coordinator Healthcare","0"
"Thanks to and all of our great fans for helping us get the W today vs UCLA Appreciate your support home a","0"
"Did ESPN really have to use that Bryce Love run against UCLA for his Heisman Trophy vignette Really ESPN","0"
"Here we go What an honor to present the final concert of gtr s farewell U S tour Meeting of the Spirits","0"
"Andrew Lopez Meanwhile LSU offers 2020 QB Jack Miller out of Arizona Miller already holds offers from Arizona Arizona State Fl","0"
"Guess you could say Michigan stole a win from UCLA","0"
"U N envoy told North Korea urgent need to open channels to cut conflict risk reuters","0"
"Rawsportz Media post State Playoff game interview with Tulare Union Star RB Kazmeir Allen UCLA bound Kazmeir Allen breaks","0"
"Wolverines overcome 15 point deficit beat UCLA 78 69 in OTANN ARBOR Mich AP Moritz Wagner scored 23 points a","0"
"takes down 7 UCLA in GIA This team is fun to watch Thanks to all the fans that were here For everyone else co","0"
"UCLA Coach Steve Alford Responded To LiAngelo Ball Leaving School","0"
"Nope Two more shots this week Mississippi State and then UCLA on network television next weekend","0"
"OnThisDay December 9 1998 attended the Fire amp Ice Ball at Universal Studios in Hollywood benefitting the U","0"
"Leading the NEW ERA at UCLA 4sup 8Clap","0"
"Soo I posted on Snapchat that I was hungry while at work and my bf who s at UCLA ordered me pizza and had it delive","0"
"UCLA only stole twice today making improvements","0"
"Thanks to and all of our great fans for helping us get the W today vs UCLA Appreciate your support home a","0"
"Be a part of the NEW ERA at UCLA 4sup 8Clap","0"
"Thanks to and all of our great fans for helping us get the W today vs UCLA Appreciate your support home a","0"
"So far 7 2 ATS today Pret tay Pret tay Pret tay good","0"
"ACC STOCK REPORT Rob look at where ACC teams stand from a recruiting perspective","0"
"Lavar says he can get Gelo ready for the draft better than UCLA can UCLA has 15 active and 117 former NBA playe","0"
"I m here to stay","0"
"Ole Miss fans are more upset than UCLA fans that Michigan won","0"
"Thanks to and all of our great fans for helping us get the W today vs UCLA Appreciate your support home a","0"
"I m here to stay","0"
"Alumni This also happens to me far too often","0"
"Rawsportz Media post State Playoff game interview with Tulare Union Star RB Kazmeir Allen UCLA bound Kazmeir Allen breaks","0"
"They re not the only one with highlight tapes from aau to UCLA lavar just knows how to ma","0"
"ICYMI Zavier Simpson with the ridiculous layup to keep Michigan within 2 points late in the comeback victory against UC","0"
"UCLA EDUCATED NEUROSCIENTIST has published just one scientific research article in his life And it","0"
"bell 99 Having a great official visit at UCLA 4sUp Bruins","0"
"bell 99 Having a great official visit at UCLA 4sUp Bruins","0"
"UCLA s sloppy ending haunts them in 78 69 overtime loss to Michigan","0"
"Results of today s games Kentucky W Duke L UCLA L Indiana L","0"
"Thanks to and all of our great fans for helping us get the W today vs UCLA Appreciate your support home a","0"
"Thanks to and all of our great fans for helping us get the W today vs UCLA Appreciate your support home a","0"
"Wagner We just got to work on that and don t take that as just like a little byproduct It s very serious stuff","0"
"UCLA bound RB breaks NATIONAL single season TD record Watch","0"
"Michigan guard Zavier Simpson left heads to the basket ahead of UCLA guard Aaron Holiday","0"
"Lonzo Ball is a distraction to the game Return him to UCLA he needs to take some classes and choose a new profession","0"
"Spotted in the Michigan student section ahead of today s game vs UCLA A WeWantSHEA sign along with a LaVar Ball head","0"
"Deontay Shea and Van at UM UCLA game","0"
"bell 99 Having a great official visit at UCLA 4sUp Bruins","0"
"Recruiting 2018 Tight End Target Tommy Tremble is currently on his UCLA Official Visit 8CLAP","0"
"BROOOOOO UCLA BOUND HM BET","0"
"Beat Miss State and UCLA and go on Big run in conference play and we will be back in the top 15 We can do better","0"
"Guess you could say Michigan stole a win from UCLA","0"
"Thanks to and all of our great fans for helping us get the W today vs UCLA Appreciate your support home a","0"
"Nation Defeat from the jaws of victory smh","0"
"People are entitled to their wrong opnions It s not real It s Gif I don t say I got my friend a Jift for his birth","0"
"bell 99 Having a great official visit at UCLA 4sUp Bruins","0"
"UCLA should do an Alumni Day for former hoopers or have something similar to the Then Now and Forever pregame tailgate","0"
"UCLA only stole twice today making improvements","0"
"UCLA only stole twice today making improvements","0"
"god pls let me be accepted to ucla","0"
"Michigan basketball reverses fortune finishes strong in OT vs UCLA 78 69","0"
"LOOK Michigan hosts the OleMich trio and several commits to the Wolverines UCLA basketball game","0"
"Thanks to and all of our great fans for helping us get the W today vs UCLA Appreciate your support home a","0"
"Gelo you need school you not finishing out at UCLA will make you dumber than your father Lavar Stupid","0"
"Join us and the UCLA chapter for happy hour in West LA this Thursday RSVP here","0"
"Just 3 05 to play UCLA leads 60 58 We need you CrislerLIVE GoBlue","0"
"Photo Gallery Michigan 78 UCLA 69 OT","0"
"Looks like he didn t have a hard time finding work after UCLA hired Kelly","0"
"Utah is down by 3 to UCLA They shoot and make a 2 at the buzzer and celebrate","0"
"Friendly reminder for my NC friends tonight Bridges and spans are air cooled structures That s why they ice before roads I","0"
"Thanks to and all of our great fans for helping us get the W today vs UCLA Appreciate your support home a","0"
"Gary Beban The Great One Redwood City California UCLA 1967 HeismanTrophy","0"
"UCLA should do an Alumni Day for former hoopers or have something similar to the Then Now and Forever pregame tailgate","0"
"Summertime c 1894 Mary Cassatt American 1844 1926 oil on canvas Hammer Museum Los Angeles California US","0"
"Thanks to and all of our great fans for helping us get the W today vs UCLA Appreciate your support home a","0"
"Our work on a Semantic Loss function for deep learning with unlabeled data and or complex constraints Now in the learning with","0"
"Michigan basketball erases deficit stuns UCLA Bruins in OT 78 69","0"
"Thanks to and all of our great fans for helping us get the W today vs UCLA Appreciate your support home a","0"
"Nation Banner time","0"
"Too bad room almost empty when Judea Pearl is speaking Paper should be worth a read as well","0"
"All DTR 14 wants for Christmas is his UCLA playbook","0"
"Is anyone waiting for the end game of Mardsen s tweets about UCLA Underarmour leos I mean why does he keep tagging Underarmour and UCLA","0"
"We re hiring Read about our latest job opening here Medical Assistant Healthcare LosAngeles CA CareerArc","0"
"Gross old men bitching about the UCLA gymnasts not wearing the extremely scanty sponsored leos to their intrasquad can go fuck themselves","0"
"Thanks to and all of our great fans for helping us get the W today vs UCLA Appreciate your support home a","0"
"Postdoc Fellowships Available in Math Physical Sciences Engineering at and for thos","0"
"Thanks to and all of our great fans for helping us get the W today vs UCLA Appreciate your support home a","0"
"One of the first documentary features on gay and lesbian identity WORD IS OUT STORIES OF SOME OF OUR LIVES 1977 pre","0"
"Guess you could say Michigan stole a win from UCLA","0"
"gtr Last concert tonight with this beauty It can be yours in one day and all proceeds go to charity If you don t need a gui","0"
"Thanks to and all of our great fans for helping us get the W today vs UCLA Appreciate your support home a","0"
"UCLA Gymnasts Shine at Meet the Bruins","0"
"UCLA vs Michigan NCAA Basketball 2017 09 12 2017 via 12 10 2017 SUNDAY","0"
"bell 99 Having a great official visit at UCLA 4sUp Bruins","0"
"According to NFL Draft analyst Tony Pauline the clash between UCLA s Josh Rosen amp USC s Sam Darnold was described to him as on","0"
"So much butthurt from no name UCLA fanboys hiding behind no name accounts This class has 11 commits","0"
"Thanks to and all of our great fans for helping us get the W today vs UCLA Appreciate your support home a","0"
"UCLA showed up for the and heroes fighting the SkirballFire providing roughly 300 free meals to the command","0"
"Whoa whoa go straight to the hospital and get checked out Your lips and fingers should be bu","0"
"Alumni Welcome to BruinNation 4sUp","0"
"With Michigan and UCLA set to play at noon today we take a look at a bend in history that ties the two Lew Alcindor Michi","0"
"AUDIO HIGHLIGHTS Listen to s top calls as Michigan comes back to defeat UCLA LISTEN","0"
"Current OleMiss QB Shea Patterson is in Ann Arbor at the Michigan UCLA hoops game","0"
"ACC STOCK REPORT Rob look at where ACC teams stand from a recruiting perspective","0"
"UCLA gymnasts shine at Meet the Bruins preseason intrasquad Recap GoBruins","0"
"was it close i missed all the games today with family stuff going on michigan beat ucla so i m happy about that","0"
"Moritz Wagner on overtime win over UCLA","0"
"So OSU came back from down 20 to beat the team that just beat UCLA On top of that dominating W amp M today Good day for Buckey","0"
"OSU It s ok to like UCLA again since they ll no longer have anything to do with the Ball family","0"
"UCLA needs liangelo ball lmao","0"
"SJP At UCLA Condemns Anti Semitic Cartoon Drawn By One Of Their Members Daily Wire","0"
"UCLA Football Josh Rosen having to avoid hits on and off the field Via By","0"
"U aint goin to UCLA boi","0"
"UCLA Football Josh Rosen having to avoid hits on and off the field Via By","0"
"ICYMI Zavier Simpson with the ridiculous layup to keep Michigan within 2 points late in the comeback victory against UC","0"
"ACC STOCK REPORT Rob look at where ACC teams stand from a recruiting perspective","0"
"I ve done plenty of pieces for but this might just be the first true opinion piece I ve written for them","0"
"bell 99 Having a great official visit at UCLA 4sUp Bruins","0"
"beat North Mecklenburg 85 79 to move to 11 1 6 9 5 Jaemyn Brakefield 20 was a machine with 30","0"
"He may have retracted But the rest of the low iq gang will keep the lie alive make it huge in fact amp","0"
"ICYMI How To Create A Foundational Estate Plan HuffPost Retirement","0"
"Thanks to and all of our great fans for helping us get the W today vs UCLA Appreciate your support home a","0"
"Mississippi state and UCLA have now become must wins because you need SOMETHING out of this out of conference sched","0"
"UCLA Football Josh Rosen having to avoid hits on and off the field Via By","0"
"This is why CollegeBasketball is great Michigan basketball erases deficit stuns UCLA Bruins in OT 78 69","0"
"Alaskan dropkicker I got him the hoodie collar little UCLA bone bling for his collar amp a shirt He wore it","0"
"UCLA Football Josh Rosen having to avoid hits on and off the field","0"
"Thanks to and all of our great fans for helping us get the W today vs UCLA Appreciate your support home a","0"
"Michigan beating ucla helps a little though","0"
"Win up to 200 in Bitcoin every hour Win up to 150 in Dogcoin every","0"
"OnThisDay December 9 1998 attended the Fire amp Ice Ball at Universal Studios in Hollywood benefitting the U","0"
"Just 3 05 to play UCLA leads 60 58 We need you CrislerLIVE GoBlue","0"
"GALLERY Several Michigan targets commits players coaches and staffers were all at Crisler Center for the Wolverines b","0"
"beat North Mecklenburg 85 79 to move to 11 1 6 9 5 Jaemyn Brakefield 20 was a machine with 30","0"
"I ve done plenty of pieces for but this might just be the first true opinion piece I ve written for","0"
"This job might be a great fit for you Outpatient Coding Supervisor Healthcare","0"
"Bummer of a finish for the Bearcats Still have Mississippi State and UCLA in the next week","0"
"I need to know who number 3 is on UCLA women basketball team asking for a friend lmao","0"
"Guess you could say Michigan stole a win from UCLA","0"
"Alaskan Lol sameeee my mom was like aaaiiigh hija","0"
"Earlier in the week we reported that UCLA QB Josh Rosen refuted reports that he had declared for the NFLDraft It s p","0"
"UCLA Football Josh Rosen having to avoid hits on and off the field via","0"
"Earlier in the week we reported that UCLA QB Josh Rosen refuted reports that he had declared for the NFLDraft It","0"
"I say it works at CU Arizona and UCLA have the tradition to get 4 and 5 stars CU doesn t h","0"
"beat North Mecklenburg 85 79 to move to 11 1 6 9 5 Jaemyn Brakefield 20 was a machine with 30","0"
"Michigan Wolverines overcome 15 point deficit beat UCLA 78 69 in OT Daily Bre","0"
"Want to read more about Michigan s thrilling win over UCLA today See what Charles Matthews said about it","0"
"UCLA researchers create device that could revolutionize hydrogen vehicles Shared from my Google feed","0"
"roycehall Love y all","0"
"Deontay Shea and Van at UM UCLA game","0"
"When I told my mum she was aaiigh Mijo well at least the name that you got you ll love forever","0"
"bell 99 Having a great official visit at UCLA 4sUp Bruins","0"
"roycehall Fuck yes Let s get big baby","0"
"Account balance 150 Spends 20 00 new balance 130 00 me","0"
"Thanks to and all of our great fans for helping us get the W today vs UCLA Appreciate your support home a","0"
"Just found out Matthew Tago QB and LB from Quartz Hill has decommitted from UCLA His recruitment is open","0"
"Why are we stirring the pot over leos Is Utah going to publicly apologize for their fans bein","0"
"Tuesday roycehall with","0"
"Wolverines Overcome 15 Point Deficit Beat UCLA 78 69 In OT","0"
"Will we even play UCLA","0"
"jace The way to win like Oregon s Arizona s UCLA s is to win young 3 years with a class w","0"
"Surface Area 2 SC Also you should tune in when Frank talks He has tried","0"
"Lonzo could of used 2 more years at UCLA","0"
"In collaboration with the local community and OptimismCan perform a groundbreaking hand transplant operation https","0"
"Deontay Shea and Van at UM UCLA game","0"
"dropkicker I got him the hoodie collar little UCLA bone bling for his collar amp a shirt He w","0"
"Thanks to and all of our great fans for helping us get the W today vs UCLA Appreciate your support home a","0"
"We beat UCLA and MSU and run through the conference with less than 3 losses and we are fine","0"
"Want to read more about Michigan s thrilling win over UCLA today See what Charles Matthews said about it","0"
"Want to work at UCLA Health Careers We re hiring in LosAngeles CA Click for details","0"
"Super proud of the HistSTM students from UCSB and UCLA who self organized a graduate workshop to showcase their work","0"
"UCLA should be calling Coral everyday Would love to see the Gators screw this up Justin is not flipping guarantee","0"
"ICYMI Zavier Simpson with the ridiculous layup to keep Michigan within 2 points late in the comeback victory against UC","0"
"beat North Mecklenburg 85 79 to move to 11 1 6 9 5 Jaemyn Brakefield 20 was a machine with 30","0"
"okstate had been knocking at the door against ranked opponents Last night that door opened Check out the highlights from the","0"
"kaskp YOU GUYS WE ARE SO CLOSE TO THE GOAL OF 25 000 please retweet Kendra Perez Memorial Scholarship","0"
"Lavar Ball PULLS SON LiAngelo OUT OF UCLA","0"
"Oklahoma could have a 10 win Army squad and an 11 win FAU squad on their OOC slate Also Chip Kelly and UCLA","0"
"CoachPop Stat Leaders Huntington Prep Jaemyn Brakefield 30pts 7rebs Kenneth Nwuba UCLA commit 10pts amp 6rebs Michael Christma","0"
"Postdoc Fellowships Available in Math Physical Sciences Engineering at and for thos","0"
"Skool Andre Regardless if they are overhyped or not they have a brand of success","0"
"Aaron Holiday amp Thomas Welsh each scored in double figures in UCLA s 78 69 overtime loss at Michigan on Saturday RECAP http","0"
