"Recruiting Top 2018 Target Bryan Addison is in Westwood on his UCLA OV this weekend A decision is looming for one of the nation","0"
"UCLA QB Commit","0"
"vs Sam Darnold who will be the better quarterback Tweet TheRosenOne or InDarnoldWeTrust to vote https","0"
"BUTLER 2H OV 79 5 1 UCLA 2H OV 76 5 2 ARMY UN 45 2 DEPAUL 2H UN 76 1 DRAKE OV 157 1 DRAKE 2H OV 84 5 1","0"
"Guess you could say Michigan stole a win from UCLA","0"
"1077 I now live in So Calif not too far from Disneyland My folks met b 4 WWll I have 3 kids and a","0"
"Interview with Rising 2021 California QB Tyler Buchner on RNG UCLA SDSU GoAzt","0"
"heading up to UCLA tmrw","0"
"ICYMI Zavier Simpson with the ridiculous layup to keep Michigan within 2 points late in the comeback victory against UC","0"
"Thanks to and all of our great fans for helping us get the W today vs UCLA Appreciate your support home a","0"
"He is at UCLA right now kicking it","0"
"I interviewed Josh Rosen back in March and he talked a lot about how much playing tennis helped his footwork as a quarterba","0"
"Harbaugh at the game can only mean one thing Harbaugh to UCLA Sources","0"
"Michigan got a huge comeback in OT against UCLA With all of the good there was some bad All of that and more ht","0"
"UCLA OL commit is the nephew of longtime MLB player Mike Sweeney","0"
"Does UCLA even know that the SkirballFire exists This fire less than a few miles away makes it extremely hard to bre","0"
"Guess you could say Michigan stole a win from UCLA","0"
"Thanks to and all of our great fans for helping us get the W today vs UCLA Appreciate your support home a","0"
"UCLA hosted 2018 Wesleyan School GA TE Tommy Tremble for an official visit today","0"
"UM beats UCLA","0"
"ZachShaw Michigan mounts epic comeback downs UCLA in thrilling overtime win Story","0"
"ZachShaw Scoring 10 points in seven minutes shutting down Aaron Holiday and even emulating a past Ohio point guard who wore No 3 Z","0"
"RG Melvin Gordon runner up and wasnt it the guy from UCLA Barr I think","0"
"Recruiting Sick Uni s","0"
"Thanks to and all of our great fans for helping us get the W today vs UCLA Appreciate your support home a","0"
"In collaboration with the local community and OptimismCan perform a groundbreaking hand transplant operation https","0"
"BMurda I can t argue with you there but all I was saying was he doesn t need an education in order to be in the","0"
"ICYMI Zavier Simpson with the ridiculous layup to keep Michigan within 2 points late in the comeback victory against UC","0"
"UCLA has resumed classes even though fires continue burning nearby To some students chagrin it also means that","0"
"Recruiting Welcome to uclabruins 4sUp","0"
"Postdoc Fellowships Available in Math Physical Sciences Engineering at and for thos","0"
"Donne I m not shocked his dad pulled him out of UCLA But I don t agree with him having Melo sign with an agent","0"
"do you think UCLA overperformed I m having hopes that they will come out with the title should I hold my breath","0"
"Thanks to and all of our great fans for helping us get the W today vs UCLA Appreciate your support home a","0"
"One of the best pass rushers out west and a UCLA commit Abdul Malik McClain","0"
"recap is up when Michigan and Charles Matthews desperately needed a lift a couple unlikely sources came through to pul","0"
"UCLA researchers find that the simple act of petting an animal is good for your mental and physical health","0"
"One of the best pass rushers out west and a UCLA commit Abdul Malik McClain","0"
"Prod indiefilm filmfestivals shortfilm webseries contentcreation producers directors writers actorslife","0"
"Don t hate the player is a saying I m not really having to explain this am I The majority of","0"
"feature on Sophomore Ben Goldberg","0"
"I wish him nothing but success except against Ucla lol","0"
"The UCLA life science department Gender diversity isn t important Historical racism justified through biology isn","0"
"had more real life subtweets for and","0"
"UCLA salutes our 1967 Gary Beban on his 50th anniversary and congratulations to Baker Mayfield on joinin","0"
"Coming Soon Cohort 4 TFTinfinity Wars 2018 z ucla uclatft4 uclatftcohort4 bruins","0"
"y Rails Nice win today by UM over the hated Alford led UCLA","0"
"Donne That s what I m saying I don t condone at all what he did it actually was one of the worst places to","0"
"Think your BPA free plastic is safe Think again says researchers hormones plastic research BPA","0"
"M21 Harold Ickes to Franklin D Roosevelt 23 June 1941","0"
"UCLA bound RB breaks NATIONAL single season TD record Watch","0"
"Throws like this by UCLA QB Josh Rosen 3 are why his is a consideration for the 1 pick overall in the 2018 NFLDraft","0"
"gtr UCLA Royce Hall we are ready See you tonight","0"
"I liked a video A Day in My Life UCLA Student Reality","0"
"Recruiting Big A looking good Love to see u in Westwood","0"
"32 2 QBs under 6 foot who ve done well Thanks for proving my point Lol OU is soooo much better and more t","0"
"Recruiting Top 2018 Target Bryan Addison is in Westwood on his UCLA OV this weekend A decision is looming for one of the nation","0"
"UCLA Coach Steve Alford Responded To LiAngelo Ball Leaving School","0"
"LaVar Ball is teaching his kids that you can escape consequences reacts to LaVar pulling his son LiAnge","0"
"Recruiting Top 2018 Target Bryan Addison is in Westwood on his UCLA OV this weekend A decision is looming for one of the nation","0"
"Heck of a comeback by Michigan to beat UCLA in OT","0"
"Former Cowboy Bryndon Manzer who was on the call for okstate s last win over a top 10 team caught up with Coach Littell foll","0"
"bell 99 Man knows what he s doing UCLA will put you in a position to do great things long after football","0"
"Recruiting Your going to be the guy to bring us back","0"
"ICYMI Zavier Simpson with the ridiculous layup to keep Michigan within 2 points late in the comeback victory against UC","0"
"UCLA issues lack of ball security Not sure that s going to change UCLA offense is based on PG s handling ball His PG s tad reckless","0"
"OnThisDay December 9 1998 attended the Fire amp Ice Ball at Universal Studios in Hollywood benefitting the U","0"
"Russell Wilson and Drew Brees put a good face on the 5 11 label Baker was out attempted by Darnold t","0"
"roycehall See you Tuesday","0"
"I think it s too early in the year to start counting them out or say they re a bad team but this was","0"
"riedl i ve been informed pearl s presentation was poorly publicized and had to compete with many other tracks","0"
"Quarter done See you back in month ucla anderson","0"
"Thanks to and all of our great fans for helping us get the W today vs UCLA Appreciate your support home a","0"
"LaMelo and LiAngelo Ball SIGN TO PLAY PRO IN CHINA LAVAR Pulls Them From UCLA","0"
"Thanks to and all of our great fans for helping us get the W today vs UCLA Appreciate your support home a","0"
"I m at UCLA s Royce Hall for John McLaughlin tonight The ceiling is cool","0"
"Hope not UCLA woof","0"
"Thanks to and all of our great fans for helping us get the W today vs UCLA Appreciate your support home a","0"
"Harold Ickes to Franklin D Roosevelt 23 June 1941","0"
"Nation My dude anyone that says this doesn t look good has no flavor You look dope Unis are Le","0"
"okstate had been knocking at the door against ranked opponents Last night that door opened Check out the highlights from the","0"
"BUTLER 2H OV 79 5 1 UCLA 2H OV 76 5 2 ARMY UN 45 2 DEPAUL 2H UN 76 1 DRAKE OV 157 1 DRAKE 2H OV 84 5 1","0"
"Steve Alford remains a very good coach who UCLA is lucky to have sarcasm","0"
"How do you talk to kids after during the trauma of these fires This app may help ThomasFire","0"
"bell 99 Having a great official visit at UCLA 4sUp Bruins","0"
"Can y all see it GoBruins","0"
"Harbaugh at the game can only mean one thing Harbaugh to UCLA Sources","0"
"Chip Kelly won t turn UCLA into Oregon but he doesn t have to","0"
"UCLA researchers find that the simple act of petting an animal is good for your mental and physical health","0"
"Interview with Rising 2021 California QB Tyler Buchner on RNG UCLA SDSU","0"
"UCLA Football Josh Rosen having to avoid hits on and off the field Go Joe Bruin","0"
"I m just basing it off everyone s prediction it wouldn t shock me if he picks UCLA","0"
"h tattoo if this 18k rose gold lavender opal trigem looks this great here imagine how stunning it will be in you","0"
"Sophomore Kyle MacLean son of former Simi Valley and UCLA standout Don MacLean had 43 points for Westlake in 82 51 win","0"
"Why yes that was me palming an asada burrito on the 10 to the 405 to UCLA to see a play","0"
"South Region 1 Villanova 16 Northern Kentucky 8 UCLA 9 Creighton 5 Cincinnati 12 Saint Mary s 4 West Vir","0"
"Recruiting Top 2018 Target Bryan Addison is in Westwood on his UCLA OV this weekend A decision is looming for one of the nation","0"
"Thanks to and all of our great fans for helping us get the W today vs UCLA Appreciate your support home a","0"
"Family friend desperately in need of platelets any blood type and or O or O white blood cells at UCLA hospital","0"
"Walton is a big UCLA dude Lavar talking mess about Bill s son after his son embarrassed his beloved","0"
"Thanks to and all of our great fans for helping us get the W today vs UCLA Appreciate your support home a","0"
"Guess you could say Michigan stole a win from UCLA","0"
"Guess you could say Michigan stole a win from UCLA","0"
"Mossman Next season UCLA comes to town Kyler Murray show getting started","0"
"People say UCLA fans can t be pleased and are toxic because they wanted Alford fired 2 years ago but in my experie","0"
"Thanks to and all of our great fans for helping us get the W today vs UCLA Appreciate your support home a","0"
"Utube CEO Susan Diane Wojcicki Santa Clara County California U S Alma materHarvard College A B University of C","0"
"1 Denny s 2 Bell s House 3 UCLA s Arcade 4 SJSU 5 Fanime","0"
"Yeah I talk about Oregon in this Just limited to the two schools in our area but UCLA definitely up there","0"
"Thanks to and all of our great fans for helping us get the W today vs UCLA Appreciate your support home a","0"
"All UCLA fans want for Christmas is for DTR to enroll early and bring his WRs stbrown","0"
"My thoughts the L s cone from UCLA Wichita twice SMU on the road and Temple on the road They need t","0"
"Aaron Holiday s 25 points ties a career high UCLA leads Michigan 60 58 with 3 05 left in the second half GoBruins UCLAvs","0"
"My grades are in for most of the coaching hires in this year s college cycle Check them out here Insider","0"
"ICYMI Zavier Simpson with the ridiculous layup to keep Michigan within 2 points late in the comeback victory against UC","0"
"Messy at UCLA and UO too","0"
"UCLA Football Josh Rosen having to avoid hits on and off the field Via By","0"
"KState basketball got you down Check out 1200 words in Part 1 of 3 of my CactusBowl Preview UCLA Offense v","0"
"ICYMI Zavier Simpson with the ridiculous layup to keep Michigan within 2 points late in the comeback victory against UC","0"
"t Paper is here","0"
"TBH I no longer have the distaste for Sooners that I still have for the Ducks and now have UCLA","0"
"Naveau Michigan 78 UCLA 69 Zavier Simpson 15 points 4 steals His best game in college","0"
"I apologize for my teams success But think of it this way you get to celebrate every year we don","0"
"UCLA only stole twice today making improvements","0"
"With Patterson watching Michigan dazzles in comeback win over UCLA","0"
"Guess you could say Michigan stole a win from UCLA","0"
"Fans Storm Count After Cowgirl Basketball Upsets No 7 UCLA Pistols Firing","0"
"Recruiting Excited to watch u in Westwood","0"
"Sounds like he s a UCLA lock Sigh","0"
"Just 5 more losses with UCLA Wichita 2x SMU 2x UCF 2x when healthy I d be ok with that","0"
"sanders28 LiAngelo Ball s final UCLA career stats 0 minutes 1 steal","0"
"I m sure overseas teams are lining up for 6 5 stretch fours amp 16 year old unproven shot jackers Story","0"
"Congrats looking forward to seeing you slay in Westwood ucla","0"
"Nation I don t want to get too excited till it s official","0"
"UCLA chemists synthesize narrow ribbons of graphene using only light and heat","0"
"ICYMI Zavier Simpson with the ridiculous layup to keep Michigan within 2 points late in the comeback victory against UC","0"
"007 Excellent news When you start putting hefty price tags on harassment maybe peo","0"
"Thanks to and all of our great fans for helping us get the W today vs UCLA Appreciate your support home a","0"
"2018 UCLA signee nash14 dominated the paint offensively and defensively this weekend in South Carolina UCLA is","0"
"It was time for a change I open my phone to the three things I love most in life UCLA Grayson Dolan and Kid Cud","0"
"Thanks to and all of our great fans for helping us get the W today vs UCLA Appreciate your support home a","0"
"Blink and you might have missed the Michigan men s basketball team s comeback","0"
"bell 99 Having a great official visit at UCLA 4sUp Bruins","0"
"Thanks to and all of our great fans for helping us get the W today vs UCLA Appreciate your support home a","0"
"JoeD A good man good coach heck of a father And he reps UCLA colors well on the recruiting hunt SacBee read on McC","0"
"I m hoping it s a huge benchmark for our team as we go forward John Beilein on Michigan s win vs UCLA","0"
"GALLERY Several Michigan targets commits players coaches and staffers were all at Crisler Center for the Wolverines b","0"
"BUTLER 2H OV 79 5 1 UCLA 2H OV 76 5 2 ARMY UN 45 2 DEPAUL 2H UN 76 1 DRAKE OV 157 1 DRAKE 2H OV 84 5","0"
"GALLERY Michigan takes down UCLA in OT 78 69","0"
"h tattoo if this 18k rose gold lavender opal trigem looks this great here imagine how stunning it will be in you","0"
"USC doesn t beat Stanford in the Pac 12 title game without Hawkins Might not have beaten UCLA Arizona or Cal either Check","0"
"UCLA chemists synthesize narrow ribbons of graphene using only light and heat","0"
"Photos of Michigan win over UCLA","0"
"h tattoo if this 18k rose gold lavender opal trigem looks this great here imagine how stunning it will be in you","0"
"if this 18k rose gold lavender opal trigem looks this great here imagine how stunning it will be in","0"
"Oklahoma could have a 10 win Army squad and an 11 win FAU squad on their OOC slate Also Chip Kelly and UCLA","0"
"Georgia tight end on his UCLA official visit","0"
"Anyone who questions Josh Rosen s toughness or passion I can instantly pull up 10 clips that say otherwise Or y","0"
"In collaboration with the local community and OptimismCan perform a groundbreaking hand transplant operation https","0"
"Prod indiefilm filmfestivals shortfilm webseries contentcreation producers directors writers actorslife","0"
"weekendgetaway step three concert terabottorff lifeisgood californiadreamin UCLA Royce Hall","0"
"UCLA QB Commit","0"
"Dorian Thompson Robinson living his best life on his official visit to UCLA","0"
"indiefilm filmfestivals shortfilm webseries contentcreation producers directors writers actorslife","0"
"ICYMI Zavier Simpson with the ridiculous layup to keep Michigan within 2 points late in the comeback victory against UC","0"
"UCLA Football Josh Rosen having to avoid hits on and off the field Via By","0"
"BigEast goes 3 0 today vs the Power6 Meanwhile B1G goes 1 4 with Michigan win over UCLA the only W B1G now a","0"
"Please RT interiordesign homedecor decoration Director of London s Architectural Association Brett","0"
"Just 12 minutes with a dog can help heart and lung function Read this article by UCLA health touting the benefits of Animal Ass","0"
"Guard Loryn Goodwin who previously played at North Texas Butler and UTSA is making an impact this year at Oklahoma State","0"
"She s free like the wind she disperses the clouds or illuminates them with the lightning flash of her gaze Octavio","0"
"UCLA researchers find that the simple act of petting an animal is good for your mental and physical health","0"
"UCLA researchers find that the simple act of petting an animal is good for your mental and physical health","0"
"UCLA lock","0"
"Take these steps to improve your health and well being healthyliving healthylifestyle","0"
"The Real was talking about the LiAngelo Ball situation and all I could think about was Shut the bleep up T","0"
"UCLA QB Commit","0"
"Michigan UCLA Hoops Full Game MGoBoard","0"
"Michigan UCLA Hoops Full Game MGoBoard","0"
"bell 99 Having a great official visit at UCLA 4sUp Bruins","0"
"Wish we could see you on tv Seem like we mainly get Ucla since I live in California now Girls keep up the great work 2 Whoot","0"
"I m hoping the Arizona scandal scares him off but he s going to get even more offers already holds offe","0"
"UCLA chemists synthesize narrow ribbons of graphene using only light and heat","0"
"Postdoc Fellowships Available in Math Physical Sciences Engineering at and for thos","0"
"Huntington Prep beat Rock Creek MD 82 67 Jon McGriff with 17 pts amp 8 rebs Kenny Nwuba UCLA with 15 amp 8","0"
"UCLA chemists synthesize narrow ribbons of graphene using only light and heat","0"
"Thanks to and all of our great fans for helping us get the W today vs UCLA Appreciate your support home a","0"
"She s free like the wind she disperses the clouds or illuminates them with the lightning flash of her gaze Octavio","0"
"My finals week at UCLA every quarter I gotta change","0"
"UCLA chemists synthesize narrow ribbons of graphene using only light and heat","0"
"gtr UCLA Royce Hall we are ready See you tonight","0"
"FB commit says in a recent interview that he will be running track also at UCLA and if they let him play","0"
"Postdoc Fellowships Available in Math Physical Sciences Engineering at and for thos","0"
"UCLA salutes our 1967 Gary Beban on his 50th anniversary and congratulations to Baker Mayfield on joinin","0"
"Furious finish gives Michigan huge win over UCLA","0"
"If your bball team had been in a Muslim country you could have done it for them first","0"
"UCLA chemists synthesize narrow ribbons of graphene using only light and heat","0"
"UCLA chemists synthesize narrow ribbons of graphene using only light and heat","0"
"The Golden Savior UCLA GiantsPride","0"
"Recruiting Top 2018 Target Bryan Addison is in Westwood on his UCLA OV this weekend A decision is looming for one of the nation","0"
"2018 UCLA signee nash14 dominated the paint offensively and defensively this weekend in South Carolina UCLA is","0"
"2018 UCLA signee nash14 dominated the paint offensively and defensively this weekend in South Carolina UCLA is","0"
"Thanks to and all of our great fans for helping us get the W today vs UCLA Appreciate your support home a","0"
"UCLA chemists synthesize narrow ribbons of graphene using only light and heat","0"
"Shea Patterson will visit Michigan for the Michigan UCLA game","0"
"Is this our first pic of Chip Kelly in UCLA gear","0"
"Recruiting Top 2018 Target Bryan Addison is in Westwood on his UCLA OV this weekend A decision is looming for one of the nation","0"
"Thanks to and all of our great fans for helping us get the W today vs UCLA Appreciate your support home a","0"
"Thanks to and all of our great fans for helping us get the W today vs UCLA Appreciate your support home a","0"
"Dickey Great news Can t wait to see you show UCLA how it s done in a couple weeks","0"
"Thanks to and all of our great fans for helping us get the W today vs UCLA Appreciate your support home a","0"
"theD School shooting UCLA uhhhh students take your finals Bomb threat UCLA uhhh summer school is still in session Fire UCLA","0"
"SEC Kentucky transfer Charles Matthews went for 20 8 and 3 today for Michigan and hit the overtime dagger 3 pointer agains","0"
"Sophomore Kyle MacLean son of former Simi Valley and UCLA standout Don MacLean had 43 points for Westlake in 82 51 win","0"
"Trump blasts San Francisco murder acquittal Dreamer effort reuters ucla nba india","0"
"Wolverines Overcome 15 Point Deficit Beat UCLA 78 69 In OT","0"
"UCLA chemists synthesize narrow ribbons of graphene using only light and heat","0"
"Dabo looks like he jus dabbed GoBruins UCLA","0"
"UCLA Football Josh Rosen having to avoid hits on and off the field Go Joe Bruin","0"
"You mean like Louis Farrakhan Sounds about right with the hate and divisiveness that your party espouses","0"
"UM beats UCLA","0"
"UCLA Football Josh Rosen having to avoid hits on and off the field Go Joe Bruin","0"
"solomon Ohh has caught me in the act a few times The UCLA A amp","0"
"Magic Jaylen Hands UCLA with a Career High 23pts to go with 9rebs and 4ast in the Win","0"
"DAHLin I think he meant Gelo was going to be just a role player at UCLA He was going to come off the bench","0"
"UCLA doesn t have dead week with no classes we have DEATH week where classes overlap with finals and everything is on fu","0"
"Michigan basketball erases deficit stuns UCLA Bruins in OT 78 69 via","0"
"Sophomore MF Jessie Fleming has been selected as a finalist for the UCLA s 3rd finalist in the last 5 year","0"
"UCLA chemists synthesize narrow ribbons of graphene using only light and heat","0"
"DAHLin Regardless of what happen in China Gelo best was gonna be a role player He wasn t a","0"
"I felt awful that UCLA students still had to continue classes yesterday when they were so close to the fire but the memes t","0"
"ajking Oklahoma State s QB led the world in passing yards Jay Rosen at UCLA had a ton of yards too and neither got a whiff so","0"
"there s also NIML2017 a NIPS2017 like workshop tomorrow Sun 12 10 at UCLA 20 registration still a few spots left","0"
"there s also NIML2017 a NIPS2017 like workshop tomorrow Sun 12 10 at UCLA 20 registration still a few spots","0"
"Please RT interiordesign homedecor decoration Director of London s Architectural Association Brett","0"
"UCLA doesn t have dead week with no classes we have DEATH week where classes overlap with finals and everything is on fu","0"
"Lonzo Ball 41 3 pt shooter at UCLA MVP of Summer League is in the worst shooting slump I ve ever seen Basket ca","0"
"Wassupp UCLA it s ya girl Ashley Ask me any q s tell me what you got poppin for the weekend send me memes etc etc","0"
"Gonna be scouting that Oklahoma USC game from yesterday a little later Might do UCLA Michigan too","0"
"Thanks to and all of our great fans for helping us get the W today vs UCLA Appreciate your support home a","0"
"t Paper is here","0"
"gtr UCLA Royce Hall we are ready See you tonight","0"
"2018 UCLA signee nash14 dominated the paint offensively and defensively this weekend in South Carolina UCLA is","0"
"ICYMI Zavier Simpson with the ridiculous layup to keep Michigan within 2 points late in the comeback victory against UC","0"
"t Paper is here","0"
"All DTR 14 wants for Christmas is his UCLA playbook","0"
"nigel LOL He s doing the same thing Chip Kelly would be doing Different","0"
"4 Star UCLA commit Can t forget that","0"
"That is also an issue In a weird way I think death of NBA","0"
"I liked a video Why LiAngelo Ball will NEVER MAKE the NBA LiAngelo benched at UCLA","0"
"Recruiting Top 2018 Target Bryan Addison is in Westwood on his UCLA OV this weekend A decision is looming for one of the nation","0"
"Thanks to and all of our great fans for helping us get the W today vs UCLA Appreciate your support home a","0"
"FINAL Game 4 82 Michael Christmas 22 Jonathan McGriff 17p 7a 4r Kenny Nwuba 15p 8r UCLA","0"
"2018 UCLA signee nash14 dominated the paint offensively and defensively this weekend in South Carolina UCL","0"
"UCLA Gymnasts Shine at Meet the Bruins","0"
"UCLA researchers find that the simple act of petting an animal is good for your mental and physical health","0"
"Recruiting Top 2018 Target Bryan Addison is in Westwood on his UCLA OV this weekend A decision is looming for one of the nation","0"
"UCLA should do an Alumni Day for former hoopers or have something similar to the Then Now and Forever pregame tailgate","0"
"Personnel conclusions projections Ball elite passer very good defender shooting finishing is a huge issue Sho","0"
"UCLA researchers find that the simple act of petting an animal is good for your mental and physical health","0"
"Recruiting Top 2018 Target Bryan Addison is in Westwood on his UCLA OV this weekend A decision is looming for one of the nation","0"
"Deontay Shea and Van at UM UCLA game","0"
"bell 99 Having a great official visit at UCLA 4sUp Bruins","0"
"Thanks to and all of our great fans for helping us get the W today vs UCLA Appreciate your support home a","0"
"Also beat Michigan State who was ranked 4th at the time And the PAC his heisman year","0"
"UCLA researchers find that the simple act of petting an animal is good for your mental and physical health","0"
"Sophomore Kyle MacLean son of former Simi Valley and UCLA standout Don MacLean had 43 points for Westlake in 82 51 win","0"
"His problem is this he honestly hasn t been coached to go half court sets his ski","0"
"Thanks to and all of our great fans for helping us get the W today vs UCLA Appreciate your support home a","0"
"Guess you could say Michigan stole a win from UCLA","0"
"WITHOUT A DOUBT Love the Heisman But that whole senior thing was dumb and so short sided Want","0"
"UCLA researchers create device that could revolutionize hydrogen vehicles","0"
"Sophomore MF Jessie Fleming has been selected as a finalist for the UCLA s 3rd finalist in the last 5 year","0"
"Thanks to and all of our great fans for helping us get the W today vs UCLA Appreciate your support home a","0"
"UCLA researchers find that the simple act of petting an animal is good for your mental and physical health","0"
"What petting a dog can do for your mentalhealth and physical according to UCLA research","0"
"tbh this migh tbe my fave calss ive had so far at ucla both her an dmy ta were so passionate and excited abt their","0"
"Woah Michigan beat UCLA Bruins must be really bad","0"
