"crazy how 15 years from now it might be ur wedding or ur kids birthday but rn it s just a regular shitty day","0"
"crazy how 15 years from now it might be ur wedding or ur kids birthday but rn it s just a regular shitty day","0"
"crazy how 15 years from now it might be ur wedding or ur kids birthday but rn it s just a regular shitty day","0"
"Griff It s a great time in life We d love to help you put together a beautiful wedding suite Free Sample","0"
"I lost my wedding ring in Section 124 at the stadium today if somebody found a silver band ring please let me know","0"
"it s so cute how yongsun also went to jinoo s wedding i guess sj s manager is also friends with sj members friends https","0"
"crazy how 15 years from now it might be ur wedding or ur kids birthday but rn it s just a regular shitty day","0"
"Thank you for the amazing Total Claw stream We had one wedding possibly two new babies on the way and will RB fol","0"
"me i think my favourite part about wedding vow youtube is friend","0"
"Ok lets plan a wedding","0"
"You re all invited to the wedding","0"
"alright since everyone s getting engaged and married the least you can do is invite me to the wedding and have an open","0"
"Adam Vinatieri just dropped his wedding ring Colts INDvsBUF","0"
"amp won t get married whole wedding cancelled","0"
"I lost my wedding ring in Section 124 at the stadium today if somebody found a silver band ring please let me know","0"
"crazy how 15 years from now it might be ur wedding or ur kids birthday but rn it s just a regular shitty day","0"
"crazy how 15 years from now it might be ur wedding or ur kids birthday but rn it s just a regular shitty day","0"
"me about to kiss my bride at my wedding some voltron fan bursts into the room yeah real cute f f marriage you got here","0"
"Lol religious freedom cough cough gay wedding cake supreme court Freedom speech ban nazis and loo","0"
"ARMY INT twt As u see in gaon charts history not Kpop history E","0"
"My husband spent more time writing a post it note on how to properly close the back door than he did his wedding vows","0"
"crazy how 15 years from now it might be ur wedding or ur kids birthday but rn it s just a regular shitty day","0"
"All caught up in the Short Story Advent Calendar ssac2017 nice balance of genres in this collection 9 Afterma","0"
"His scene in Wedding Crashers is one of the greatest things he s ever done","0"
"Modeled after my own Wedding circlet custommade for you epiconetsy cosplay wedding https","0"
"Louis and his crazy rant was trying to get Molly to say the wedding is off 90dayfiance","0"
"Went to a wedding yesterday of couple that s only known each other for 5 months and his surprise wedding gift to her was a hous","0"
"RT ACLU RT ACLU If Masterpiece Cakeshop is permitted to discriminate against Dave and Charlie simply because they are gay","0"
"I lost my wedding ring in Section 124 at the stadium today if somebody found a silver band ring please let me know","0"
"me about to kiss my bride at my wedding some voltron fan bursts into the room yeah real cute f f marriage you got here","0"
"alright since everyone s getting engaged and married the least you can do is invite me to the wedding and have an open","0"
"Yoni amp Josh Wedding PuertoVallarta Video DestinationWeddings RivieraNayarit","0"
"Definitely playing If this World Were Mines at my wedding","0"
"I ll cry at my wedding because it s a miracle it s happening honestly","0"
"i feel i m gonna get beat up in a parking lot when i go to this wedding","0"
"Wedding of the year goes to","0"
"Wedding of the year goes to","0"
"crazy how 15 years from now it might be ur wedding or ur kids birthday but rn it s just a regular shitty day","0"
"THE WENJOON WEDDING rt to be invited to witness us being bound together in holy macaroni when tuesday dec 12 at 8 pm","0"
"He WANTED her to say the wedding is off He came up with that bullshit so she would break it off and it wouldn t be on him","0"
"Marriages Sorry I m only sending one wedding gift Savoy","0"
"someone give me the details of a fake wedding i wanna make a suite design","0"
"Nav Replace me w Kilgore 67 and that it s gonna look when JIMMY FRANCHISE G and I walk down the isle at our wedding","0"
"My husband spent more time writing a post it note on how to properly close the back door than he did his wedding vows","0"
"After a bidet of course Got one as a wedding gift and it changed my life","0"
"My own father didn t attend my wedding so shouldn t feel bad I ELOPED She has FaceTime with my husband","0"
"hope you enjoy the wedding","0"
"weird how 15 years from now it might be ur wedding or ur kids birthday but rn it s just a regular shitty day","0"
"crazy how 15 years from now it might be ur wedding or ur kids birthday but rn it s just a regular shitty day","0"
"lol it s ok i m not gonna be here for u wedding","0"
"Wedding of the year goes to","0"
"I love Albanians I wanna shqip dance on my wedding night","0"
"Wedding of the year goes to","0"
"me about to kiss my bride at my wedding some voltron fan bursts into the room yeah real cute f f marriage you got here","0"
"me about to kiss my bride at my wedding some voltron fan bursts into the room yeah real cute f f marriage you got here","0"
"weird how 15 years from now it might be ur wedding or ur kids birthday but rn it s just a regular shitty day","0"
"Any wedding with Kandi singing is already asking for a divorce RHOA","0"
"Y all dead ass wouldn t invite your side nigga to your wedding That s mad selfish","0"
"alright since everyone s getting engaged and married the least you can do is invite me to the wedding and have an open","0"
"weird how 15 years from now it might be ur wedding or ur kids birthday but rn it s just a regular shitty day","0"
"Tara Moss celebrates her eighth wedding anniversary","0"
"weird how 15 years from now it might be ur wedding or ur kids birthday but rn it s just a regular shitty day","0"
"Must read","0"
"crazy how 15 years from now it might be ur wedding or ur kids birthday but rn it s just a regular shitty day","0"
"weird how 15 years from now it might be ur wedding or ur kids birthday but rn it s just a regular shitty day","0"
"With this step by step method of flowerarranging you can now become a floralarrangement specialist","0"
"crazy how 15 years from now it might be ur wedding or ur kids birthday but rn it s just a regular shitty day","0"
"crazy how 15 years from now it might be ur wedding or ur kids birthday but rn it s just a regular shitty day","0"
"crazy how 15 years from now it might be ur wedding or ur kids birthday but rn it s just a regular shitty day","0"
"crazy how 15 years from now it might be ur wedding or ur kids birthday but rn it s just a regular shitty day","0"
"My husband spent more time writing a post it note on how to properly close the back door than he did his wedding vows","0"
"alright since everyone s getting engaged and married the least you can do is invite me to the wedding and have an open","0"
"Okay WANTED WEDDING DATE","0"
"Yes And she lost her baby and blamed Belle Then kidnapped Shawn She was horrible And then the Mimi wedding was so OOC","0"
"crazy how 15 years from now it might be ur wedding or ur kids birthday but rn it s just a regular shitty day","0"
"Why I m looking at the pictures from my mom wedding and a picture of Celiaa came up and of course she had a glass i","0"
"NJ love u guys I m bout to be best man at my good friend Doms wedding In the snow Sending love","0"
"Everybody right now this wedding is sooo shady Also us RHOA","0"
"He WANTED her to say the wedding is off He came up with that bullshit so she would break it off and it wouldn t be","0"
"GORGEOUS Cherry Plum Blossom Branch 1950s Repro Dress Rustic wedding Casual Wedding Count","0"
"Hello WomenInMedicine I m at a wedding but still tuning in Research Fellow in Cardiac Surgery","0"
"me about to kiss my bride at my wedding some voltron fan bursts into the room yeah real cute f f marriage you got here","0"
"i had to give a toast to my cousin at her wedding and i was having a panic attack so i kept stuttering and they hav","0"
"crazy how 15 years from now it might be ur wedding or ur kids birthday but rn it s just a regular shitty day","0"
"1920s ivory slipper satin wedding dress flapper wedding dress Great Gatsby","0"
"Ugh wedding videos always get me so emotional","0"
"Y all I watched my sister make doll clothes on a Barbie sewing machine when she was 6 amp now she s 22 designing and makin","0"
"alright since everyone s getting engaged and married the least you can do is invite me to the wedding and have an open","0"
"Wedding in Lakewood NJ with CalevStratton on keys jewish simcha singing dancing not the greatest pic but","0"
"If I don t play los chismes by Chalino on my weeding day is it really going to be my wedding","0"
"Milano I never do 63 million idiots voted for a patho","0"
"Wedding of the year goes to","0"
"There was more religion talk in the last 5 minutes of 90dayfiance than a whole Duggar wedding","0"
"Time management Marga Juggling work and wedding planning Partida","0"
"me about to kiss my bride at my wedding some voltron fan bursts into the room yeah real cute f f marriage you got here","0"
"Wedding Dress Cute Wedding Dress Lace Wedding Dress Ivory Wedding Dress Sheath ball go","0"
"crazy how 15 years from now it might be ur wedding or ur kids birthday but rn it s just a regular shitty day","0"
"hakyeon s phone lockscreen is a photo of his mum and noona during his noona s wedding day this is adorable","0"
"weird how 15 years from now it might be ur wedding or ur kids birthday but rn it s just a regular shitty day","0"
"HELP Which wedding hashtag do you like best As of now I can t make up my mind","0"
"Best friend wedding celebrations","0"
"Wow Madhavi pours kerosene over herself in an attempt to stop Vyom amp Sharanya s wedding EkDeewaanaTha Vanya look so pretty","0"
"925 Sterling Silver Blue Fire Opal Gemstone Wedding Ring Jewelry Gift For Women eBay","0"
"I love how Luis turned their argument into a heated discussion about religion when Molly originally just wanted to","0"
"Wedding of the year goes to","0"
"weird how 15 years from now it might be ur wedding or ur kids birthday but rn it s just a regular shitty day","0"
"Few things are as emotional as a daughter being walked down the aisle by her father Here are some of our recent father daught","0"
"Why is picking plates out for a wedding so freaking hard","0"
"Lmao this wedding shit is messy RHOA","0"
"Being a bridesmaid in my best friends wedding buying a house and TTC for our last baby","0"
"NJ love u guys I m bout to be best man at my good friend Doms wedding In the snow Sending love","0"
"RHOA Cast Throws Kenya Moore a Shady Surprise Wedding Before Questioning If Her Marriage Is","0"
"I think one of the coolest things in boot camp was seeing how committed one of my drill instructors was to his wife He w","0"
"crazy how 15 years from now it might be ur wedding or ur kids birthday but rn it s just a regular shitty day","0"
"ohh my god they all sang happy summer wedding not just 4th gen im","0"
"weird how 15 years from now it might be ur wedding or ur kids birthday but rn it s just a regular shitty day","0"
"Happy Wedding For more information please don t hesitate to contact us Phone amp WA","0"
"I ll cry at my wedding because it s a miracle it s happening honestly","0"
"All you brides to be if you are looking for a great place to buy wedding dresses then click on the following link","0"
"There was more religion talk in the last 5 minutes of 90dayfiance than a whole Duggar wedding","0"
"me about to kiss my bride at my wedding some voltron fan bursts into the room yeah real cute f f marriage you got here","0"
"i have two weeks to find a dress for my sister s wedding and i have no idea how that s gonna happen","0"
"me about to kiss my bride at my wedding some voltron fan bursts into the room yeah real cute f f marriage you got here","0"
"me about to kiss my bride at my wedding some voltron fan bursts into the room yeah real cute f f marriage you got here","0"
"I wouldn t get married maybe if shorty and i were together for a long time maybe a wedding would be dope for the p","0"
"me about to kiss my bride at my wedding some voltron fan bursts into the room yeah real cute f f marriage you got here","0"
"My dad joking about my brother getting married and how someone will have to wheel him to my wedding was funny the f","0"
"me about to kiss my bride at my wedding some voltron fan bursts into the room yeah real cute f f marriage you got here","0"
"weird how 15 years from now it might be ur wedding or ur kids birthday but rn it s just a regular shitty day","0"
"crazy how 15 years from now it might be ur wedding or ur kids birthday but rn it s just a regular shitty day","0"
"crazy how 15 years from now it might be ur wedding or ur kids birthday but rn it s just a regular shitty day","0"
"weird how 15 years from now it might be ur wedding or ur kids birthday but rn it s just a regular shitty day","0"
"it s weird how 10 years from today it could be ur wedding day or ur kids birthday but rn it s just a regular day","0"
"FoodBae Bints in the talking stage i know how to cook I can make anything the day after the wedding","0"
"Kurdish Polygamy with underage wives are the heritage from Muhammad to his followers At this typical Muslim wedding the adult g","0"
"oluwani Someone said Lukaku will miss his own wedding Chai Aye le","0"
"Everybody right now this wedding is sooo shady Also us RHOA","0"
"me about to kiss my bride at my wedding some voltron fan bursts into the room yeah real cute f f marriage you got here","0"
"crazy how 15 years from now it might be ur wedding or ur kids birthday but rn it s just a regular shitty day","0"
"weird how 15 years from now it might be ur wedding or ur kids birthday but rn it s just a regular shitty day","0"
"alright since everyone s getting engaged and married the least you can do is invite me to the wedding and have an open","0"
"No WONDER these good Mormons are speeding to the hotel at 87 mph on their wedding night LivePD tonightsthenight","0"
"Wedding dress goals","0"
"THE WENJOON WEDDING rt to be invited to witness us being bound together in holy macaroni when tuesday dec 12 at 8 pm","0"
"Featuring them one of my concerts led to an invitation to sing at a wedding We three were excited BUT only knew one son","0"
"crazy how 15 years from now it might be ur wedding or ur kids birthday but rn it s just a regular shitty day","0"
"crazy how 15 years from now it might be ur wedding or ur kids birthday but rn it s just a regular shitty day","0"
"Y all I watched my sister make doll clothes on a Barbie sewing machine when she was 6 amp now she s 22 designing and makin","0"
"I m so anxious about the wedding of HRH Princess Margaret to Tony","0"
"Chilling after the wedding reception like","0"
"Panto and Silas cordially invite you to their fantasy wedding in a sleepy boy s alternate dimension DirkGentlyBBCA ht","0"
"crazy how 15 years from now it might be ur wedding or ur kids birthday but rn it s just a regular shitty day","0"
"Y all I watched my sister make doll clothes on a Barbie sewing machine when she was 6 amp now she s 22 designing and makin","0"
"So proud of Virushka They knew Indian media would reach Italy too India today reporter was not allowed to repor","0"
"my wedding finna be bomb","0"
"Moments in Time Images is ready to give you all the wedding images you want both moving and still","0"
"oluwani Someone said Lukaku will miss his own wedding Chai Aye le","0"
"weird how 15 years from now it might be ur wedding or ur kids birthday but rn it s just a regular shitty day","0"
"Sushant Singh Rajput reacts to rumors of Virat and Anushka s wedding Virushka","0"
"If you want to come to Connecticut in front of the fire some night I ll tell you about my wedding night you ll be on","0"
"crazy how 15 years from now it might be ur wedding or ur kids birthday but rn it s just a regular shitty day","0"
"Congratulations on your wedding","0"
"weird how 15 years from now it might be ur wedding or ur kids birthday but rn it s just a regular shitty day","0"
"We only knew the song When the battle s over NOT GOOD FOR A WEDDING We got very busy learning new material We","0"
"alright since everyone s getting engaged and married the least you can do is invite me to the wedding and have an open","0"
"What Redbone would sound like if played at a wedding and ur 5 drinks in","0"
"weird how 15 years from now it might be ur wedding or ur kids birthday but rn it s just a regular shitty day","0"
"Modeled after my own Wedding circlet custommade for you epiconetsy cosplay wedding","0"
"Oh WHERE ARE MY WEDDING PHOTOS","0"
"Reason 382395 why the omnihomestead rocks a year later our wedding cake still tastes awesome","0"
"I lost my wedding ring in Section 124 at the stadium today if somebody found a silver band ring please let me know","0"
"weird how 15 years from now it might be ur wedding or ur kids birthday but rn it s just a regular shitty day","0"
"My fathers reaction to seeing my sister in her wedding dress was PRICELESS","0"
"crazy how 15 years from now it might be ur wedding or ur kids birthday but rn it s just a regular shitty day","0"
"Wedding of the year goes to","0"
"Custom designed monograms add a lot to wedding decor heres our design from the wedding of Keli","0"
"When I look at Rika s wedding pictures I get emotional not only because Rika was my first oshi and I still love her but r","0"
"me about to kiss my bride at my wedding some voltron fan bursts into the room yeah real cute f f marriage you got here","0"
"crazy how 15 years from now it might be ur wedding or ur kids birthday but rn it s just a regular shitty day","0"
"weird how 15 years from now it might be ur wedding or ur kids birthday but rn it s just a regular shitty day","0"
"crazy how 15 years from now it might be ur wedding or ur kids birthday but rn it s just a regular shitty day","0"
"Thank you so much to everyone who came to the special wedding stream It meant so much to see how many people care abo","0"
"me about to kiss my bride at my wedding some voltron fan bursts into the room yeah real cute f f marriage you got here","0"
"crazy how 15 years from now it might be ur wedding or ur kids birthday but rn it s just a regular shitty day","0"
"Wedding","0"
"One should neither be late for the wedding nor stay too long at it somali somalia somaliland proverb","0"
"So here s why trickle down economics does not work when you give rich people more money they put it in the stock ma","0"
"Choosing your weddingflowers weddingday","0"
"saysSMILE I just found a new level of respect for for being light hearted about this wedding RHOA","0"
"crazy how 15 years from now it might be ur wedding or ur kids birthday but rn it s just a regular shitty day","0"
"DIY Bride Bag and Wedding Day Essentials Kit","0"
"Big congratulations to my wonderful sister on her wedding Nothing but GoodNews all the way all the days","0"
"crazy how 15 years from now it might be ur wedding or ur kids birthday but rn it s just a regular shitty day","0"
"crazy how 15 years from now it might be ur wedding or ur kids birthday but rn it s just a regular shitty day","0"
"Only 18 04 for Fashion Women s Rose Gold Wedding Band Rings w Code PLAZAR05 giveaway","0"
"crazy how 15 years from now it might be ur wedding or ur kids birthday but rn it s just a regular shitty day","0"
"crazy how 15 years from now it might be ur wedding or ur kids birthday but rn it s just a regular shitty day","0"
"me about to kiss my bride at my wedding some voltron fan bursts into the room yeah real cute f f marriage you got here","0"
"A delda wedding or for Ricky to answer my dms","0"
"I feel like I hold the wedding ceremony in not Japan I wanna make it not formal very casual unlike the one in Japan","0"
"Wedding of the year goes to","0"
"ah sa wedding ni ate bam","0"
"amp face their toughest decision yet which flavour of wedding cake PropertyBrothers","0"
"crazy how 15 years from now it might be ur wedding or ur kids birthday but rn it s just a regular shitty day","0"
"crazy how 15 years from now it might be ur wedding or ur kids birthday but rn it s just a regular shitty day","0"
"weird how 15 years from now it might be ur wedding or ur kids birthday but rn it s just a regular shitty day","0"
"Bella Sale Anniversary Engagement Wedding Ring s Bands fashion jewelry Earth Mined Gemstone Diamond bridetobe groom http","0"
"Visit website for more BANKY W AND TEEBILLZ FALLS OUT AS TEEBILLZ WAS ABSENT IN BANKY S WEDDING BANKY W AND TEEBILL","0"
"crazy how 15 years from now it might be ur wedding or ur kids birthday but rn it s just a regular shitty day","0"
"Only if I can reenact the wedding scene from the office more specifically Dwight s part","0"
"Upcoming wedding Party Occasion This dress is perfect for all events Sexy amp stylish Shop","0"
"weird how 15 years from now it might be ur wedding or ur kids birthday but rn it s just a regular shitty day","0"
"I m tryna go to a wedding so someone pls marry my boy","0"
"I added a video to a playlist Deputy Governor to sponsor mass wedding for 100 widows divorcees","0"
"Aliexpress plus size wedding dresses","0"
"weird how 15 years from now it might be ur wedding or ur kids birthday but rn it s just a regular shitty day","0"
"75 ways to beunforgettable","0"
"alright since everyone s getting engaged and married the least you can do is invite me to the wedding and have an open","0"
"weird how 15 years from now it might be ur wedding or ur kids birthday but rn it s just a regular shitty day","0"
"Wedding dress goals","0"
"Deputy Governor to sponsor mass wedding for 100 widows divorcees via","0"
"OurPerfectWedding When the Photographer had little bit of Nyaope before the wedding SimonDrive","0"
"crazy how 15 years from now it might be ur wedding or ur kids birthday but rn it s just a regular shitty day","0"
"Queen Elizabeth and Prince Philip celebrated their 70th wedding anniversary","0"
"crazy how 15 years from now it might be ur wedding or ur kids birthday but rn it s just a regular shitty day","0"
"Considering that I want a fall wedding but we have a family vacation happening next year and we re planning to move","0"
"Moving to Wisconsin with my boyfriend the main question I get is if we re gonna get married within the next year","0"
"alright since everyone s getting engaged and married the least you can do is invite me to the wedding and have an open","0"
"I swear after my wedding I m chopping all my hair off","0"
"weird how 15 years from now it might be ur wedding or ur kids birthday but rn it s just a regular shitty day","0"
"me about to kiss my bride at my wedding some voltron fan bursts into the room yeah real cute f f marriage you got here","0"
"FC Cricket Italian wedding for India captain Virat Kohli virat kohli ViratKohli ViratKohli","0"
"Wedding of the year goes to","0"
"crazy how 15 years from now it might be ur wedding or ur kids birthday but rn it s just a regular shitty day","0"
"The Rock She wears it with a band If the band were a wedding band it would be worn closest to her heart Now th","0"
"Have you seen yet the lavender bolero wedding shrug handmade bridal by andamasq via","0"
"My husband better be ok with ed sheeran bring our wedding song","0"
"If my future wedding won t be as lit as The9amBanger I don t want it","0"
"Whether it s a wedding introduction ceremony themed banquet or cocktail graduation end of year staff party et al","0"
"I ll cry at my wedding because it s a miracle it s happening honestly","0"
"mullins A lovely Druid Wedding at Stonehenge now on the blog stonehenge weddingphotographer https","0"
"weird how 15 years from now it might be ur wedding or ur kids birthday but rn it s just a regular shitty day","0"
"weird how 15 years from now it might be ur wedding or ur kids birthday but rn it s just a regular shitty day","0"
"crazy how 15 years from now it might be ur wedding or ur kids birthday but rn it s just a regular shitty day","0"
"me about to kiss my bride at my wedding some voltron fan bursts into the room yeah real cute f f marriage you got here","0"
"weird how 15 years from now it might be ur wedding or ur kids birthday but rn it s just a regular shitty day","0"
"Last night instead of a champagne toast after the wedding we did a pedialyte toast","0"
"crazy how 15 years from now it might be ur wedding or ur kids birthday but rn it s just a regular shitty day","0"
"weird how 15 years from now it might be ur wedding or ur kids birthday but rn it s just a regular shitty day","0"
"Thank you so much to everyone who came to the special wedding stream It meant so much to see how many people care","0"
"me about to kiss my bride at my wedding some voltron fan bursts into the room yeah real cute f f marriage you got here","0"
"Louis and his crazy rant was trying to get Molly to say the wedding is off 90dayfiance","0"
"He mines and it s always been that way I ll invite you to the wedding","0"
"Me I m like the chillest girl Also me has my whole wedding planned on Pinterest like the absolutely least chill girl on the planet","0"
"Yes Molly call off the damn wedding 90dayfiance","0"
"Gay Wedding Cakes and the United States Constitution HuffPost","0"
"D amp E performing I guess its Oppa Oppa again ahah it became a wedding anthem xD","0"
"weird how 15 years from now it might be ur wedding or ur kids birthday but rn it s just a regular shitty day","0"
"crazy how 15 years from now it might be ur wedding or ur kids birthday but rn it s just a regular shitty day","0"
"Jacqueline KatrinaKaif khan and react to rumors of Anushka and Virat s wedd","0"
"Photos from the wedding of Wole Soyinka s son Oretunlewa in the US PHOTOS","0"
"Looking for a hairextension company interested in a collab for a wedding shoot next week Please get in touch prr","0"
