"crazy how 15 years from now it might be ur wedding or ur kids birthday but rn it s just a regular shitty day","0"
"Jacqueline KatrinaKaif khan and react to rumors of Anushka and Virat s wedding","0"
"Me at my wedding I do innit but don t get gassed","0"
"Wedding rings Wedding Photography","0"
"Wedding of the year goes to","0"
"crazy how 15 years from now it might be ur wedding or ur kids birthday but rn it s just a regular shitty day","0"
"say goodbye to mom Wedding Photography","0"
"I m going to a wedding next weekend I wonder how much weight I can lose by Saturday","0"
"Open for a surprise most handsome wedding date out there NewProfilePic","0"
"Wedding of the year goes to","0"
"gynocology porn wedding night sex toys","0"
"Wedding of the year goes to","0"
"Just Pinned to Mermaid wedding dresses lace satin tulle fishtail wedding gowns H1054 Stunning v neck lace mermaid","0"
"BankyW amp Adesua Etomi step out in style for the Arabian themed premiere of The Wedding","0"
"hell no this better not be the Red Wedding episode for AMC","0"
"2016 New Arrival Wedding Dresses Special Boat Neck Lace Wedding Gowns Long Sleeves ball go","0"
"RHOA Cast Throws Kenya Moore a Shady Surprise Wedding Before Questioning If Her Marriage Is Real","0"
"weird how 15 years from now it might be ur wedding or ur kids birthday but rn it s just a regular shitty day","0"
"Congrats Natasu on your wedding","0"
"a Bree6 When it comes to a wedding the important things are having an open bar a good dj and a good photog","0"
"BankyW amp Adesua Etomi step out in style for the Arabian themed premiere of The Wedding","0"
"Am i invited to the wedding or nah","0"
"crazy how 15 years from now it might be ur wedding or ur kids birthday but rn it s just a regular shitty day","0"
"HQ VID 171209 dd dasom90 Instagram Update Donghae and Eunhyuk excitedly performing Oppa Oppa at their friend s weddin","0"
"HECK NO GIRL I gotta wedding dress to look good in in 6 months","0"
"Ohtani should crash Trout s wedding DM me for details bro WelcomeToAnaheim","0"
"If my wedding photos don t look like this do I even wanna get married Just kidding But these are actually so","0"
"nokwal jyo l","0"
"John McCain was in Wedding Crashers","0"
"Ok sorry More accurately Indians having wedding in Sri Lanka amp having Hariharan to sing live","0"
"crazy how 15 years from now it might be ur wedding or ur kids birthday but rn it s just a regular shitty day","0"
"Banky W And Wife Adesua Etomi MRS W Looks At The Grand Premiere Of The Wedding Party 2","0"
"Another couple have a crystal and lace theme and everything is from the opshop and there wedding is looking amazing","0"
"BankyW amp Adesua Etomi step out in style for the Arabian themed premiere of The Wedding","0"
"New old for me is new video of jensen singing Crazy love at a wedding s friend with Jason manns in 2007 He was so shy","0"
"The murder at the Red Wedding broke Guest Right a Westerosi tradition of not harming guests once food and drink is sha","0"
"Antique Gold Filled Cufflinks Stick Pin Art Nouveau Etched wedding jewelry groom","0"
"crazy how 15 years from now it might be ur wedding or ur kids birthday but rn it s just a regular shitty day","0"
"Y all I watched my sister make doll clothes on a Barbie sewing machine when she was 6 amp now she s 22 designing and makin","0"
"Wedding of the year goes to","0"
"BankyW amp Adesua Etomi step out in style for the Arabian themed premiere of The Wedding","0"
"Specializing in Memories Let s start planning your wedding dreams today PressPlay","0"
"Wedding of the year goes to","0"
"A wedding y all Really lol these girls crazy RHOA","0"
"Prime Children I understand Don t spend it on a wedding Weddings should be special but not set you back w","0"
"Wedding of the year goes to","0"
"crazy how 15 years from now it might be ur wedding or ur kids birthday but rn it s just a regular shitty day","0"
"Niggas coming to the wedding in jeans and sneakers WHO RAISED YOU","0"
"BankyW amp Adesua Etomi step out in style for the Arabian themed premiere of The Wedding","0"
"Wedding looks","0"
"Sri Lankans having the amazing Hariharan to sing at a wedding function is some next level Explains that he s a family frien","0"
"Matt Lauer and Wife Remove Wedding Rings and Her Dad Says She Plans to Divorce Him E News oh well shit falls","0"
"I ll be the flower girl at your wedding","0"
"whispers into the abyss give kurogane amp fai a wedding","0"
"New old for me is new video of jensen singing Crazy love at a wedding s friend with Jason manns in 2007 He was so shy","0"
"crazy how 15 years from now it might be ur wedding or ur kids birthday but rn it s just a regular shitty day","0"
"171209 guswlsla 92 IG update with Siwon Yesung Hyukjae and Donghae at Jinoo s wedding","0"
"crazy how 15 years from now it might be ur wedding or ur kids birthday but rn it s just a regular shitty day","0"
"Proper wedding invites Photo by","0"
"crazy how 15 years from now it might be ur wedding or ur kids birthday but rn it s just a regular shitty day","0"
"crazy how 15 years from now it might be ur wedding or ur kids birthday but rn it s just a regular shitty day","0"
"Someone marry me so I can have a videographer make a wedding video with this song tysm","0"
"crazy how 15 years from now it might be ur wedding or ur kids birthday but rn it s just a regular shitty day","0"
"New old for me is new video of jensen singing Crazy love at a wedding s friend with Jason manns in 2007 He was so shy","0"
"Every wedding cake I ve ever seen was pretty gay","0"
"crazy how 15 years from now it might be ur wedding or ur kids birthday but rn it s just a regular shitty day","0"
"boho bouquet bridal bouquet wedding bouquet wedding via","0"
"HUHU MISS YOU NA DEN MERRY CHRISTMAS HAPPY NEW YEAR HAPPY VALENTINES HAPPY GRADUATION HAPPY S","0"
"crazy how 15 years from now it might be ur wedding or ur kids birthday but rn it s just a regular shitty day","0"
"It s not a wedding if it s not at Schuetzen Park","0"
"crazy how 15 years from now it might be ur wedding or ur kids birthday but rn it s just a regular shitty day","0"
"crazy how 15 years from now it might be ur wedding or ur kids birthday but rn it s just a regular shitty day","0"
"Mark is ready for the wedding rhoa","0"
"crazy how 15 years from now it might be ur wedding or ur kids birthday but rn it s just a regular shitty day","0"
"branded I honestly can not wait for it Cobbie gonna go big on her wedding","0"
"Just gonna show up married one day cause it s not like I m having a wedding","0"
"Galia Lahav Authentic Custom Wedding Dress Joyce Style Ivory Size 8","0"
"BankyW amp Adesua Etomi step out in style for the Arabian themed premiere of The Wedding","0"
"crazy how 15 years from now it might be ur wedding or ur kids birthday but rn it s just a regular shitty day","0"
"crazy how 15 years from now it might be ur wedding or ur kids birthday but rn it s just a regular shitty day","0"
"crazy how 15 years from now it might be ur wedding or ur kids birthday but rn it s just a regular shitty day","0"
"Weddings Long Sleeve White Lace Wedding Dress A Line Button Sweep Train 2016 Real party d","0"
"I lost my wedding ring in Section 124 at the stadium today if somebody found a silver band ring please let me know","0"
"I don t want y all at my wedding in club attire","0"
"crazy how 15 years from now it might be ur wedding or ur kids birthday but rn it s just a regular shitty day","0"
"This man just asked me to be a flower girl in his wedding boy bye","0"
"Cool pic from our friends wedding a little while back montyhill guitarist band fender","0"
"crazy how 15 years from now it might be ur wedding or ur kids birthday but rn it s just a regular shitty day","0"
"amp won t get married whole wedding cancelled","0"
"crazy how 15 years from now it might be ur wedding or ur kids birthday but rn it s just a regular shitty day","0"
"ICYMI Will SCOTUS say states can force wedding vendors to provide services for gay weddings What I saw at this week s oral","0"
"Pinterest planning my wedding down to the smallest detail like i even got a boo or suh in LOL","0"
"Ok sorry More accurately Indians having wedding in Sri Lanka amp having Hariharan to sing live","0"
"crazy how 15 years from now it might be ur wedding or ur kids birthday but rn it s just a regular shitty day","0"
"crazy how 15 years from now it might be ur wedding or ur kids birthday but rn it s just a regular shitty day","0"
"This couple s Australian wedding was filled with playful creative details and decorations see all their pics","0"
"crazy how 15 years from now it might be ur wedding or ur kids birthday but rn it s just a regular shitty day","0"
"Grind sched for the week 11 Corner Studio 12 D amp D Session 13 Wedding Prep 14 SaGuijo 15 Private Event 16 Private Event","0"
"crazy how 15 years from now it might be ur wedding or ur kids birthday but rn it s just a regular shitty day","0"
"Country music will not step foot near my wedding","0"
"This couple s Australian wedding was filled with playful creative details and decorations see all their pics","0"
"Em wow 9 years might be too long for my wedding","0"
"fc So we are getting to know that Virushka wedding is happening for real What are your thoughts fans a rumour or real Hop","0"
"Live happily ever after with these magical wedding cakes","0"
"Wedding dress idea Featured Dress Milla Nova","0"
"me about to kiss my bride at my wedding some voltron fan bursts into the room yeah real cute f f marriage you got here","0"
"Whatever you call them they re a great choice for your cookie swap","0"
"All About Flower Girls","0"
"crazy how 15 years from now it might be ur wedding or ur kids birthday but rn it s just a regular shitty day","0"
"crazy how 15 years from now it might be ur wedding or ur kids birthday but rn it s just a regular shitty day","0"
"It s mistletoe magnolias and a Christmas wedding in the Kirkpatrick family kindle Free","0"
"Wedding of the year goes to","0"
"hmmm one more novelty in South Indian wedding","0"
"crazy how 15 years from now it might be ur wedding or ur kids birthday but rn it s just a regular shitty day","0"
"RHOA Cast Throws Kenya Moore a Shady Surprise Wedding Before Questioning If Her Marriage Is Real","0"
"Jesus would definitely not have a problem with baking gay people a cake for their wedding In fact Jesus would take","0"
"Wedding of the year goes to","0"
"Paraphrasing from a post I saw today If baking a cake for a gay wedding is endorsing homosexuality then voting for","0"
"Virat stood away from TV and Internet Checks phone 354 messages wow Must be wishes for my wedding Opens inbox","0"
"Thumper The Wedding Band livingsexy","0"
"crazy how 15 years from now it might be ur wedding or ur kids birthday but rn it s just a regular shitty day","0"
"It s not about wedding cake It s about being denied service And how far that could go","0"
"alright since everyone s getting engaged and married the least you can do is invite me to the wedding and have an open","0"
"Gatecrashing Anushka Sharma s wedding starter pack","0"
"My own father didn t attend my wedding so shouldn t feel bad I ELOPED She has FaceTime with my husband","0"
"Why does instagram think I need wedding inspo If it turned on it s mic accessibility and just listened in on my co","0"
"I heard the description their dream barn wedding and I can t stop thinking about it Dream Barn Wedding Hehe n","0"
"me about to kiss my bride at my wedding some voltron fan bursts into the room yeah real cute f f marriage you got here","0"
"Wedding of the year goes to","0"
"a Bree6 In Europe they go cheap on the wedding and the honeymoon then spend the serious money on a house T","0"
"crazy how 15 years from now it might be ur wedding or ur kids birthday but rn it s just a regular shitty day","0"
"New post Bukola Saraki s daughter marries in Society wedding Abuja Photos has been published on Lively Stones","0"
"pretty girls slide in my dms so we can start planning our wedding","0"
"Gabe andMadel played butterfly effect at their wedding legendary","0"
"Happy 68th Wedding Anniversary to my awesome parents and many more","0"
"me about to kiss my bride at my wedding some voltron fan bursts into the room yeah real cute f f marriage you got here","0"
"crazy how 15 years from now it might be ur wedding or ur kids birthday but rn it s just a regular shitty day","0"
"Had the honor of photographing a long time Instagram follower s wedding From the simple support of liking my photo","0"
"Girls Asked I just want need 1 man so Free online SignUp Need1Man DaynightNeed1man","0"
"theGAMEGODDESS im so stubborn i ll fuck around amp catch an attitude on my wedding day","0"
"a happy bride is a Queen subuphotography wedding weddingday weddingfun weddingtime","0"
"I m watching wedding shows how do these ladies not devour their husbands faces If he s expecting a kindergarten peck I m already sorry man","0"
"Different strokes for different folks It s their wedding day if they like it so they like it so","0"
"crazy how 15 years from now it might be ur wedding or ur kids birthday but rn it s just a regular shitty day","0"
"Any wedding with Kandi singing is already asking for a divorce RHOA","0"
"8 10 Picture Frame Collage Set of 2 White Wood Frames Photo Frame for Wedding","0"
"I m here to ruin more wedding photos with my bright hair and my loud crying","0"
"Dusty blue wedding with blue groomsmen Dusty blue bridesmaids and bouquet Invitations by Unica Forma","0"
"The only thing Arabian on my body is the Oud I will use to kill anybody that comes close at this Wedding party movie premiere","0"
"it s weird how 10 years from today it could be ur wedding day or ur kids birthday but rn it s just a regular day","0"
"alright since everyone s getting engaged and married the least you can do is invite me to the wedding and have an open","0"
"crazy how 15 years from now it might be ur wedding or ur kids birthday but rn it s just a regular shitty day","0"
"I m tired of seeing baby showers where the wedding pics at","0"
"amp won t get married whole wedding cancelled","0"
"crazy how 15 years from now it might be ur wedding or ur kids birthday but rn it s just a regular shitty day","0"
"I m a millennial who jsut had a 25 per wedding instead of a huge one so I can pay off my student loans and not inc","0"
"crazy how 15 years from now it might be ur wedding or ur kids birthday but rn it s just a regular shitty day","0"
"The murder at the Red Wedding broke Guest Right a Westerosi tradition of not harming guests once food and drink is sha","0"
"crazy how 15 years from now it might be ur wedding or ur kids birthday but rn it s just a regular shitty day","0"
"weird how 15 years from now it might be ur wedding or ur kids birthday but rn it s just a regular shitty day","0"
"This is the fanciest armor she s got for draecember and I spent an ungodly amount of gold to get it off the BMAH so I gotta","0"
"The murder at the Red Wedding broke Guest Right a Westerosi tradition of not harming guests once food and drink is sha","0"
"ryan is surprising her with a surprise wedding on christmas eve","0"
"The murder at the Red Wedding broke Guest Right a Westerosi tradition of not harming guests once food and drink is sha","0"
"The murder at the Red Wedding broke Guest Right a Westerosi tradition of not harming guests once food and drink is sha","0"
"crazy how 15 years from now it might be ur wedding or ur kids birthday but rn it s just a regular shitty day","0"
"The murder at the Red Wedding broke Guest Right a Westerosi tradition of not harming guests once food and drink is sha","0"
"The murder at the Red Wedding broke Guest Right a Westerosi tradition of not harming guests once food and drink is sha","0"
"The murder at the Red Wedding broke Guest Right a Westerosi tradition of not harming guests once food and drink is sha","0"
"The murder at the Red Wedding broke Guest Right a Westerosi tradition of not harming guests once food and drink is sha","0"
"amp face their toughest decision yet which flavour of wedding cake PropertyBrothers","0"
"crazy how 15 years from now it might be ur wedding or ur kids birthday but rn it s just a regular shitty day","0"
"crazy how 15 years from now it might be ur wedding or ur kids birthday but rn it s just a regular shitty day","0"
"The murder at the Red Wedding broke Guest Right a Westerosi tradition of not harming guests once food and drink is sha","0"
"Everybody right now this wedding is sooo shady Also us RHOA","0"
"The murder at the Red Wedding broke Guest Right a Westerosi tradition of not harming guests once food and drink is sha","0"
"The murder at the Red Wedding broke Guest Right a Westerosi tradition of not harming guests once food and drink is sha","0"
"The murder at the Red Wedding broke Guest Right a Westerosi tradition of not harming guests once food and drink is sha","0"
"The murder at the Red Wedding broke Guest Right a Westerosi tradition of not harming guests once food and drink is sha","0"
"i want my refund for my flight i can t believe i missed my sisters wedding","0"
"Fully prepared to do my best Adam Sandler and be your wedding singer Let s make it happen","0"
"nokwal jyo l","0"
"The murder at the Red Wedding broke Guest Right a Westerosi tradition of not harming guests once food and drink is sha","0"
"I have so much respect for you for showing what real friendship is about Having a family only wed","0"
"The murder at the Red Wedding broke Guest Right a Westerosi tradition of not harming guests once food and drink is sha","0"
"crazy how 15 years from now it might be ur wedding or ur kids birthday but rn it s just a regular shitty day","0"
"one year since the most beautiful wedding i have ever seen troick really is THAT couple i love them so much https","0"
"The murder at the Red Wedding broke Guest Right a Westerosi tradition of not harming guests once food and drink is sha","0"
"THIS Why have a full on wedding for it to be two ppl Bitch take yo ass to the court house","0"
"The murder at the Red Wedding broke Guest Right a Westerosi tradition of not harming guests once food and drink is sha","0"
"Lea Cars Bentley Arnage Wedding car at a Sikh wedding in Newcastle","0"
"crazy how 15 years from now it might be ur wedding or ur kids birthday but rn it s just a regular shitty day","0"
"The murder at the Red Wedding broke Guest Right a Westerosi tradition of not harming guests once food and drink is sha","0"
"The murder at the Red Wedding broke Guest Right a Westerosi tradition of not harming guests once food and drink is sha","0"
"I lost my wedding ring in Section 124 at the stadium today if somebody found a silver band ring please let me know","0"
"The best wedding date Little Gardens","0"
"crazy how 15 years from now it might be ur wedding or ur kids birthday but rn it s just a regular shitty day","0"
"crazy how 15 years from now it might be ur wedding or ur kids birthday but rn it s just a regular shitty day","0"
"org Awesome job tonight Joey Thanks for the laughs the selfies and the congrats on our we","0"
"crazy how 15 years from now it might be ur wedding or ur kids birthday but rn it s just a regular shitty day","0"
"me about to kiss my bride at my wedding some voltron fan bursts into the room yeah real cute f f marriage you got here","0"
"amp won t get married whole wedding cancelled","0"
"Here s some good news from MN With lots of hard work amp support from Shakopee Judge Chris Wilton Jennifer has turned her","0"
"crazy how 15 years from now it might be ur wedding or ur kids birthday but rn it s just a regular shitty day","0"
"Idk about this wedding RHOA","0"
"9 Promotion Ideas For A Wedding Service Business via","0"
"Mom meatloaf I wonder what she s doing RT His scene in Wedding Crashers is one of the greatest things he s ev","0"
"purse handmade Fine jewelry pearl set nigerian wedding african beads gold","0"
"Another big fave caro s wedding in October where we were able to celebrate Jamie and Addison and also have a","0"
"I lost my wedding ring in Section 124 at the stadium today if somebody found a silver band ring please let me know","0"
"Sometimes I forget Tre and I were married 3 days before our actual wedding","0"
"crazy how 15 years from now it might be ur wedding or ur kids birthday but rn it s just a regular shitty day","0"
"So here s why trickle down economics does not work when you give rich people more money they put it in the stock ma","0"
"crazy how 15 years from now it might be ur wedding or ur kids birthday but rn it s just a regular shitty day","0"
"Well yeah if you elope then fine That s the whole point anyway If you have an actual planned and st","0"
"i think i wanna do a location wedding fr and have that hoe real intimate","0"
"one year since the most beautiful wedding i have ever seen troick really is THAT couple i love them so much https","0"
"clancy Philly at its finest pure class as always It s nice hearing your lifestyle but I ll take it you d","0"
"crazy how 15 years from now it might be ur wedding or ur kids birthday but rn it s just a regular shitty day","0"
"crazy how 15 years from now it might be ur wedding or ur kids birthday but rn it s just a regular shitty day","0"
"crazy how 15 years from now it might be ur wedding or ur kids birthday but rn it s just a regular shitty day","0"
"Everybody right now this wedding is sooo shady Also us RHOA","0"
"Gatecrashing Anushka Sharma s wedding starter pack","0"
"I planned on buying dustin his fossil watch for Christmas but instead I got to excited and gave it to him the day o","0"
"I said I wanted some red bottoms for my wedding Lemme start saving now I still ain t breaking my pocket for none though","0"
"KRG I know in the future I don t want an extravagant wedding My husband and I probably wouldn t say shit but to our close family a","0"
"After playing the role of this quirky and intelligent wedding planner Shruti Kakkar She got her recognition I applaud","0"
"alright since everyone s getting engaged and married the least you can do is invite me to the wedding and have an open","0"
"vixx at weddings hakyeon wonshik visibly crying at the vows hongbin says he didn t cry he did a little taekwoon touch","0"
"Congratulation for the newlyweds Congratulation for ur wedding","0"
"crazy how 15 years from now it might be ur wedding or ur kids birthday but rn it s just a regular shitty day","0"
"snows 4 inches alright everyone cancel school put on the 1 long sleeve shirt you own buy the entire grocery store","0"
"NJ love u guys I m bout to be best man at my good friend Doms wedding In the snow Sending love","0"
"This is an Indian wedding bro We do destination weddings","0"
"Michael thinks the hurling was better than his wedding night via","0"
"crazy how 15 years from now it might be ur wedding or ur kids birthday but rn it s just a regular shitty day","0"
"me about to kiss my bride at my wedding some voltron fan bursts into the room yeah real cute f f marriage you got here","0"
"Virat stood away from TV and Internet Checks phone 354 messages wow Must be wishes for my wedding Opens inbox","0"
"me about to kiss my bride at my wedding some voltron fan bursts into the room yeah real cute f f marriage you got here","0"
"Wedding of the year goes to","0"
"Femail Are these the most bizarre wedding photos ever People from around the world","0"
"Want a Better Wedding Get the Weddbook App","0"
"Wedding anniversary 22 dinner tonight blackandwhitephoto anniversary Chops Lobster Bar","0"
"i ve always wanted to plan a wedding let s do it i ll be on my way","0"
"crazy how 15 years from now it might be ur wedding or ur kids birthday but rn it s just a regular shitty day","0"
"I would do anything to have officiate my wedding","0"
"I was more amped for the wedding of Barry Allen and Iris West tbh","0"
"Graduation pregnancy wedding you get over an ashy Nigga I m celebrating man I love the warmth of positivity","0"
"Nah if this nigga actually proposes tho lol I already know that wedding would be one of the best nights ever","0"
"I love how Luis turned their argument into a heated discussion about religion when Molly originally just wanted to discuss h","0"
"Photos Sola Sobowale s gorgeous look to the Arabian themed Wedding party 2 world premiere","0"
"Look at her wedding ring Hubby is drooling for sloppy seconds","0"
"I hope someone tells who the real is b4 their wedding Great meeting you amp go to Galapagos I","0"
"Lol and I know her wedding going to be dope","0"
"I lost my wedding ring in Section 124 at the stadium today if somebody found a silver band ring please let me know","0"
"Still dreaming about and David s beautiful wedding day at Karly s mom s home Weddings","0"
"Me running away from my husband on the wedding day cuz I don t catch feelings sweetie I catch flights","0"
"crazy how 15 years from now it might be ur wedding or ur kids birthday but rn it s just a regular shitty day","0"
"crazy how 15 years from now it might be ur wedding or ur kids birthday but rn it s just a regular shitty day","0"
"vixx at weddings hakyeon wonshik visibly crying at the vows hongbin says he didn t cry he did a little taekwoon touch","0"
"crazy how 15 years from now it might be ur wedding or ur kids birthday but rn it s just a regular shitty day","0"
"crazy how 15 years from now it might be ur wedding or ur kids birthday but rn it s just a regular shitty day","0"
"WEDDING PROPOSALS ALWAYS MAKE ME CRY SO HARD I CANT WAIT TO SEE MY REACTION WHEN I GET ASKED TO BE SOMEONES WIFE","0"
"crazy how 15 years from now it might be ur wedding or ur kids birthday but rn it s just a regular shitty day","0"
"Wedding of the year goes to","0"
"crazy how 15 years from now it might be ur wedding or ur kids birthday but rn it s just a regular shitty day","0"
"I ll cry at my wedding because it s a miracle it s happening honestly","0"
"Something I never noticed in Home Alone Harry has a wedding ring Does his wife know he almost ate a child s fingers","0"
