"Supreme Court wedding cake case asks whether baking is protected speech","0"
"Gay Wedding Cakes and the United States Constitution GAY NEWS GLBT","0"
"weird how 15 years from now it might be ur wedding or ur kids birthday but rn it s just a regular shitty day","0"
"Sri Lankans having the amazing Hariharan to sing at a wedding function is some next level Explains that he s a fam","0"
"We got a similar stunt planned for the wedding","0"
"loose wild wedding flowers styled by Vic Brotherson","0"
"me about to kiss my bride at my wedding some voltron fan bursts into the room yeah real cute f f marriage you got here","0"
"Gotta love it when you grow up with a friend and she asks you to do her makeup for her wedding","0"
"Genuine 2 25ct Diamond Wedding Band Ring 14k Yellow Gold Round G H I1 Prong","0"
"For it was not into my ear you whispered but into my heart It was not my lips you kissed but my soul Judy Garland w","0"
"Accept What Is Let Go of What Was Have Faith in What Will Be wall hanging by gr8byz wedding birt","0"
"I am a Wedding Planner I have successfully planned 8 weddings I work with ones budget big or small I have amazing de","0"
"My own father didn t attend my wedding so shouldn t feel bad I ELOPED She has FaceTime with my husband","0"
"Of course you ve stacked deck w your characterization here Phillips says","0"
"My wife and I aren t gonna have a first dance at the wedding we having the the first Lob I m gonna lower the rim","0"
"One Marwadi and one mallu wedding to attend on the same day Marwadi wedding gets over at 5am while the mallu one s","0"
"Chrissy Lampkin and Jim Jones WEDDING NEWS Couple married according to Media Take Out LHHNY via","0"
"alright since everyone s getting engaged and married the least you can do is invite me to the wedding and have an open","0"
"wedding night porno big wet sexy ass","0"
"Me lol these people are having a LARP wedding And then the bride wanted to have a dance with her original knight","0"
"weird how 15 years from now it might be ur wedding or ur kids birthday but rn it s just a regular shitty day","0"
"I d be super weird if you have an actual wedding and not invite your closest friends I mean what s the point of the wedding then","0"
"Imma have a strict dress code at my wedding because y all be going to weddings dressed like y all going to the club and I cannot","0"
"I know in the future I don t want an extravagant wedding My husband and I probably wouldn t say shit but to our cl","0"
"wish i was going to the game on sunday but will be recuperating from a wedding in Louisia","0"
"With its striking rude perplexity the illustrious no that range on top of a drop business was the city s chief","0"
"Y all I watched my sister make doll clothes on a Barbie sewing machine when she was 6 amp now she s 22 designing and makin","0"
"Mom meatloaf I wonder what she s doing RT His scene in Wedding Crashers is one of the greatest things he s ev","0"
"I ve just been invited to my first same sex marriage My dear friends Antony and Ron have been waiting 37 years you re dam","0"
"Just had a 15 minute conversation with ash while wearing my bridesmaid dress for s wedding normalroomiestuff","0"
"My face when I m told that I have to take finals during wedding week WellsWeddingBells","0"
"crazy how 15 years from now it might be ur wedding or ur kids birthday but rn it s just a regular shitty day","0"
"Look yeah if I get into African wedding youtube I m not coming out for ages","0"
"crazy how 15 years from now it might be ur wedding or ur kids birthday but rn it s just a regular shitty day","0"
"Thanks buddy Tell her hi for me Haha looking forward to seeing you guys at the track When s the wedding","0"
"If I gave out my wedding registry would y all buy us stuff Probably not right","0"
"Modeled after my own Wedding circlet custommade for you epiconetsy cosplay wedding https","0"
"Maybe I just don t want to invite anyone I just want to have a moment and a wedding with just me a","0"
"I m in tears This is so amazing Casey amp Davis The Marlar Wedding via","0"
"I can understand if you make the decision to elope or have a justice of the peace type of wedding By all means cool","0"
"The wedding is back on she just bought me a durag Nigga showed me the durag they really in love","0"
"Had a little to much fun celebrating wedding whoops whydidntanyonetakemydrinks","0"
"Sumeeth and Sangeetha tie the knot in unique manner avoiding even milk products","0"
"crazy how 15 years from now it might be ur wedding or ur kids birthday but rn it s just a regular shitty day","0"
"crazy how 15 years from now it might be ur wedding or ur kids birthday but rn it s just a regular shitty day","0"
"Adam Vinatieri just dropped his wedding ring Colts INDvsBUF","0"
"Making a wedding cake for a same sex couple will get a baker more new business than refusing to make one","0"
"50s 1950s Original Strapless Vixen Cocktail Party Wedding Full Dress XS","0"
"alright since everyone s getting engaged and married the least you can do is invite me to the wedding and have an open","0"
"White Satin Wedding WeddingGarter Set with Red Heart Deco Your via","0"
"amp won t get married whole wedding cancelled","0"
"crazy how 15 years from now it might be ur wedding or ur kids birthday but rn it s just a regular shitty day","0"
"RHOA Cast Throws Kenya Moore a Shady Surprise Wedding Before Questioning If Her Marriage Is Real","0"
"crazy how 15 years from now it might be ur wedding or ur kids birthday but rn it s just a regular shitty day","0"
"wish i was going to the game on sunday but will be recuperating from a wedding in","0"
"crazy how 15 years from now it might be ur wedding or ur kids birthday but rn it s just a regular shitty day","0"
"and it s not that i m proud of that but like I just feel like y all should know because I feel like it s a wedding planning milestone","0"
"one year since the most beautiful wedding i have ever seen troick really is THAT couple i love them so much","0"
"I don t know about Julie but I would make it Then again I m secure in my ideolo","0"
"Y all I watched my sister make doll clothes on a Barbie sewing machine when she was 6 amp now she s 22 designing and makin","0"
"This wedding shit RHOA","0"
"The song that will be played at and my wedding","0"
"amp won t get married whole wedding cancelled","0"
"crazy how 15 years from now it might be ur wedding or ur kids birthday but rn it s just a regular shitty day","0"
"One that lives with his whole family is always the richest in the world Happy wedding day Appa and Amma Thank you","0"
"Gonna be a Spiderman Captain Marvel themed wedding Finally making that head canon a reality","0"
"NJ love u guys I m bout to be best man at my good friend Doms wedding In the snow Sending love","0"
"crazy how 15 years from now it might be ur wedding or ur kids birthday but rn it s just a regular shitty day","0"
"weird how 15 years from now it might be ur wedding or ur kids birthday but rn it s just a regular shitty day","0"
"weird how 15 years from now it might be ur wedding or ur kids birthday but rn it s just a regular shitty day","0"
"You hitched now How was your wedding","0"
"alright since everyone s getting engaged and married the least you can do is invite me to the wedding and have an open","0"
"Checkout this pic taken for a wedding event back on 11 11 2017 Beautiful evening and great beer","0"
"me about to kiss my bride at my wedding some voltron fan bursts into the room yeah real cute f f marriage you got here","0"
"So here s why trickle down economics does not work when you give rich people more money they put it in the stock ma","0"
"crazy how 15 years from now it might be ur wedding or ur kids birthday but rn it s just a regular shitty day","0"
"crazy how 15 years from now it might be ur wedding or ur kids birthday but rn it s just a regular shitty day","0"
"weird how 15 years from now it might be ur wedding or ur kids birthday but rn it s just a regular shitty day","0"
"PuertoVallarta RivieraNayarit DestinationWedding Advantages WeddingPlanning","0"
"me about to kiss my bride at my wedding some voltron fan bursts into the room yeah real cute f f marriage you got here","0"
"Gonna be a Spiderman Captain Marvel themed wedding Finally making that head canon a reality","0"
"Burnt Orange and White Bride WeddingGarter Set with TexasLonghorn via","0"
"Latest indian dresses bridal collections dresses wedding Design amazon shopping online Dresses","0"
"These women are MESSY Did they really think this fake wedding would be a good idea for Kenya Messy Moore I mean","0"
"me about to kiss my bride at my wedding some voltron fan bursts into the room yeah real cute f f marriage you got here","0"
"At yesterday s ChuAna s wedding with Boss Ryan and friends Angelfields","0"
"RT","0"
"Can t wait to come to the wedding","0"
"I am a Wedding Planner I have successfully planned 8 weddings I work with ones budget big or small I have amazing de","0"
"I want a Frasier themed wedding We ll read the same vows that Niles and Daphne use in their wedding I m Daphne in th","0"
"Wedding of the year goes to","0"
"Vinson I m gonna get Buffalo Wild Wings to cater my wedding one day","0"
"crazy how 15 years from now it might be ur wedding or ur kids birthday but rn it s just a regular shitty day","0"
"crazy how 15 years from now it might be ur wedding or ur kids birthday but rn it s just a regular shitty day","0"
"There was more religion talk in the last 5 minutes of 90dayfiance than a whole Duggar wedding","0"
"Y E Oliver And Felicity s Wedding Reception Ends In Betrayal In Arrow s Mid Season Finale Arrow","0"
"Congratulations your wedding is so lovely","0"
"Another couples wedding went horribly wrong they spent 300 on decor and did it themselves but had no dj caterer","0"
"The dress she wore looked like it belonged in a wedding Of course it was lighter and shorter to fit a","0"
"mens complete 5 piece royal blue formal suit tailored fit wedding prom party 106 99 What a","0"
"It melts my heart every time I read it What about you love wedding","0"
"weird how 15 years from now it might be ur wedding or ur kids birthday but rn it s just a regular shitty day","0"
"crazy how 15 years from now it might be ur wedding or ur kids birthday but rn it s just a regular shitty day","0"
"The food and music choices are very important on your big day wedding weddingtips BrideToBe","0"
"I m one more broken heart away from living in an attic in a wedding dress and teaching a little girl to hate all men","0"
"alright since everyone s getting engaged and married the least you can do is invite me to the wedding and have an open","0"
"Yes oooo I couldn t agree less guys you can join us if you stay around ikeja For wedding party 2","0"
"We finally have a concrete wedding date May 18 2019","0"
"crazy how 15 years from now it might be ur wedding or ur kids birthday but rn it s just a regular shitty day","0"
"at my wedding i m gonna walk down the aisle to Heroes by Bowie","0"
"Wedding of the year goes to","0"
"wedding night sex positions free big tit porn sites","0"
"With Amazon s Registries you can add items from Earth s biggest selection get free 90 day returns on most items and manag","0"
"me about to kiss my bride at my wedding some voltron fan bursts into the room yeah real cute f f marriage you got here","0"
"crazy how 15 years from now it might be ur wedding or ur kids birthday but rn it s just a regular shitty day","0"
"Black and Orange WeddingGarter Set with Motorcycle Charms via","0"
"Jacqueline KatrinaKaif khan and react to rumors of Anushka and Virat s wedding","0"
"When I get married I hope there s someone on a horse galloping as fast as they can to stop the wedding arriving too la","0"
"oluwani Someone said Lukaku will miss his own wedding Chai Aye le","0"
"While yogiblair is planning her wedding Invisalign clear aligners are transforming her smile InvisalignSmile https","0"
"Wedding of the year goes to","0"
"For it was not into my ear you whispered but into my heart It was not my lips you kissed but my soul Judy Garland wedding happy love","0"
"me about to kiss my bride at my wedding some voltron fan bursts into the room yeah real cute f f marriage you got here","0"
"crazy how 15 years from now it might be ur wedding or ur kids birthday but rn it s just a regular shitty day","0"
"oluwani Someone said Lukaku will miss his own wedding Chai Aye le","0"
"In the shop a Captain America wedding garter set by Sugarplum Garters","0"
"on tomorrow Someone tell him to donate some LTC to me as a wedding gift before he goes on","0"
"crazy how 15 years from now it might be ur wedding or ur kids birthday but rn it s just a regular shitty day","0"
"crazy how 15 years from now it might be ur wedding or ur kids birthday but rn it s just a regular shitty day","0"
"JD let s start planning these wedding festivities","0"
"crazy how 15 years from now it might be ur wedding or ur kids birthday but rn it s just a regular shitty day","0"
"crazy how 15 years from now it might be ur wedding or ur kids birthday but rn it s just a regular shitty day","0"
"crazy how 15 years from now it might be ur wedding or ur kids birthday but rn it s just a regular shitty day","0"
"Not fair wedding outside","0"
"Anyone know when the Supreme Court gay wedding cake verdict is coming out","0"
"s Wedding","0"
"Everybody right now this wedding is sooo shady Also us RHOA","0"
"There s a video of Mike Leach commenting on the woes of wedding planning and now I can t get mad at my fianc whil","0"
"Muskie fishing is like the pasta machine I got as a wedding present It comes out","0"
"I doubt it though She wants that wedding","0"
"Anushka s gonna kill me The cutest reactions to Virushka s wedding by far Jacqueline","0"
"Eunhae wedding video Flight to Malibu Happy dance after wedding ceremony Morning after wedding night","0"
"I liked a video DIY Enchanted Rose Decoration Wedding Photos Arty Advent Day 10","0"
"I m so glad my brother is providing a taxi for us to the wedding cuz tbh again the thought of trying to get one ou","0"
"I lost my wedding ring in Section 124 at the stadium today if somebody found a silver band ring please let me know","0"
"Can t get married cause then my wedding board on Pinterest will be useless","0"
"Fashion Engagement Ring Wedding Band Set 18KGP CZ Rhinestone Crystal Size 5 5 10 Check Price on eBay gt","0"
"ourownhistory I hated Philip back then he was the worst Shawn had every right to crash that wedding","0"
"Wedding of the year goes to","0"
"Any wedding with Kandi singing is already asking for a divorce RHOA","0"
"Watch out world Morgan is planning my wedding","0"
"crazy how 15 years from now it might be ur wedding or ur kids birthday but rn it s just a regular shitty day","0"
"I ve just been invited to my first same sex marriage My dear friends Antony and Ron have been waiting 37 years you re dam","0"
"crazy how 15 years from now it might be ur wedding or ur kids birthday but rn it s just a regular shitty day","0"
"me about to kiss my bride at my wedding some voltron fan bursts into the room yeah real cute f f marriage you got here","0"
"The music at The ACC for games is like a bad wedding DJ TMLtalk LeafsNation","0"
"Wedding of the year goes to","0"
"crazy how 15 years from now it might be ur wedding or ur kids birthday but rn it s just a regular shitty day","0"
"crazy how 15 years from now it might be ur wedding or ur kids birthday but rn it s just a regular shitty day","0"
"Plan amp order your wedding in 30 min I d love to send you an update","0"
"crazy how 15 years from now it might be ur wedding or ur kids birthday but rn it s just a regular shitty day","0"
"Anushka All wedding preps are done I m so excited Kohli Score dekh yaar","0"
"s Wedding","0"
"Wedding of the year goes to","0"
"Romantic Recipes To Celebrate A Wedding Anniversary I would love Lobster Tails Recipe With","0"
"Dinner at my future wedding location","0"
"crazy how 15 years from now it might be ur wedding or ur kids birthday but rn it s just a regular shitty day","0"
"Romantic Recipes To Celebrate A Wedding Anniversary I would love Lobster Tails Recipe With","0"
"New post on Tuneupnaija VIDEO Checkout Nigerian Celebrities Outfits to The Wedding Party Premiere","0"
"Romantic Recipes To Celebrate A Wedding Anniversary I would love Lobster Tails Recipe With","0"
"Romantic Recipes To Celebrate A Wedding Anniversary I would love Lobster Tails Recipe With","0"
"me about to kiss my bride at my wedding some voltron fan bursts into the room yeah real cute f f marriage you got here","0"
"Live happily ever after with these magical wedding cakes","0"
"crazy how 15 years from now it might be ur wedding or ur kids birthday but rn it s just a regular shitty day","0"
"If chief keef doesn t perform at my wedding then i don t want to get married","0"
"Hand Crocheted Almond Colored Shawl Stole Wrap Organic Cotton Shawl Scarf Bridal Wedding CR1044 VLL Designs","0"
"ourownhistory I hated Philip back then he was the worst Shawn had every right to crash that wedding","0"
"felicity smoak is staying felicity smoak no hyphenation he s gonna send us some script pages from 6 09 that were cut from","0"
"Substitute wedding date since Madison didn t wanna","0"
"Omotola Jalade s Look At The Grand Premiere Of The Wedding Party 2 WeddingPartyMovie2 TWP2","0"
"My grandparents are gonna have a horse and carriage for their wedding shauuu so excited","0"
"Selena and Justin at Selena friend Shannon Larossi s beach side wedding ceremony December 8 2011","0"
"Check out this glam bridesmaid from our past wedding at the She is absolutely","0"
"I m ALL for a good piss take Hell yesterday my mate slayed me in his wedding speech Hilarious fun But bullying","0"
"crazy how 15 years from now it might be ur wedding or ur kids birthday but rn it s just a regular shitty day","0"
"me about to kiss my bride at my wedding some voltron fan bursts into the room yeah real cute f f marriage you got here","0"
"alright since everyone s getting engaged and married the least you can do is invite me to the wedding and have an open","0"
"Wedding is now cancelled","0"
"me about to kiss my bride at my wedding some voltron fan bursts into the room yeah real cute f f marriage you got here","0"
"Red Satin Bride Wedding Garter Set with Checkered Flag Deco via","0"
"Turn Left The wedding of the century","0"
"Hey you know how ive been saying we needa renewZNation for that sketchy skeezy wedding episode Like sprinkle that","0"
"Photos From Actor Daniel K Daniel s Wedding via","0"
"i hope my future husband is cool w us going on the show Four Weddings bc i m finna show the other brides how it s done My wed","0"
"Antique Gold Filled Cufflinks Stick Pin Art Nouveau Etched wedding jewelry groom","0"
"Is it too early to decide that I want this to be the first dance at my wedding","0"
"So here s why trickle down economics does not work when you give rich people more money they put it in the stock ma","0"
"I lost my wedding ring in Section 124 at the stadium today if somebody found a silver band ring please let me know","0"
"This better not be a red wedding episode TheWalkingDead","0"
"I liked a video DIY Enchanted Rose Decoration Wedding Photos Arty Advent Day 10","0"
"new goal have my wedding be more turnt than and I Duh s it might be hard to top","0"
"weird how 15 years from now it might be ur wedding or ur kids birthday but rn it s just a regular shitty day","0"
"crazy how 15 years from now it might be ur wedding or ur kids birthday but rn it s just a regular shitty day","0"
"NJ love u guys I m bout to be best man at my good friend Doms wedding In the snow Sending love","0"
"crazy how 15 years from now it might be ur wedding or ur kids birthday but rn it s just a regular shitty day","0"
"Wedding of the year goes to","0"
"Omotola Jalade s Look At The Grand Premiere Of The Wedding Party 2","0"
"Fully prepared to do my best Adam Sandler and be your wedding singer Let s make it happen","0"
"crazy how 15 years from now it might be ur wedding or ur kids birthday but rn it s just a regular shitty day","0"
"RHOA Cast Throws Kenya Moore a Shady Surprise Wedding Before Questioning If Her Marriage Is","0"
"My bf surprised me with a promise ring as an early Christmas present My dream ring He also wrote me a letter that said","0"
"AuroraRain IU leaving the concert she gave SSC the best wedding gift by inviting them to her concert I still remember when Kyo co","0"
"crazy how 15 years from now it might be ur wedding or ur kids birthday but rn it s just a regular shitty day","0"
"me about to kiss my bride at my wedding some voltron fan bursts into the room yeah real cute f f marriage you got here","0"
"I ll cry at my wedding because it s a miracle it s happening honestly","0"
"Pre Raphaelite Necklace Waterhouse Art Painting Wedding Valentin Queen PeachGoldOrangeAb","0"
"With Shantanubhai and deepeshtanwer ex director and director Harley chapter at wedding in jodhpur","0"
"Ben and Michael Win Australia s First Legal Gay Wedding Competition via Eik n FirstGayW","0"
"Mark is ready for the wedding rhoa","0"
"Don t Miss 9 49 for Rose Gold Plated Rings w Single Crystal w Code VTQEOE5V giveaway","0"
"Wait a minute soooo u consider amp half friends because didn t go","0"
"So here s why trickle down economics does not work when you give rich people more money they put it in the stock ma","0"
"I ve just been invited to my first same sex marriage My dear friends Antony and Ron have been waiting 37 years you re dam","0"
"Virat Anushka to tie knot at a resort in Tuscany","0"
"W88 He s not a pig This is all her She is the grown person with kids He is a kid himself with no life ex","0"
"WHO GIVES A FUCK ABOUT WEDDING HUSBAND THAT S HER FUCKING BIZNESS THEY ALWAYS MAKING SHIT MESSY WH","0"
"Selena and Justin at Selena friend Shannon Larossi s beach side wedding ceremony December 8 2011","0"
"I ll cry at my wedding because it s a miracle it s happening honestly","0"
"Bride amp Prejudice wedding scene is everything","0"
"Jackie keeps denying my playlists for her wedding","0"
"crazy how 15 years from now it might be ur wedding or ur kids birthday but rn it s just a regular shitty day","0"
"crazy how 15 years from now it might be ur wedding or ur kids birthday but rn it s just a regular shitty day","0"
"Fany and Tim sang a song at Baek Dobin and Jung Si a s Wedding","0"
"crazy how 15 years from now it might be ur wedding or ur kids birthday but rn it s just a regular shitty day","0"
"Antique Gold Filled Cufflinks Stick Pin Art Nouveau Etched wedding jewelry groom","0"
"crazy how 15 years from now it might be ur wedding or ur kids birthday but rn it s just a regular shitty day","0"
"my mom keeps asking me who i m bringing to my cousin s wedding in June soooo taking applications for a wedding date","0"
"Jennie Garth goes casual for coffe without wedding ring","0"
"douglas The Wedding Present film kickstarter looks good weddingpresent","0"
"THE WEDDING PARTY 2 MOVIE PREMIERE RED CARPET MOMENTS ADESUA SHAKES BUTT via","0"
"Selena and Justin at Selena friend Shannon Larossi s beach side wedding ceremony December 8 2011","0"
"Virat stood away from TV and Internet Checks phone 354 messages wow Must be wishes for my wedding Opens inbox","0"
"crazy how 15 years from now it might be ur wedding or ur kids birthday but rn it s just a regular shitty day","0"
"alright since everyone s getting engaged and married the least you can do is invite me to the wedding and have an open","0"
"I ll cry at my wedding because it s a miracle it s happening honestly","0"
"I m in love with this story about s wedding P S Congrats Javier","0"
"Now that you have pointed it out I think Eve gave Adam a wedding cake to eat not apple","0"
"Wedding Confetti eggs 1 2 doz Cascarones Etsy fun weddingdecoration bridalshower partyfavor e","0"
"We only knew the song When the battle s over NOT GOOD FOR A WEDDING We got very busy learning new material Were known","0"
"weird how 15 years from now it might be ur wedding or ur kids birthday but rn it s just a regular shitty day","0"
"crazy how 15 years from now it might be ur wedding or ur kids birthday but rn it s just a regular shitty day","0"
"and Lucy Personalized Bride Groom Wedding Hanger Set via wedding weddinggift bridegift bride","0"
"tWitch 4Years This is the first of a few photos I ll be sharing from our wedding which happened 4","0"
"me about to kiss my bride at my wedding some voltron fan bursts into the room yeah real cute f f marriage you got here","0"
"amp won t get married whole wedding cancelled","0"
"For the month of December wedding gown Dress SALE 299","0"
"You re all invited to the wedding","0"
"My next wedding planner No doubt","0"
"dang guys tomorrow i m getting my haircut for my WEDDING","0"
"Magnus reaction to seeing Alex in the wedding dress is still one of my favorite FierroChase moments","0"
"Beverage Insulator Sequin PocketHuggie via wedding brides theknot bachelorette bridesmai","0"
"Wedding of the year goes to","0"
"Planning the future talks Other people I can t wait to get married It s always been a dream of mine I ve a","0"
"I want a Frasier themed wedding We ll read the same vows that Niles and Daphne use in their wedding I m Daphne in this scenario","0"
"You re gonna have a wedding shower and get all of the gifts","0"
"There was more religion talk in the last 5 minutes of 90dayfiance than a whole Duggar wedding","0"
"Glitter Blue Snowflakes winter wedding invitation weddings bridal eventprofs","0"
"Mom meatloaf I wonder what she s doing RT His scene in Wedding Crashers is one of the greatest things he","0"
"There is no way they thought this wedding was a good idea RHOA","0"
"Emmerdale producer IainMcLeod has told Press amp Media in the past that AaronDingle amp RobertSugden would come t","0"
"Me at my wedding I do innit but don t get gassed","0"
"Anyone know when the Supreme Court gay wedding cake verdict is coming out","0"
