"The Dixie Cups Chapel Of Love Hey I mentioned this on my FB page for Prince Harry and Meghan Markle upcoming wed","0"
"me about to kiss my bride at my wedding some voltron fan bursts into the room yeah real cute f f marriage you got here","0"
"My wedding day","0"
"At the wedding","0"
"weird how 15 years from now it might be ur wedding or ur kids birthday but rn it s just a regular shitty day","0"
"me about to kiss my bride at my wedding some voltron fan bursts into the room yeah real cute f f marriage you got here","0"
"crazy how 15 years from now it might be ur wedding or ur kids birthday but rn it s just a regular shitty day","0"
"Happy wedding for and I m sorry I can t attended your wedding party because of my schedule He","0"
"crazy how 15 years from now it might be ur wedding or ur kids birthday but rn it s just a regular shitty day","0"
"Kenya probably just wanted to keep her wedding low key she s probably planning a bigger wedding RHOA","0"
"He mines and it s always been that way I ll invite you to the wedding","0"
"weird how 15 years from now it might be ur wedding or ur kids birthday but rn it s just a regular shitty day","0"
"alright since everyone s getting engaged and married the least you can do is invite me to the wedding and have an open","0"
"crazy how 15 years from now it might be ur wedding or ur kids birthday but rn it s just a regular shitty day","0"
"Any wedding with Kandi singing is already asking for a divorce RHOA","0"
"Can a garland turn a wedding on its head LookBeforeYouLeave","0"
"So here s why trickle down economics does not work when you give rich people more money they put it in the stock ma","0"
"Virat and Anushka are getting married at countryside The wedding is going to be so beautiful OMG","0"
"I ll cry at my wedding because it s a miracle it s happening honestly","0"
"3 months ago today I got married I m in LA while is in Berlin and I m missing her SSSOOOO I decided to","0"
"Wedding of the year goes to","0"
"So here s why trickle down economics does not work when you give rich people more money they put it in the stock ma","0"
"Everybody right now this wedding is sooo shady Also us RHOA","0"
"crazy how 15 years from now it might be ur wedding or ur kids birthday but rn it s just a regular shitty day","0"
"My own father didn t attend my wedding so shouldn t feel bad I ELOPED She has FaceTime with my husband","0"
"Wedding of the year goes to","0"
"Friends at a friend s wedding It was magical","0"
"Wedding of the year goes to","0"
"Passed out for a good two hours after the wedding","0"
"crazy how 15 years from now it might be ur wedding or ur kids birthday but rn it s just a regular shitty day","0"
"Best friend wedding celebrations","0"
"weird how 15 years from now it might be ur wedding or ur kids birthday but rn it s just a regular shitty day","0"
"Only if I can reenact the wedding scene from the office more specifically Dwight s part","0"
"If You Fear Having a Panic Attack From Smoking Weed Read This Before Lighting Up weddings wedding bride","0"
"alright since everyone s getting engaged and married the least you can do is invite me to the wedding and have an open","0"
"crazy how 15 years from now it might be ur wedding or ur kids birthday but rn it s just a regular shitty day","0"
"Women Short floral Robe Dressing Gown Bridal Wedding Bride Bridesmaid Kimono New weddings wedding bride","0"
"weird how 15 years from now it might be ur wedding or ur kids birthday but rn it s just a regular shitty day","0"
"Women Silk Stain long Wedding Bride Bridesmaid Robe Floral Bathrobe Kimono2018 weddings wedding bride","0"
"My wife who has a major puke phobia has only puked in front of me once on our wedding night after","0"
"IM Black Hen Party Night Do Sash Birthday Sashes accessories Gift Bride Mirable weddings wedding bride","0"
"I just uploaded Gabrielle amp Ray s Wedding w DJ Taso Adelphia 12 09 17 to Vimeo","0"
"weird how 15 years from now it might be ur wedding or ur kids birthday but rn it s just a regular shitty day","0"
"Women Lady High Quality Long Peacock Bride Kimono Robe satin Night dress Gown 72 weddings wedding bride","0"
"15 Keto Approved Appetizers You ll Love Having in Your Rotation weddings wedding bride","0"
"crazy how 15 years from now it might be ur wedding or ur kids birthday but rn it s just a regular shitty day","0"
"2016 Elegant wedding dress white wedding dress sweetheart wedding dress long bridal","0"
"These Are the Most Common STIs and Exactly When You Should Get Screened For Them weddings wedding bride","0"
"weird how 15 years from now it might be ur wedding or ur kids birthday but rn it s just a regular shitty day","0"
"Wedding of the year goes to","0"
"This 4 Week Challenge Will Help You Finally Conquer Push Ups weddings wedding bride","0"
"Step Aside Squats This Move Will Lift Your Butt to New Heights weddings wedding bride","0"
"Use Greenery Wreaths in Your Wedding Decor weddings wedding bride","0"
"hi all i m a 20 year old portrait amp wedding photographer located in seattle WA a future client could be on your tl amp a s","0"
"me about to kiss my bride at my wedding some voltron fan bursts into the room yeah real cute f f marriage you got here","0"
"me about to kiss my bride at my wedding some voltron fan bursts into the room yeah real cute f f marriage you got here","0"
"Wedding of the year goes to","0"
"crazy how 15 years from now it might be ur wedding or ur kids birthday but rn it s just a regular shitty day","0"
"Louis and his crazy rant was trying to get Molly to say the wedding is off 90dayfiance","0"
"22 Winter Wedding Color Palettes That Aren t Just Red and Green","0"
"This is not an apt analogy you raging morons A Jewish baker would refuse to put a swastika on ANY FUCKING CAKE because","0"
"Aditi Rao Hydari Vogue Wedding 2017","0"
"alright since everyone s getting engaged and married the least you can do is invite me to the wedding and have an open","0"
"crazy how 15 years from now it might be ur wedding or ur kids birthday but rn it s just a regular shitty day","0"
"crazy how 15 years from now it might be ur wedding or ur kids birthday but rn it s just a regular shitty day","0"
"Name Bar Necklace Stamped Swivel Bar Necklace Custom Hand via","0"
"weird how 15 years from now it might be ur wedding or ur kids birthday but rn it s just a regular shitty day","0"
"weird how 15 years from now it might be ur wedding or ur kids birthday but rn it s just a regular shitty day","0"
"alright since everyone s getting engaged and married the least you can do is invite me to the wedding and have an open","0"
"My bf surprised me with a promise ring as an early Christmas present My dream ring He also wrote me a letter that said","0"
"Wedding of the year goes to","0"
"Have you chosen a wedding venue","0"
"me about to kiss my bride at my wedding some voltron fan bursts into the room yeah real cute f f marriage you got here","0"
"THIS WEDDING IS STRESSING ME OUT","0"
"He s straight up using her Talks abt God when she wants 2 cancel wedding Ship him back ASAP","0"
"crazy how 15 years from now it might be ur wedding or ur kids birthday but rn it s just a regular shitty day","0"
"Don t worry tyler we ll have an open bar lmaoo I would bail on my own wedding if we didn t","0"
"crazy how 15 years from now it might be ur wedding or ur kids birthday but rn it s just a regular shitty day","0"
"It seems I will be attending to the wedding I need a dress","0"
"New old for me is new video of jensen singing Crazy love at a wedding s friend with Jason manns in 2007 He was so shy","0"
"Our wedding is planned","0"
"Wedding of the year goes to","0"
"crazy how 15 years from now it might be ur wedding or ur kids birthday but rn it s just a regular shitty day","0"
"crazy how 15 years from now it might be ur wedding or ur kids birthday but rn it s just a regular shitty day","0"
"weird how 15 years from now it might be ur wedding or ur kids birthday but rn it s just a regular shitty day","0"
"weird how 15 years from now it might be ur wedding or ur kids birthday but rn it s just a regular shitty day","0"
"And you re a jerk if you think it s okay to not invite parents and best friends to you re wedding","0"
"crazy how 15 years from now it might be ur wedding or ur kids birthday but rn it s just a regular shitty day","0"
"oh yes It will be grand Extremely lavish My wedding dress is black with lots of lace It s fitt","0"
"Sassy and a little bad assy Had so much fun at a family wedding and loved this day to","0"
"My own father didn t attend my wedding so shouldn t feel bad I ELOPED She has FaceTime with my husband","0"
"Jones Wedding rehearsal","0"
"Rustic Monogram Hanger 15 Off Sale LAST DAY 12 10 etsychaching epiconetsy craftshout rustic","0"
"weird how 15 years from now it might be ur wedding or ur kids birthday but rn it s just a regular shitty day","0"
"Wedding of the year goes to","0"
"crazy how 15 years from now it might be ur wedding or ur kids birthday but rn it s just a regular shitty day","0"
"The Wedding Dance in the open air bruegel fineart","0"
"OMG Stop the presses Trump invited Clinton to his wedding And Trump gave to the Clinton campaign And Trump gave t","0"
"crazy how 15 years from now it might be ur wedding or ur kids birthday but rn it s just a regular shitty day","0"
"I need an au where pcy and bbh are getting married and their seven best men kjd loses the rings kjm is trying to stay","0"
"When you don t see your friend that claims to know Banky and Susu in their wedding pictures How it be","0"
"bluestarmom Handcrafted 7ct Yellow Blue Sapphire 75ct Halo Pave Diamond Wedding fashion Ring Band 18k Gold","0"
"Great Gatsby Inspired Back Necklace Wedding Back Drop necklace jewelry art deco crystal","0"
"Honestly tho Molly canceling the wedding is long overdue As soon as Luis started talking about my kids he would ve been gone 90dayfiance","0"
"13 3 for Titanium Steel Cubic Zirconia Couple Engagement Wedding Rings w Code giveaway","0"
"n101 Yes too much no privacy amp this location must have bowled them over destination wedd","0"
"crazy how 15 years from now it might be ur wedding or ur kids birthday but rn it s just a regular shitty day","0"
"5 00 ct Ladies Round Cut Diamond Eternity Wedding Band Ring New Design Platinum","0"
"Y all I have a wedding to plan","0"
"I lost my wedding ring in Section 124 at the stadium today if somebody found a silver band ring please let me know","0"
"crazy how 15 years from now it might be ur wedding or ur kids birthday but rn it s just a regular shitty day","0"
"weird how 15 years from now it might be ur wedding or ur kids birthday but rn it s just a regular shitty day","0"
"Wedding of the year goes to","0"
"It s a great time in life We will help create a beautiful wedding suite Free Sample","0"
"me about to kiss my bride at my wedding some voltron fan bursts into the room yeah real cute f f marriage you got here","0"
"The wedding stress is getting real two more months","0"
"alright since everyone s getting engaged and married the least you can do is invite me to the wedding and have an open","0"
"When are we going to see someone truly cancel the wedding on this show 90DayFiance","0"
"at my christian bakeshop when a serial killer who was let off on a technicality walks in ME oh my god its u SERIAL K","0"
"Louis and his crazy rant was trying to get Molly to say the wedding is off 90dayfiance","0"
"I died laughing tonight the wedding was to funny","0"
"weird how 15 years from now it might be ur wedding or ur kids birthday but rn it s just a regular shitty day","0"
"crazy how 15 years from now it might be ur wedding or ur kids birthday but rn it s just a regular shitty day","0"
"Accept What Is Let Go of What Was Have Faith in What Will Be wall hanging by gr8byz","0"
"crazy how 15 years from now it might be ur wedding or ur kids birthday but rn it s just a regular shitty day","0"
"crazy how 15 years from now it might be ur wedding or ur kids birthday but rn it s just a regular shitty day","0"
"Justice questions baker in gay wedding cake case","0"
"It s not a wedding if it s not at Schuetzen Park","0"
"LOOK AT BARRY S WEDDING RING TheFlash","0"
"crazy how 15 years from now it might be ur wedding or ur kids birthday but rn it s just a regular shitty day","0"
"weird how 15 years from now it might be ur wedding or ur kids birthday but rn it s just a regular shitty day","0"
"Y all weddings be so beautiful but me I want me a small wedding outside or either on a rooftop setting something classy but small","0"
"Hawaiian Weddings amp Photo Tours Whether you re looking for a romantic amp intimate wedding on the beach or a beautif","0"
"I ll cry at my wedding because it s a miracle it s happening honestly","0"
"crazy how 15 years from now it might be ur wedding or ur kids birthday but rn it s just a regular shitty day","0"
"crazy how 15 years from now it might be ur wedding or ur kids birthday but rn it s just a regular shitty day","0"
"alright since everyone s getting engaged and married the least you can do is invite me to the wedding and have an open","0"
"Sushant Singh Rajput reacts to rumors of Virat and Anushka s wedding Virushka","0"
"crazy how 15 years from now it might be ur wedding or ur kids birthday but rn it s just a regular shitty day","0"
"Wedding in Santorini Gem via with Marryme in Greece","0"
"ohh my god they all sang happy summer wedding not just 4th gen im","0"
"My sister asked me what I want for Christmas and I said a plus 1 for her wedding hahahahahaha","0"
"wise Listen I would be HURT Esp after that we eloped lie when this was clearly a destination wedding I do","0"
"weird how 15 years from now it might be ur wedding or ur kids birthday but rn it s just a regular shitty day","0"
"crazy how 15 years from now it might be ur wedding or ur kids birthday but rn it s just a regular shitty day","0"
"Kylil is not meeting anybody else until my wedding day so serious","0"
"At the wedding","0"
"crazy how 15 years from now it might be ur wedding or ur kids birthday but rn it s just a regular shitty day","0"
"I just want my man to think Angel by Shaggy is a good wedding dance song","0"
"I added a video to a playlist Chrissy Lampkin and Jim Jones WEDDING NEWS Couple married according to","0"
"Cancel that wedding girl 90DayFiance","0"
"It s 7pm I m falling asleep sitting up at the kitchen table while Megan attempts to show me wedding cakes Adult","0"
"If Cynthia is truly a great friend why didn t she get an invite to your wedding Your friendship is one sided","0"
"I ll cry at my wedding because it s a miracle it s happening honestly","0"
"yoonseok s always have to make your wedding books very well made","0"
"Featuring them one of my concerts led to an invitation to sing at a wedding We three were excited BUT only kne","0"
"Watching Australia s cheapest weddings and this couple that live on Norfolk Island only paid 90 for the hall every","0"
"crazy how 15 years from now it might be ur wedding or ur kids birthday but rn it s just a regular shitty day","0"
"So here s why trickle down economics does not work when you give rich people more money they put it in the stock ma","0"
"me about to kiss my bride at my wedding some voltron fan bursts into the room yeah real cute f f marriage you got here","0"
"Anything Tesla We played Firehouses Love of a lifetime as our first dance at our wedding 21 years ago","0"
"Carter Ive seen 4 engagement announcements and 2 sets of wedding pictures today The wedding fever is UNREAL","0"
"weird how 15 years from now it might be ur wedding or ur kids birthday but rn it s just a regular shitty day","0"
"It s okay Molly at least you woke up before the wedding 90DayFiance","0"
"crazy how 15 years from now it might be ur wedding or ur kids birthday but rn it s just a regular shitty day","0"
"Our dating anniversary was 5 days from Eddie s bday amp I always had to get him two gifts and now we have Christmas","0"
"crazy how 15 years from now it might be ur wedding or ur kids birthday but rn it s just a regular shitty day","0"
"Oh shit the wedding is happening on the The Last Jedi review","0"
"Prince Harry Officially a daddy in waiting How exciting This is going to be the royal wedding of the century","0"
"Welo Opal Eternity Ring or Wedding Band NorthCoastCottage handmade jewelry ph htt","0"
"hussain Hmm having a simple wedding is a sunnah Having one in Mecca is beautiful act of intention to","0"
"weird how 15 years from now it might be ur wedding or ur kids birthday but rn it s just a regular shitty day","0"
"Luis okay family No wedding Luis jumping enjoy 90dayfiance","0"
"me about to kiss my bride at my wedding some voltron fan bursts into the room yeah real cute f f marriage you got here","0"
"crazy how 15 years from now it might be ur wedding or ur kids birthday but rn it s just a regular shitty day","0"
"High Quality mikado v neck ball gown Perfect for mother of bride evening party wedding Homecoming prom or any","0"
"Cancel that wedding girl 90DayFiance","0"
"GroomSocks Father of the Bride Wedding Socks Special Socks For A GroomSocks SpecialWalk","0"
"My own father didn t attend my wedding so shouldn t feel bad I ELOPED She has FaceTime with my husband","0"
"Went to a wedding yesterday of couple that s only known each other for 5 months and his surprise wedding gift to her was a hous","0"
"me about to kiss my bride at my wedding some voltron fan bursts into the room yeah real cute f f marriage you got here","0"
"Man Adrian i dont know what to say I have to go to a wedding and i dont even want to go Worst thing","0"
"His Hers Wedding Engagement Ring Sets Black Stainless Steel Titanium 4 Pc LX Item","0"
"weird how 15 years from now it might be ur wedding or ur kids birthday but rn it s just a regular shitty day","0"
"weird how 15 years from now it might be ur wedding or ur kids birthday but rn it s just a regular shitty day","0"
"crazy how 15 years from now it might be ur wedding or ur kids birthday but rn it s just a regular shitty day","0"
"crazy how 15 years from now it might be ur wedding or ur kids birthday but rn it s just a regular shitty day","0"
"I went to my ex s wedding had a ball","0"
"Actually there s two eps left I m at like the wedding itself pretty much","0"
"me about to kiss my bride at my wedding some voltron fan bursts into the room yeah real cute f f marriage you got here","0"
"crazy how 15 years from now it might be ur wedding or ur kids birthday but rn it s just a regular shitty day","0"
"me about to kiss my bride at my wedding some voltron fan bursts into the room yeah real cute f f marriage you got here","0"
"amp won t get married whole wedding cancelled","0"
"yoonseok s always have to make your wedding books very well made","0"
"Art Deco Wedding Band Women Art Deco Rings Sterling Silver via","0"
"me about to kiss my bride at my wedding some voltron fan bursts into the room yeah real cute f f marriage you got here","0"
"Laird1 Dastyari affair is not a good look But neither is the Adani wedding scandal We need a federal ICAC to sort this mess","0"
"crazy how 15 years from now it might be ur wedding or ur kids birthday but rn it s just a regular shitty day","0"
